,title,brand,price,rating,reviewCount,description,categories
0,"SINOWAY Portable Foldable Desk Table Air Fan with Built-in Battery Operated, USB Rechargeable Small Compact Multifunction Table Fan with LED Light (White)",,539,3.0,3,111,Kitchen-And-Home-Appliances
1,"MICROTEK Legend UPS 650, Black, Medium",,"2,400",3.8,340,"Capacity: 650VA/360W Boost and Buck AVR-For Voltage Stabilization Overload, Discharge/Overcharge Protections Auto Restart while AC is recovering",Kitchen-And-Home-Appliances
2,Wipro North West Polycarbonate Fan Regulator 5+1 Position Step Type (White),,623,3.6,4,"Wipro north west offers a expansive range of products to cater to different spaces. With usps of sleek design, premium finish yet affordability this range of products have analysed all the common user requirements and translated them as distinctive features to offer more benefits and added value to its users.",Kitchen-And-Home-Appliances
3,"Pressure Washer Hose Pipe 2 X 8 Meter Upto 2150 PSI Heavy Duty Black Molded Pipe with M22 Adaptor Compatible with JPT, STARQ, REQTECH Pressure Washer (2x8 Meter)",,"2,199",No reviews,,"Scuff and mark resistant construction with bend restrictors for prolonged service life, Weather, and abrasion-resistant. The best replacement pressure washer hose for an enthusiast or professional use to wash Car, Motorcycle, Floors, Windows, Driveways, Roofs, Siding, and so on. 100% process inspection before shipping. If there is any quality problem with the product, please feel free to contact us. Or If you aren't sure that your pressure washer matches it or not, please feel free to contact us.",Kitchen-And-Home-Appliances
4,NEOSTAR Tall Tubular TT/LT Single Battery Light Grey Inverter Trolley (Suitable for All Type Inverter-Batteries),,"1,540",4.0,31,"This Light Grey Tall Tubular /Tt Trolley Is Used For Storing Single Tt Battery, Commonly Called Single Tt Battery Trolley. It Can Accommodate Tt Battery It Is Spacious, Safe And Made From Tough Long Lasting Material Which Does Not Get Destroyed By Spillage From Battery, If Any. It Is Used For Reducing Storage Space And Preventing Exposing Battery To Open Air. Battery Can Be Kept Inside The Trolley And Inverter Or Ups Can Be Placed On The Top. Its Highly Durable And Sturdy Plastic Design Makes The Battery Safe From Humidity And Other Environmental Issues. It Has 5 Wheels For Easy Mobility. This Screw Less Battery Trolley Is Made For Easy Battery Maintenance. It Is Open From Back Side For Ventilation And Water Topping. This Is A Strong And Easy To Install Trolley From NEOSTAR.",Kitchen-And-Home-Appliances
5,"Aqualex, Pokar RO, DC Power Ballast (Choke) 24v - 36v (2 in 1) Suitable for 8 to 11w UV Lamp (Tube), for All Brand RO- UV Water Purifiers",,299,3.5,135,Yesh dc power ballast (Choke) 24v - 36v (2 in 1) for 11w uv tube suitable for all ro- uv water purifiers.,Kitchen-And-Home-Appliances
6,"Morphy Richards Icon DLX Food Processor, (Silver, 1000 Watts)",,"8,845",3.2,83,,Kitchen-And-Home-Appliances
7,Orient Electric Orina 1200mm Ceiling Fan (Chocolate Brown Ivory),,"3,650",4.1,"1,147",,Kitchen-And-Home-Appliances
8,"Deco Window Aluminium Home Garden Torch Marshal Conical, 60-inch, Brown Oil Rubbed -Set of 4, 250ML TORCH FUEL HOLD",,"1,999",4.1,79,,Kitchen-And-Home-Appliances
9,JPT Combo Heavy Duty Foam Lance with Bosch Adaptor and 5PCS Nozzle Set for AQT Series CAR Pressure Washer,,"2,698",4.0,36,"1. Universal foam cannon with 1/4"" quick disconnection fits in your Bosch washer with provided bosch adaptor. 2. Adjustable foam cannon can mix cleaning fluid with water accurately and generate foam quickly. 3. The bottle can be filled in with 1 Liter of cleaning fluid. Spray angle and suction amount of cleaning fluid can be adjusted according to needs. 4. It is used to wash motorcycles, cars, roofs, driveways, siding, floors, and windows. 5. Working Condition: 1000 PSI to 4000 PSI 6. Max Temperature: 45℃ / 113℉. 7. Bottle Capacity: 1L. JPT ADAPTORS COMPATIBLE WITH DIFFERENT KINDS OF GUNS, for attaching different accessories like JPT FOAM LANCE, JPT 90 DEGREE CONNECTOR, JPT NOZZLE SET (5 Pcs Package) 1/4"" Stainless Steel 4000 PSI Quick Connect High-Pressure Spray Tip Nozzle Package included: 1 x Black Brass Soap Nozzle (65 Degrees) 1 x Red Stainless Steel Nozzle Tip (0 Degree) 1 x Yellow Stainless Steel Nozzle Tip (15 Degrees) 1 x Green Stainless Steel Nozzle Tip (25 Degrees) 1 x White Stainless Steel Nozzle Tip (40 Degrees) 5 different Spray Angle Tips: meet your need in different situations, such as watering flowers and plants, washing the car, and can be attached to a quick-connect wand for swifter application and more Material: ADL nozzle cover, hardness stainless steel, brass tips * Different spray angle allows you to clean hard-to-reach areas quickly and easily * 5 Pack: 65 Degrees Brass soap nozzle, 0 Degrees Red Stainless Steel Nozzle Tip,15 Degrees Yellow Stainless Steel Nozzle Tip, 25 Degrees Green Stainless Steel Nozzle Tip, 40 Degrees White Stainless Steel Nozzle Tip * Don't use a ladder to clean or spray water for a tree with these spray nozzles * Designed for high-pressure washing up to 4000 PSI; * More Application: Can be attached to a Quick-Connect Wand for swifter application and more",Kitchen-And-Home-Appliances
10,Kitchen Small Digital Weight Machine Weighing Scale (Multicolor),,299,3.8,9,Multipurpose Portable Digital Weighing Scale This portable digital Weight Machine Kitchen Shop Food scale comes in a white colour and is white in colour. The digital weighing scale automatically locks the data while reading to provide a precise reading. Salient Features 1. Wide Screen Display 2. Automatic Locking of Data 3. Low Power Consumption 4. Low Battery Indicator 5. High Precision Tension Meter System,Kitchen-And-Home-Appliances
11,"DAIVE TAFTA Heavy Duty Air Conditioner Outdoor Unit Mounting Bracket Ac out door stand for 1 Ton, 1.1 Ton, 1.2 Ton, 1.5 Ton, 2 Ton Outdoor Units (1Pair)",,648,3.5,17,"DAIVE AC stand - heavy duty outdoor unit for ac upto 2.0 ton. Item made up of gi steel. Easy to install and set up. Product is highly stable and much longer life time. Beware: installation technician may try to promote their ac stand by saying this stand is not compatible or recommended , but this stand is compatible with all lg , Voltas , Samsung , kenstar , carrier , mitashi ,whirlpool , godrej ,bluestar , lyyod and all other leading brands air conditioner. Suitable for 1 air conditioner outdoor unit up of (1 ton, 1.1 ton, 1.2 ton, 1.5 ton, 2 ton Voltas, whirlpool, carrier, Videocon, daikin, Mitsubishi, lg, Samsung, kenstar, blue star, godrej, bpl, onida, sensui, mitashi ac outdoor units).",Kitchen-And-Home-Appliances
12,Akua Beat Body Protective Cover for Hindustan Unilever Pureit Classic Nxt RO+MF l Classic Nxt RO+UV model Water Purifier (Blue),,199,5.0,1,,Kitchen-And-Home-Appliances
13,"VOWEl™ Folding Portable Outdoor Barbeque Charcoal BBQ Grill Oven With 10PC Stainless Steel Stick , Wooden Stick,(BBQ ,Wooden & Big 10-stick, bbq air blower )",,995,3.8,519,,Kitchen-And-Home-Appliances
14,SWADESHI HANDICRAFTS Eco-Friendly Natural Bamboo Cane Jute Rope Hand Made Laundry Basket/Wicker/Storage Box-I Piece,,"1,799",4.6,46,,Kitchen-And-Home-Appliances
15,STARQ Metal Inlet Brass Nozzle for high Pressure Washer,,329,4.2,91,"Color : Gold Material :Solid brass Package Includes :1 x Connector Note: Please allow 1%-3% inch/cm difference due to manual measurement. Due to the difference between different monitors, the picture may not reflect the actual color of the item. Please understand,Thank you",Kitchen-And-Home-Appliances
16,"Shophere Portable Handheld Garment Steamer Clothes Facial Steamer for Face and Nose at Home and in Travel (Pink,White)",,889,3.6,537,"Safty Instrusction: 1.first, please cut the power and pull the plug to let the machine cool down entirely. 2. Please add the water and vinegar mixture(1:1)slowly from the water mouth until it is half full.  3. Please pour the mixture after 1-2 hours. you can repeat above steps until the precipitates is completely gone. 4. Please add the clear water into the machine to wash the tank until the vinegar is completely eliminated. Warm Tip: 1.Please do limit the amount of water within 200ml. The water level must under the maximum water line, otherwise the water may pour out! 2.Please do not add water when it with hot water,or add cold water into it immediately after using. The hot water cannot be mixed with the cold water! 3.Please use the steamer in UPRIGHT position. 4.Please screw the lid on tight.*Note : We have many color variation of this product. So we will dispatch order as per color availability.",Kitchen-And-Home-Appliances
17,"C (DEVICE) Shaver for Cloths, Lint Remover for Woolen Sweaters, Blankets, Jackets/Burr Remover Pill Remover from Carpets, Pack of 1",,399,3.9,13,,Kitchen-And-Home-Appliances
18,"Rainflow Water Tank Filter-3/4"" | Disc Filter (Y-Type Filter) | for Water, R.O. Filter, Drip irrigation filter, Home or Apartment water Tank Filter -6 Months Warranty MADE IN INDIA",,446,3.5,238,,Kitchen-And-Home-Appliances
19,SVK Dream Portable High Pressure Water Spray Gun High Pressure Nozzle Car Washer High Pressure Pump Gun Nozzle,,479,4.0,1,"This High Pressure Nozzle Is Excellent For Heavy-duty Cleaning Work Such As Concrete Cleaning, Paint stripping, And Removing Oxidation And Grease From Equipment And Floors. The 40° Buram Water Pressure Nozzle Gives You The Widest Spray Pattern. Use This Tip For Spraying And Hosing Down The Car, Washing Windows, And Anywhere You Want To Rinse Something Off. If A Surface Is Delicate, This Car Wash Spray Gun Nozzle Lets You Apply A Wider Spray With Less Pressure So You Don't Damage It.",Kitchen-And-Home-Appliances
20,"WIDEWINGS 4 in 1 Stainless Steel Electric Handheld Blender Milk Wand Mixer Frother for Latte Coffee Hot Milk, Egg Beater, Hand Blender, (Hand_Blender_WW-1710)",,"1,899",4.9,72,"Features: ● 4-in-1 Multi-functional: 500W Powerful motor operates at low noise. ● Quick: Making delicious soup, fresh juice and other cuisine just in seconds. ● Stylish Stainless Steel Panel: Ergonomic handle for a secure grip-splash guard to prevent food splatter. Provide excellent convenience and easiness for blending. ● Comes With High Quality Attachments: Blender with SS blade to puree and liquid ingredients into smoothie. ● 2 Speed Operation: 2 speeds settings to suit different ingredients and attachments. ● Detachable attachments: Easy to wash ● Compact appearance, work efficiently and take the strain out of everyday kitchen tasks. Extremely fits to your kitchen and home. Package Included: 1 x Blender Sticker 1 x 700ml(24oz) Beaker 1 x Chopper 1 x Egg Whisk",Kitchen-And-Home-Appliances
21,Prithi Home's and Kitchen Stainless Steel South Indian Filter Coffee Maker/Drip Coffee maker- 160 ml Approx. capacity (2-3 cups),,275,3.9,8,,Kitchen-And-Home-Appliances
22,"SELMEZ® Mini Pocket Weight Scale Digital Jewellery/Chem/Kitchen Small Weighing Machine with Auto Calibration, Tare Full Capacity, Operational Temp 10-30 Degree (200/0.01 g)",,329,3.6,16,"SELMEZ Mini Pocket Weight Scale Digital Jewellery/Chem/Kitchen Small Weighing Machine with Auto Calibration, Tare Full Capacity, Operational Temp 10-30 Degree (200/0.01 g) Digital Pocket Scale Features  Accurate and Precise: Portable electronic scale with the accuracy of 0.01g, for an accurate weighing session. Quality Promised: The Scale is designed with a stainless steel platform and a protective flip cover, this scale is a Lightweight and pocket size solution for all your portable weighing tasks. Portable and Convenient: Exquisite craftsmanship, compact, easy to carry, can be put in the pocket. Backlight Display: Large-screen backlight display, blue screen colour crystal screen, easy to read. Measure Range: Gold, Silver, Coins, Jewellery, casting powder for model, jewellery and small packages, perfect for weighing portion sizes on the go when trying to track calories, and other small things and etc. Easy to Use  These digital mini pocket scales are incredibly easy to use, even if you've never employed one of these tools. Pocket scales are small enough to carry in a pocket. Despite their small size, they can accomplish just about anything a regular-sized weighing scale can. These impressive portable digital scales can measure up to 500 grams with the greatest of ease.  How Should We Calibrate the Food Scale?  Turn on the scale. Press the UNITS button for about 2 seconds till 500.00 appears on the LCD display. Then release and repress the UNITS button once, CAL and 500.00 flicks on the LCD display. Put a weight of 500g on the scale. Turn off the scale when it appears PASS and 500.00g(± 0.05g)on the LCD display successively. Calibration is done. Please calibrate several times when it is still not accurate enough.",Kitchen-And-Home-Appliances
23,"Riya Handloom small box mini rope paper storage JUTE basket woven laundry bag brown hamper baby nursery tray bucket organizer set of 3 for kids toys, fruits, kitchen, office, shelfs, Pack of 3 (Set Of 3 Pieces, White)",,299,4.1,7,,Kitchen-And-Home-Appliances
24,Coffeeza Coffee Capsule Holder with Rotating Stand - Holds 40 Coffee Pods| Compatible with Nespresso Pods | Espresso Pod Holder For Home & Office,,"1,139",4.6,25,Having to sort through a drawer filled with mixed capsules is not the ideal way to make coffee. Coffeeza's Capsule/Pod Holder makes choosing your favorite capsule blend easy and enjoyable. Its elegant display of coffee capsules lets you see and choose from many different coffee options. It also adds a nice touch to your coffee counter.,Kitchen-And-Home-Appliances
25,AirTamer Rechargeable Personal Air Purifier A310W,,"9,999",No reviews,,"The airtamer A310 is a high performance rechargeable personal or travel air purifier. Airtamer's advanced ionic technology emits a constant stream of healthy negative ions that force airborne pollutants away from your personal space giving you a 3 foot sphere of cleaner, healthier air around your head. It cleans the air of atomic sized pollutants (e.G. Viruses, pollen, smoke, molds and dust mites) that traditional air purifiers (e.G. Hepa) leave behind. It is silent in operation and it's extremely energy efficient power boost technology provides 150+ hours of run time on one charge. Easily charged by included USB cable. Airtamer's design is ultra compact and incredibly versatile. A proprietary conductive adjustable Lanyard dramatically improves performance and increases run time. You can wear it around your neck (strap included) since it is smaller than most MP3 players or place it freely on your nightstand so the air around your pillow is clean and free of pollutants. Wear airtamer to create a cleaner zone of healthier air while traveling, in public places or in other poor air quality locations.",Kitchen-And-Home-Appliances
26,"Pack of 2 : Ikea Milk Frother 303.011.67, Black by IKEA, Pack of 2",,417,4.1,50,Ikea Ikea Milk Frother 303.011.67 Black by IKEA Pack of 2,Kitchen-And-Home-Appliances
27,"Elysian® Blue Crystal Silica Gel Self Color Indicating Desiccant Dehumidifier Silica Gel for Room Kitchen Wardrobe Cupboard Car Bedroom Camera Lenses Shoes (Blue, 1000 Gm)",,379,4.1,55,"➿ELYSIAN➿Product Name-Color Indicating Blue Silica CrystalPack Of-1 kg➿ HOW TO USE ➿ Place your items and silica gel in a tightly sealed container to protect your items from moisture damage; Use silica gel packs to protect Foods, Vitamins, Seeds, Nuts, Snacks, Cookies, Spices, Pet Foods, 3D Filaments, Safes, Guns, Ammos, Canister, Collectables, Jewelry, Documents, Camera Lens, Clothes, Cosmetics, Books, Bags, Decorations, Wet phones, Cameras, Watches, Electronics, Shoes, and Many Other Valuables.➿ Silica Gel are effective for ➿ElectronicsFood & MedicationJewelry & CollectiblesTools, Razor, & Ammo CansClothes, Shoes, & Bag StorageRice, grain, pasta, seeds, pet food & nutsImportant Documents, Photos, & Books.Great for storing medications, vitamins, seeds, nuts, beef jerky, snacks, cookies, & pet foods. Packets will prevent clumping of salt or sugar. Chips, crackers, and cereal won’t go stale and remain crispy.Protect shoes, bags, clothes, camping equipment, cosmetics, and decorations from moisture damage.Unique customized packing material, can be fast reactivated and be reused for more than 10 times, cost effective.With the visible color indicator, easy to know when the desiccant packets need to be reactivated or replaced. Always keeps dry.Protect tools, razors, & ammo cans from rust, tarnish, and corrosion.Place silica gel packets inside the storage boxes to protect all items from moisture damage.Protect all your important documents, photos, and books from moisture damage.Protect your precious collectibles, jewelry, and silverware from tarnish or deterioration.Great for keeping your expensive camera, camera lens, 3D Filaments, hearing aids, phones, and all other electronics dry.If you ever accidentally get your phone wet, don’t turn on the phone. Remo",Kitchen-And-Home-Appliances
28,"TAKAVU Foam Cannon, Upgraded 180Ã‚° Adjustable Spray Nozzle, Heavy Duty Car Foam Blaster Wide Nick Bottle Snow Professional Foam Lance for Pressure Washer Gun with 1/4' Quick Connector",,"1,599",4.1,255,"TAKAVU's Premium Foam Cannon is designed to deliver maximum suds to ensure your ride gets squeaky clean. Adjust the nozzle for narrow or wide steam, and use the air intake knob to create more or less foam. Compatible with standard pressure washer quick connect attachments.  Specification: Material: Brass+ABS Bottle Capacity: 1L Interface: G 1/4 - F Require Pressure: 100bar-1450psi Maximum Pressure: 220bar-3200psi Require Flow: 2.0Gpm Maximum Flow: 5.3Gpm Highest Temperature 0 -140   QUESTION: Why doesn't the connector fit my pressure washer  ANSWER: You may need a quick connect adapter they available at most hardware stores and here on Amazon  QUESTION: What is the min. and max PSI  ANSWER: min 800 max 3200, best results PSI >1000  QUESTION: How do I increase/decrease the amount of foam  ANSWER: Turn the dial on the top of the cannon; this manages airflow into the stream which creates the foam.  QUESTION: How do I get the fan effect  ANSWER: Twist the nozzle at the front of the cannon, there are two blades which create the effect the closer they are together.  QUESTION: Can this product be used with a water hose  ANSWER: No, you ll need a pressure washer.",Kitchen-And-Home-Appliances
29,Prestige Deluxe LS 750-Watt Mixer Grinder (White and Red),,"3,449.",3.7,126,,Kitchen-And-Home-Appliances
30,PANISHKA Electric yogurt maker machine for home 1 liters with Stainless Steel Inner Container | Automatic System dahi maker electric yogurt maker digital dahi maker electric yogurt maker (Multi Color),,449,No reviews,,"Description: This electric yogurt maker allows you to make yogurt at home and add fruit according to personal taste. Easy to operate, healthy and delicious, great for household use. Features: This yogurt maker is a convenient and practical cooking tool to make delicious yogurt by yourself. Easy to operate, automatic machine allows you to make yogurt easily. You can enjoy healthy and nutritious yogurt even at home. It adopts stainless steel inner container, safe, harmless and easy to clean. The entire process takes about 10 hours. You can add your favorite fruit or honey according to personal taste. It can make about 1L yogurt at one time, suitable 2~3 people. Enjoy the delicious yogurt with your family. Specifications: Condition: 100% Brand New Material: Plastic (shell) + Stainless Steel (inner container) Package Included: 1 x Electric Yogurt Maker Note: 1. Please allow 0-2cm error due to manual measurement. Thanks for your understanding. 2. Monitors are not calibrated same, item color displayed in photos may be showing slightly different from the real object. Please take the real one as standard. Using Instruction: 1. Pour 800~1000ml or so pure milk to inner container. 2. Add about 1g yeast and stir evenly. 3. Put the cover on and plug into power.",Kitchen-And-Home-Appliances
31,"HOLME'S 4 Spun Candle 10"" for RO/UV Spanner Solid Filter Cartridge (0.005, Pack of 5)",,279,3.7,264,10 inch 5 micron spun filter 4 pics set with 1 pre-filter spanner to remove dirt and all solid partical from water till 5 micron to make it pure and crystal clear and you can use this for any kind of ro/uv/uf water purifier,Kitchen-And-Home-Appliances
32,"AMPEREUS - 5pcs PP Spun Filter for All Type RO Water Purifiers (5 Piece, White, 10 Inch, 5 Micron, 90 Gram) - RO Spun Filter Cartridge",,349,3.8,242,,Kitchen-And-Home-Appliances
33,"Wheezy Portable Stainless Steel Electric Cordless Mini Handheld / Whisker / Blender Drink Mixer and Foamer for Smooth Creamy Coffee, Lattes, Frappe, Milkshakes Kitchen Item (Battery-Not Included)",,199,1.0,3,"ABOUT BRAND: Wheezy Wheezy is a rapidly emerging brand in Indian contemporary market. We provide all the daily uses products at a same place for convenient of buyers. We sell products related to households, kitchenware, gadgets and all the products of day to day life. We gives best products at a best price and we never compromise with quality. About Product: Key Features- -Get Creamy Froth Quickly just within 15 - 20 seconds for your morning coffee with our milk foamer -Beautifully Styled with an elegant design. Our coffee beater is a perfect fit into any modern kitchen -Become a Barista Overnight and make cafe style coffee at home instantly. Impress your friends and family with our magic coffee wand -Battery Operated so you don't have to worry about cords and finding sockets -Battery Operated Portable Hand Blender For Lassi, Milk & Coffee.  Instructions:  1.Slide The Top Button 2.Insert 2 AA batteries in Opposite Direction Only 3.Your Stirrer is ready to use This Product Is Ideal For Following Applications 1.Making froth in a Glass Drink 2.Milk Foam 3.Coffee Stirrer 4.Juices / Drinks Stirrer 5.CocktailsSpecifications -Material : Plastic + Steel -Colour : Multi (Colour Will Be Send As Per Available In Stock..)  -Size : 22L x 5W x 4H cm. -Package Included :1 x Drink Frother Maker -Make your milk all frothy, great for making cappuccino, white coffee and milk shake at home.",Kitchen-And-Home-Appliances
34,"Usha Crisp Air 150mm Sweep Size, 240mm Duct Size Exhaust Fan (White)",,"1,350",3.9,"1,212",,Kitchen-And-Home-Appliances
35,Ziggy® New Whisk and Improved Motor - Milk Frother Handheld Battery Operated Electric Foam Maker for Coffee Latte Mini Drink Mixer(Assorted Color)(Color as per Availability),,210,3.5,31,,Kitchen-And-Home-Appliances
36,"USHA Bloom Primrose 1250 mm 3 Blade Ceiling Fan (Sparkle Golden, Cherry, Pack of 1)",,"3,200",3.9,130,,Kitchen-And-Home-Appliances
37,"BLUE STAR PA35LMA Tower Cooler - 35L, Apple Green",,"7,699",3.7,86,,Kitchen-And-Home-Appliances
38,"Thea Silica Gel White/Desiccant/Moisture Sbsorbr/Moistur Absorbent (25 Pouches,5Gm Each - Pack of 1)",,159,4.1,184,,Kitchen-And-Home-Appliances
39,"Metal Steam Press Teflon Shoe for Silver Star ES-300, ZUKEE ZK-96 and OW-BOOS ES-300 (ES- 300)",,290,4.1,19,Metal Steam Press Teflon Shoe for ESTEEM IRON,Kitchen-And-Home-Appliances
40,Steel Pico Snap-on Foot for All Automatic Sewing Machines Singer/Usha/Brother/Janome || 1Pc,,177,No reviews,,Zipper Foot or Presser Foot for all Sewing Machines (Singer/Usha/Brother/Juki/Rajesh) | Compatible for One side Flat Needle Type Machines Only.,Kitchen-And-Home-Appliances
41,"Ionix Premium 36V Hero Solenoid Valve with Copper Winding, Compatible with All RO Water Purifiers, Solenoid Valve, Solenoid Valve 36v, solenoid valve for ro water purifier Flow Control Pack 01",,190,3.9,244,"Ionix - combination of quality and reliability. A wide range of products with good quality of accessories. Our products include water purifiers & tester accessories, ro water filter sets, wireless speakers, chargers and cases, airpod carring case, etc. Solenoid valve imported",Kitchen-And-Home-Appliances
42,Smuf Madhaani With Container Copper Heavy Duty Butter Milk Lassi Cream Maker/Blender Churn Hand Machine (125W) NoiseLess,,"1,999",3.6,6,"This Madhani with Container Household usage capacity, used to prepare smoothies in quantities upto 2 litre. Has powerful pure copper winded motor with 2800 rpm. the box includes madhani . Best in Class for Indian home kitchen usage. NOTE : WEIGHT of MADHANI is 1.2 kg with ROD and BLADE attachment. 1.100% Pure Hermetic Copper Winding and Aluminium Mirror Finish Body for durability. 2. One pair beaters and one pair dough hooks are all made of durable stainless steel, which has longer service life than hand mixers made of other materials. Never worry about making a mess as all the accessories are easy to clean and dishwasher safe. 3. Lightweight construct and ergonomic handle designed to provide a sturdy grip, made from long lasting materials. 4. Two way curd percolator. Both clockwise and anticlockwise motor rotation. 5. It comes with stainless steel blending rod, Normal power of 125 watts and It's specially design blade can crush Milk to make Lassi, Cream Etc. in a minutes.",Kitchen-And-Home-Appliances
43,BAJAJ 1.5KG Heavy Weight Instant Heat Gold Plate Coated Non Stick 1000 W Dry Iron (White),,"1,550",3.9,6,,Kitchen-And-Home-Appliances
44,Ikea | Plastic Solid Bevara Sealing Clip | Sealing Bag Clips | Polypropylene | Airtight | Packet Sealer Clamps | Multicolor,,137,5.0,1,,Kitchen-And-Home-Appliances
45,Akua Beat 50ml Cleaning Syringe I Injection compatible with Kent Gold I Kent Gold+ I Kent Optima I Tata Swach Water Purifiers UF Membrane (50 ML Syringe),,399,3.0,1,,Kitchen-And-Home-Appliances
