,title,brand,price,rating,reviewCount,description,categories
221,"Sterling Nutri Blender for Kitchen, Mixer, Smoothie Maker, Magic Bullet Mixer Grinder, Chopper, Stainless Steel Blades, 21 PCS.",,"2,799",3.7,109,,Kitchen-And-Home-Appliances
222,"Havells 1200mm Milor Energy Saving Ceiling Fan (Dusk, Pack of 1)",,"2,749",5.0,1,"ENERGY EFFICIENT MOTOR, WIDER TIP BLADES",Kitchen-And-Home-Appliances
223,"Deerma ST636W Ultrasonic Digital Air Humidifier Essential Oil Mist Maker with Purifying Dust Filter, Low Noise Operation & 280ml/hr Mist Output (4.5L,28W)",,"4,409",4.3,11,,Kitchen-And-Home-Appliances
224,RNG EKO Green - 1000W Compact Multi-Function 20 KPA Cyclonic Power Home Vacuum Cleaner- (Metallic Red + Grey),,"4,299",3.6,781,,Kitchen-And-Home-Appliances
225,THW Commercial Teflon Coated Non Stick Waffle Maker with Ice Cream Cone and Bowl Mould (Fuel Gas Stoves Only),,"2,999",4.3,11,,Kitchen-And-Home-Appliances
226,"Koinonia KCROASTERS Coffee Filter Papers | Size 4 | Use for Electric Brewer, Clever Dripper, Pour Overs | 8 x 5.2 inches | Environmentally Friendly | Pack of 200 Each Coffee Filter Papers (Set of 2)",,853,Previous page,,"Its special micro-perforations allow the flavors of the coffee to easily seep through as it traps sediments and oils giving you a crisp and light brew.Paper filters are what you probably think of when it comes to making coffee. ... Many coffee drinkers found that paper filters would make the coffee thinner and more bearable.Add coffee grounds to your paper filter, whether it's cone-shaped or Melitta-style. Roll the paper around a few times, and wrap it up securely, and just dump it into a cup, like you would with a normal tea bag. You will need a very fine grind size coupled with boiling water and generous, steep time to make it work.Add coffee grounds to your paper filter, whether it's cone-shaped or Melitta-style. Roll the paper around a few times, and wrap it up securely, and just dump it into a cup, like you would with a normal tea bag.",Kitchen-And-Home-Appliances
227,"senstek WINNER 100KG WEIGHING SCALE,DOUBLE DISPLAY WEIGHT MACHINE FOR SHOP,STAINLESS STEEL 10G ACCURACY",,"3,999",2.4,6,The product in display is an electronic weighing machine which is made of Iron and Stainless Steel. It is Rust proof. Any wide range of products with a weight of 100 kg can be weighed. The product has a warranty period of 1 year. For any mishandling or breakage or battery discharging or overload is not covered in warranty.,Kitchen-And-Home-Appliances
228,"Carrier 1.5 Ton 3 Star Window AC (Copper, Estrella Dx, White)",,"35,100",Previous page,,The Carrier Estrella is the latest in the spilt Air Conditioner segment. This Air Conditioner offers an intelligent sensor and 2+1 mode that include a dehumidifier and cooling mode along with the dry and energy saver mode. A long 2 years manufacturer's warranty and onsite warranty ensures that one cause the Air Conditioner for years without any problems. The Tropical Rotary Compressor and Exhaust command are a few features that grace this particular model. Basic features such as auto restart and auto swing help make the Air Conditioner the smart powerhouse that it is. 1 YEAR COMPLETE AND 4 YEAR ONLY COMPRESSOR WARRANTY BrandCarrier ModelEstrella Energy Efficiency3 Star Rating Capacity1.5 tons Noise Level52 dB Installation TypeWindow ColourWhite Control ConsoleRemote Control Voltage230 Volts Batteries IncludedNo Batteries RequiredNo,Kitchen-And-Home-Appliances
229,"Shaula Portable Heat Sealer Mini Sealing Machine for Food Storage Vacuum Bag, Chip, Plastic, Package Home Closer Storage Tool, Mini Food Sealer (Multicolour)",,299,4.0,1,"Portable Household Mini Heat Sealing Machine Plastic Bags Package Home Closer Storage Tool In Multicolor. Perfect for air-tight reseal of chips, snacks, and foods. Works with any plastic bag packaging.Airtight seal - Create an airtight seal and prevent your food from tasting bland and stale and lock in freshness and flavor. Also safely pack cosmetics when traveling.Designed with ease of use in mind - Place the edge of poly or my Lar bag in your sealer and slowly pull the bag through. Professional Heat Sealer will easily reseal original plastic bags so food will stop being exposed to dust and bacteria. Store food in original packaging & help saves the Earth. It easily attaches to refrigerators or any stationary metal surface so you will keep it handy in your kitchen, outdoors, cabinet or anywhere you need it. Before use, press it for 5 seconds (pre-heating). Slide it slowly will be better.Mini Sealing Machine is a brand new and handy sealing machine in India The food bag sealing machine adopts advanced micro-heating technology, which can seal the packaging bag quickly and evenly, effectively sealing the dust in the air. This mini packet sealer machine is small and convenient, just pull the miniature plastic impulse sealer machine through the bag to form an airtight seal. Easy, convenient to use and store, Ideal for home use Used to seal daily plastic bags, such as snack bags, easy to use Perfect reseal unused portions of food, keep the food in freshness You simply slide it along the edge of any bag and it's sealed airtight.SPECIFICATION: Brand - Material- Plastic Product - Mini Sealing Machine Color- Multicolor Weight - 200 gram",Kitchen-And-Home-Appliances
230,"Borosil Eva 1 L Electric Kettle, Stainless Steel Inner Body, Boil Noodles, Eggs, Maggi's, Water For Tea, Coffee, Soup, Silver",,"1,530",4.2,296,"You Demand the Best Of Yourself, So It's Right You Enjoy The Best From Us. Famous For High Quality And Performance, We Pour Our Experience Into Creating Beautifully Designed, Practical Products Like Our APPLIANCE Range. Specially Designed Keeping Your Needs In Mind, The KETTLE Makes Whatever You're Doing Simpler, Smarter And Better. As Dependable As They Are Desirable, You Can Trust Our Products Always To PERFORM BEAUTIFULLY.",Kitchen-And-Home-Appliances
231,"Pigeon by Stovekraft Ebony Double Walled Cool Touch Stainless Steel Electric Kettle, 1.8 Litre, with 1500 Watt, boiler for Water, milk, tea, coffee, instant noodles, soup etc (Black), Large",,"1,099",3.3,"2,033",,Kitchen-And-Home-Appliances
232,NIRLON Maharaja Whiteline MX-220 1000 W Ultramax HD 3 Stainless Steel Jar Mixer Grinder (Black with Chrome Finish),,"4,999",3.9,"1,068",,Kitchen-And-Home-Appliances
233,"C (DEVICE) Electric NOVA Lint Remover for All Woolen Sweaters, Blankets, Jackets (Orange)",,399,4.0,402,,Kitchen-And-Home-Appliances
234,"Bajaj Majesty New RCX21 DLX 550-Watt Deluxe Multifunction Cooker (White, 2.7 Liters)",,"2,835",3.4,73,"Raw rice cooking capacity- 1 Kg Cool touch handlesAccessories: Spatula, Cooking Bowl, Measuring Cup,Steamer",Kitchen-And-Home-Appliances
235,"Lifelong LLHH921 Regalia Plus 1200 W Halogen Room Heater, 3 Power Settings, Oscillating Base, Room Heater with 1 Year Warranty ( White, ISI Certified )",,"1,499",3.8,246,,Kitchen-And-Home-Appliances
236,"Letino UV Set for Water Purifiers, UV Chamber (Heavy Aluminium Barrel), UV LED Light (Strip), Tee and 2 Pieces Elbow, Teflon Tape for All Ro Water RO Purifier",,379,4.2,10,,Kitchen-And-Home-Appliances
237,OCEAN STAR Ro Pre Filter Pp Spun Cartridge 10 Inch 5 Micron Sediment Filters For Ro Water Purifier Pack of 12,,499,3.9,31,,Kitchen-And-Home-Appliances
238,ORBON E-Cook Jhonson 2000 Watt Electric Coil Cooking Gas Stove | Electric Cooking Heater | Induction Cooktop | G Coil Hot Plate Cooking Stove | Works With All Metal Utensils & Cookwares (Vitreous Black) (2000),,"2,198",3.3,57,"Brand : Orbon (born to be loved) product type : Electric induction cooktop model name : Stv-jns-2000-vit special feature : Rectangular g-coil electric cooking stove with rotary switch about product : There's no need to sacrifice your favorite home cooked meals simply because you choose to explore or travel with this sleek burner cooktop, you can prepare those home cooked meals with ease no matter where you are, so long as you have an electrical outlet, you are ready to cook up a storm this ultra lightweight and compact cooktop brings the power of your stove to any desired location.The orbong-coil electrical cooktop works well on any cookware surfaces. A portable cooktop with all the usefullness of gas and induction stove. It will easily fit into most spaces, and will cool down quickly once you have completed cooking and unplugged it from the electrical outlet to avoid unnecessary heat. Orbon-coil electrical cooktop saves electricity, money and time. This is the best alternative to lpg cylinders, gas stoves etc. No need to worry incase if the lpg gas is exhausted in between cooking your meal. It is beneficial for housewives, working women, bachelors, offices, students away from home etc. Its excellent water-resistance features keeps it from short-circuiting. The special coating only allows heat to reach the cookware surface, avoiding electric shocks, especially when using metal cookwares. Energy efficiency:You can cook rice and potatoes in few minutes. Milk boils within few seconds. It cooks food in less time and hence consumes less power.",Kitchen-And-Home-Appliances
239,"Bajaj CGX4, 4-Burner Stainless Steel & Glass, ISI Certified, Gas Stove (Black, Manual)",,"6,498",4.0,29,,Kitchen-And-Home-Appliances
240,Orient Electric Ocean CD7001H 70 Litre Desert Air Cooler,,"11,149",4.2,50,,Kitchen-And-Home-Appliances
241,BMC 2019 MODEL G2S A-20 AUTO C PAP WITH HEATED HUMIDIFIER AND ACCESSORIES WITH 2 YEARS WARRANTY,,"23,999",Previous page,,"The RESmart G2S A20 is an auto-adjusting pressure CPAP (Continuous Positive Airway Pressure) device with integrated humidifier, designed for the treatment of adult Obstructive Sleep Apnea (OSA), either in the hospital or at home. With its stable performance & excellent comfort features the G2S let you say goodbye to snoring troubles and enjoy a whole night's sleep with face shield face mask.",Kitchen-And-Home-Appliances
242,"H2O Water Softener For Total Home Solution, Water Conditioner (Hard Water Problems Solver), Water Filters & Purifiers, Water Purification unit, Kitchen & Home Appliances Water Purifiers & Accessories",,"28,800",Only 2 left in stock.,,"WATER CONDITIONING: H2O hard water softener/conditioner conditions and improves the water quality by eliminating lime scale build-up and allowing free flow of water. PREVENTS LIMESCALE: Solving all your hard water problems, this solution is like the Kent water softener, preventing lime scale build-up and keeping the water fixtures safe. LESS MAINTENANCE: When it comes to the maintenance of this water softener/conditioner, you don’t have to worry at all. It doesn’t take up your time and even prevents water wastage. Water Purification unit Kitchen & Home Appliances Water Purifiers & Accessories Water Filters & Purifiers",Kitchen-And-Home-Appliances
243,"Bajaj CGX4, 4-Burner Stainless Steel & Glass, ISI Certified, Gas Stove (Black, Manual)",,"6,498",4.0,29,,Kitchen-And-Home-Appliances
244,Terosa NAT Stone Sandalwood Board or Chandan Patta or Chandan Chakla (Medium - 4inches),,199,3.9,14,"Terosa brings you the handcrafted Natural Sone based Sandalwood Board or Chandan Patta/Chakla. This has been a perfect traditional method in India followed since ages to grind & get the best Sandalwood Paste, Kids Ghutti, Spice grinding like Turmeric or grinding the herbs. Carved out of Natural Khatu Stone that has the property of soaing water to help the grinding process. This is also used while offering Sandal or Chandan Paste in religious ceremonies as well. The product is Natural rough Stone with coarse surface as that helps the grinding process. The base has descending ring shape to provide stability while grinding. This comes in three sizes Medium (4 inches, 325gm), Large (5 inches, 500gm) & X-Large (6 inches, 700 gm). Happy Grinding with Terosa!",Kitchen-And-Home-Appliances
245,Yhplia 250 ML Stainless Steel Spray Bottle for Mist Sprayer Style Haircut Hair Salon Hairdressing Water Bottle for Parlor Salon,,265,3.9,14,"Product Description Easy to Hold: The spray trigger head with a unique design is comfortable to grip and easy to use. Its well-sealed nozzle will spray fine mist, very convenient to operate. Its well-sealed nozzle will spray a long stream or fine mist, very convenient to operate. The amount of the fluid that the bottle sprayed will change based on the frequency you pressed the handle., Can be used for Gardening, for Personal use, and for Home and Cleaning use Other Details : Type: water Spray bottle Material: Steel Color : Multi Color - ( As Per Avibility)",Kitchen-And-Home-Appliances
246,"DEVCOMM Hand Blender Stainless Steel | Hand Mixi | Mathani for Saag, Dal, Eggs, Ghotni, Egg Beater",,147,4.3,11,"Stainless Steel Mixi Egg Blender / Steel Hand Blender Mixer Froth Whisker Latte Maker For Milk Coffee Egg Beater. Easy to use No need of Electricity Can be used as a Beater to beat Cream, Eggs etc Can be used for Churning: Milk shake, Lassi, Butter milk etc Can be used for Tomato Soup, Dal etc. It will beat your eggs faster and better than what you can with a spoon. It will froth your milk and coffee/cappuccino as if you are having it at a cafe!",Kitchen-And-Home-Appliances
247,"IBELL WF9816 Wall Fan 3 Leaf, 406mm, Low Noise Motor,High Speed, Black and Ivory",,"2,018",3.8,507,,Kitchen-And-Home-Appliances
248,V-Guard Arido R35 H Air Cooler | 35 Litre | Air Delivery - 1100 m3/h | Two Years Warranty on Motor & Pump,,"7,138",3.4,56,,Kitchen-And-Home-Appliances
249,EMNDR® Ez Jet Water Cannon 8 in 1 Turbo Water Spray Gun for Car with inbuilt Soap Dispenser Tank for Car Bike Washing Gardening Washing Gardening with inbuilt Soap Dispenser Tank,,498,3.1,129,,Kitchen-And-Home-Appliances
250,HANEUL!! Ceiling Fan!! 600MM!!Small!!Kitchen!!Bathroom!!High Speed!! 4 Blade!! Matty Brown!!Smoky!! Made in India,,"1,099",3.2,11,,Kitchen-And-Home-Appliances
251,"Everest Elegant 2000W Attractive Design Sensor Touch Control Function Induction Cook Top 1 Year Warranty , Black",,"1,899",3.7,218,,Kitchen-And-Home-Appliances
252,"ABEERA Jute Baskets Online | Designer Baskets | Storage/Shelves Baskets | Fruit Baskets or clothes (Beige, Set of All 3 Sizes (M))",,444,Previous page,,"🔘 ABEERA Modern design and style to suit your home. Make your plant look more beautiful and organize your laundry and clutter by putting in this beautiful handmade JUTE Basket.This is the unique and first ever launched basket, Woven meticulously with natural, it is not suitable for growing plants or watering directly. You can plant the plants in the pot and then put them in our multi-functional woven basket for home decoration.",Kitchen-And-Home-Appliances
253,iScale 6 Kg Digital Kitchen & Multipurpose Weighing Machine small pan size 14.5 x 14.5 cm With Direct power adapter,,999,3.8,386,,Kitchen-And-Home-Appliances
254,JimXen Enema kit satvik movement PVC Douche Can pot 1500ml with 1 Silicon Pipe 2 Nozzles 1 Pinch Clamp Detox Home Use helps in relives gas indigestion and Constipation for Men and Women,,249,2.5,7,,Kitchen-And-Home-Appliances
255,"H2O Water Softener For Total Home Solution Water Conditioner | Hard Water Problems Solver | Water Filters & Purifiers, Water Purification unit, Kitchen & Home Appliances Water Purifiers & Accessories",,"28,800",Only 2 left in stock.,,"WATER CONDITIONING: H2O hard water softener/conditioner conditions and improves the water quality by eliminating lime scale build-up and allowing free flow of water. PREVENTS LIMESCALE: Solving all your hard water problems, this solution is like the Kent water softener, preventing lime scale build-up and keeping the water fixtures safe. LESS MAINTENANCE: When it comes to the maintenance of this water softener/conditioner, you don’t have to worry at all. It doesn’t take up your time and even prevents water wastage. Water Purification unit Kitchen & Home Appliances Water Purifiers & Accessories Water Filters & Purifiers",Kitchen-And-Home-Appliances
256,"TASMAX mini waffle maker machine 3 in 1 waffle iron home appliances kitchen gift Easy to Clean, Non-Stick Surfaces, 4 Inch, Perfect for Breakfast,Dessert, Sandwich, Pan Cakes, Paninis / Other Snacks",,960,4.8,6,,Kitchen-And-Home-Appliances
257,"TAZLYN mini waffle maker machine 3 in 1 for home kitchen appliances for home kitchen items gift Non-Stick Surfaces4 Inch, Perfect for Breakfast,Dessert, Sandwich, Pan Cakes, Paninis/Other Snacks",,899,3.0,4,,Kitchen-And-Home-Appliances
258,"Goldwinner Eco Bullet Jar for Mixer Grinder Set of 2 (530 ML & 350 ML) ABS Transparent Plastic, Black",,520,2.3,3,Highly precision designed accessory for your daily use mixer grinder bullet jars. The product contains oneJuicer jar. The capacity is 530 ml and 350ml. It has lid alongwith the product. For compatibility see the coupler photo in images. For more compatibility related queries your mixer top image on 9082814099 for Confirmation,Kitchen-And-Home-Appliances
259,"Konvio Neer 100 GPD RO Booster Pump with copper winding, Ro pump for all water purifiers",,,4.3,299,,Kitchen-And-Home-Appliances
260,"YOUTHUP Garment Steamer Ironing Glove, Waterproof Anti Steam Mitt with Finger Loop, Complete Care Protective Garment Steaming Mitt, Heat Resistant Gloves for Clothes Steamers (Pointy)",,317,4.4,417,,Kitchen-And-Home-Appliances
261,iScale 30 Kg Digital Kitchen & Multipurpose Weighing Machine medium pan size 23.5 x 19.5 cm With Direct power adapter,,"1,599",3.6,518,,Kitchen-And-Home-Appliances
262,Singer Simple 3223 Automatic Zig-Zag Electric Sewing Machine with 23 Built-in Stitches (Pink),,"12,349",4.1,851,,Kitchen-And-Home-Appliances
263,"INALSA Air Fryer Digital Compact Touch 1000W with Smart AirCrisp Technology| 8-Preset Menu, Touch Control & Digital Display|Variable Temperature & Timer Control|Free Recipe book,2 Year Warranty",,"3,999",4.3,263,,Kitchen-And-Home-Appliances
264,HEWA Aero 6 inch (150mm) ventilation exhaust fan (WHITE MARBLE),,"1,299",3.9,79,,Kitchen-And-Home-Appliances
265,"Voltmi Aura Portable Air Purifier (White) for Car, Home & Office, 99.5% Air Purification Rate, 3 Stage Air Filtration, Intelligent AI Based Air Quality Sensor-Indicator LED Lights, H13 Grade True HEPA Filter, One-key deodorization, 1 Year Warranty",,"2,499",3.5,18,"Voltmi Aura Portable Air Purifier is the most suitable and affordable compact size air purifier for your cars, small rooms, offices, and kid's area. It comes with a unique 3L3W patented technology for achieving up to 99.52% air purification level that effectively removes Pollen, Mold, Germs, Bacteria, Pet Dender, Dust & Smoke & Aldehydes. Aura achieves the highest level of air purification with the help of an Activated Carbon Filter, a True HEPA 13 Filter, and a Fine Air Filter. A built-in High concentration of Negative ions & One-key deodorization assures further freshness and purification. A Built-in air quality sensor LED light turns green for pure, blue for semi-pure, and red for bad air quality for air quality monitoring. A cup holder design makes sure it fits inside every car, and a type-c connector with a USB output turns Aura into an effective USB charging outlet. With a 1-Limited warranty good air and good product quality are assured to everyone. Aura is a must-buy for every family that cares for a smart and healthy living with a Voltmi Aura.",Kitchen-And-Home-Appliances
266,"GE Filtration Kemflow Spun Filter Candle 10inch,Outer Filter,Catridge,Compatible with All Domestic Water purifiers Pack of 10pcs",,449,4.0,34,"GE FILTRATION 10inch Spun filter commonly used in all Household Domestic water purifier.....This filter can be easily installed...The main function of this filter is that it removes the hard particles like sand,dust,algae etc.....Installing GE filteration spun filter the life of the water purifier increases automatically as it stops the hard particles at initial stage because of its micron rating of:-5 micron....Which result in choking of inner filters of water purifier very less.....Please note:-GE filiteration spun filter is also specially designed that it can be wash after some period of time which decrease the service cost of water purifier.",Kitchen-And-Home-Appliances
267,"Vacuum Sealing Machine Plastic Bag Pouch Impulse Sealer For Packaging, Packing, Polythene, Packet, Package, Seal For Table Top (Vacuum Sealr)",,998,4.6,3,"Function:-➨Vacuum sealer helps prolong the food life so that less of it ends up going into the garbage can.➨One-touch automatic operation with intelligent LED indicator, which is very easy to operate.➨Include sealing and vacuum sealer two functions.➨Do vacuum packing and sealing with one simple press.➨Compact size and lightweight design for easy store. Be careful with the heated sealing.➨Safety lock design keeps the food sealing machine tightly closed when being operated, very safe and preventing your hands from being burned.➨Package Included: 1× Food Vacuum Sealer 1× Manual Use Cleaning & Care:-➨1.Avoid using rough materials to clean the machine to avoid scratching the surface.➨2. Do not immerse the machine in liquids.➨3. Before assembling, be sure the sponge is dry. During the process of assembling, do not damage it.➨4. Dry thoroughly before reusing.➨5. It is forbidden to wipe with organic solvents and no need to add lubricant to the machine.➨6. When the machine fails, it should turn off the power immediately, check the cause and remove the trouble.",Kitchen-And-Home-Appliances
268,"IONIX Brass inlet valve for Ro water purifier with Brass Nipple, Connects to 1/4 pipe, Complete Set, Silver",,195,3.7,"1,055","Aquarium or ro ss inlet valve set 1/4\ size suited for water filter purifiers suited for common ro water filter purifiers available in india,compatible with many ro brands and models-can be used in multiple water purifier models-counter top,desk top,stand mounted,wall hanging,under sink,most of the ro model cabinets. Water filter inlet ss valve suitable for fitment with 1/4\ inch ro wire tube hose. Also suited for aquarium water inlet port. Superior quality ro inlet valve set compatible for many ro models. Good quality stainless steel valve and long life when compared to plastic valve. Stop the water leakage from your water filter attached to the sink tap or best water filter spare to keep this in handy for immediate change. Pack contains :- 1 pcs 1/4\ inlet valve complete set (ss tap adapter+on-off valve). (this product is not suited for water filters which uses 3/8\ size big size ro wire tube hose).",Kitchen-And-Home-Appliances
269,MOONSTRUCK MOON STAR - enegy saver - pankha - black -high speed - 1200 mm - 48 inch ceiling fan,,"1,299",Previous page,,"The sleek and modern black ceiling fan is the perfect addition to any room in your home. With its sophisticated design and powerful performance, this fan is sure to impress. The black finish is versatile and will blend in with any decor style, while the three black blades provide maximum airflow and energy efficiency. This ceiling fan features a quiet and powerful motor, delivering strong and steady air flow without any noise. You'll be able to enjoy the comfort of a cool breeze, without any distracting sound. With its modern design, powerful performance, and convenient features, moonstruck ceiling fan is the perfect solution for your home. Whether you want to cool down your living room, bedroom, or office, this fan will provide the comfort and style you need. Order yours today and enjoy the benefits of a premium-quality ceiling fan.",Kitchen-And-Home-Appliances
270,"Proscenic T22 Digital Smart LED Touch Screen Air Fryer with 13 Presets & Shake Reminder, Oil Free Air Fryer 5L, Low-Noise, Compatible with APP & Alexa, 100+ Online Recipes, LED Touch Screen, Non-Stick, 1700W [Energy Class A+++]",,"8,990",4.6,"3,400",,Kitchen-And-Home-Appliances
271,LONGWAY Starlite-1 1200 mm/48 inch High Speed Anti-dust Technology Decorative 5 Star Rated Ceiling Fan 400 RPM with 3 Year Warranty (Silver Blue) (Pack of 2),,"2,699",2.7,14,,Kitchen-And-Home-Appliances
272,"Accurate Mall Food,Snack Pouch Bag Clip Sealer for Keeping Food Fresh for Home Kitchen | Plastic Camping Snack Air Tight Seal Sealing Bag Clips |Packet Vacuum Sealers Clip| (Multicolor) (18)",,70,New to Amazon,,,Kitchen-And-Home-Appliances
273,"Dr. CHARCOAL Non-Electric Air Purifier, Deodorizer and Dehumidifier for Shoe Rack, Wardrobe, Fridge, Gym Bag (75g, Pack of 3, Modish Khaki)",,849,3.9,804,,Kitchen-And-Home-Appliances
274,Shapure RO 9 Inch Thread MLT Filter Cartridge Suitable for All Types of Water Purifier | 9 Inch Pre Filter Thread MLT Candle | (Pack Of 4),,193,4.0,32,Shapure Quality 9 Inches MLT pre filter candles,Kitchen-And-Home-Appliances
275,Kitchen Mart Replacement Turbo Spice Mini Jar Compatible with Preethi Aries/Taurus/Zodiac/Zion Mixer Grinder Models (Green),,899,4.1,31,,Kitchen-And-Home-Appliances
276,Preethi Trendy Plus 116 1600-Watt Induction Cooktop (Black),,"2,799",4.2,742,,Kitchen-And-Home-Appliances
