,title,brand,price,rating,reviewCount,description,categories
376,SOWBAGHYA Stainless Steel Coffee Filter - 250ml ( 304 Grade SS),,679,4.0,1,"There is something about South Indian filter coffee that is out of this world, especially when it has the traditional way with Enjoy your cup of filter coffee with the SOWBAGHYA Coffee filter which is made of the finest quality Stainless Steel 304 grade. ""Making a perfect cup of filter kaapi is an art, that’s perfected over time"" – South Indian Mothers! Instructions to Make Filter Coffee with Stainless Steel Coffee Filter: Filter coffee is brewed using a coffee filter that has two cylinders. The top Cylinder contains Pinholes. The idea is for the ''decoction'' to drip down from the top cylinder, through the tiny pinholes into the bottom cylinder. The Extra spout and and the extra handle on the bottom cylinder, makes pouring of decoction more easier without even opening the upper compartment.",Kitchen-And-Home-Appliances
377,"SaioStore Stainless Steel Hand Blender beater Mixer for curd, yogurt, egg beater, Stirring Lassi/Butter Milk Maker",,149,4.6,3,"SaioStore Brand Power Free Stainless Steel Hand Push Whisk Blender for Home Tool for Egg Beater, cake beater, Mixer Stirrer, Blending, Whisking, Beating, Stirring Lassi/Butter Milk Maker/Mixer. Long lasting life and high durability.",Kitchen-And-Home-Appliances
378,"BOSS E205 500-Watt Mixer Grinder, 3 Jars, Grey",,"1,999",3.9,40,"The BOSS Range of Mixer Grinders are a durable kitchen appliance made of stainless steel, which prevents rusting and has vacuum feet for easy operation. It comes with different stainless steel jars that allow versatile operations in the kitchen so that it can be used for multiple purposes.",Kitchen-And-Home-Appliances
379,Maggi Olga 1000 watts Travel Kettle,,524,4.2,218,"Cool Touch Body ,Wattage: 1000 Watts : Auto Cut-off ,Heating Element Teflon Coated & Sealed Die Casted. Capacity: 500ml (4 cups)Usage : Useful for Boiling Water,Used for making Tea / Coffee / Baby Food in Travelling or in the Offices in Small Quantity.",Kitchen-And-Home-Appliances
380,Kitchen Chef Aluminium Best Nonstick Manual Gas Toaster Bread 2 Slices Non Stick Grill Regular Sandwich Maker Heavy Pan with Cut Griller (Black),,"1,149",4.3,56,"KITCHEN CHEF is the one stop shop for all of your cookware’s needs. With the help of KITCHEN CHEF - GAS TOASTER SANDWICH MAKER you don’t have to worry if there is electricity or not, our NON STICK GRILL 2 SLICES TOASTER is gas stovetop compatible, simply turn on your gas or stove and make your tasty and perfect sandwich for breakfast, evening snacks and for dinner. Our TOASTER MAKER GRILLER made with high quality die cast metal. We are using 3S (SUPER SMOOTH SURFACE) & MSF (METAL SPOON FRIENDLY) technology. The HEAVY DUTY NONSTICK ALUMINIUM GAS TOASTER have 800 grams weight, our GAS TOASTER is very handy and easy to store and clean, streamlined sturdy handles for care-free operations. We always put in efforts to improve our user-friendly designs, quality, and durability of the product. It has two backlite to heat resistance. The handle also protects you against burning. Easy to use and very handy. Directly held over flame to make tasty toasts and toasted sandwiches. Daily regular use GAS TOASTER, enjoy crispy and tasty toasts and sandwiches at any time. Very handy GAS TOASTER for making toast sandwiches, you can fill omelette, cheese. Potatoes, baked beans and more in BIG OR SMALL SIZE BREAD and directly held over flame to make tasty toasts and toasted sandwiches. Our GAS TOASTER SANDWICH MAKER made with high quality die cast metal. Our GAS TOASTER & SANDWICH MAKER is very easy to use and very handy.",Kitchen-And-Home-Appliances
381,LUMINOUS Dhoom 1200MM Star-rated BEE Certified Energy Efficient 52-Watt High Speed Ceiling Fan (Brown),,"1,999",No reviews,,,Kitchen-And-Home-Appliances
382,Havells Orion 1200mm Ceiling Fan (Silver Brushed Nickel),,"5,599",4.2,332,,Kitchen-And-Home-Appliances
383,"Longway Creta 1200mm /48 Inch Remote Control High Speed Decorative Ceiling Fan with 2 Years Warranty (Golden, Pack of 1)",,"1,839",3.2,101,,Kitchen-And-Home-Appliances
384,"Kuber Industries Polka Dots Printed Waterproof Canvas Laundry Bag, Toy Storage, Laundry Basket Organizer 45 L (Black & White)-CTKTC044991",,217,4.2,27,"Kuber Industries cotton Canvas laundry bag 45L is a perfect combination of need and style. This beautiful printed laundry bag can be great for toy bin, storage bin, laundry basket etc. It is made from premium quality cotton canvas fabric, coated with waterproof PE to make it 100 percent waterproof. It has strong ring frame at the bottom and top to make it sturdy and retain its perfect shape. Kuber Industries Cotton Laundry Bag has 2 soft grab handles for easy lifting. It is very light in weight yet very sturdy and it is completely collapsible when not in use so you get the most use of every space. This canvas fabric is 100 percent recyclable. NOTE: The laundry hamper comes with compression packing which may result in crumpled in long-distance transit. It will recover after a period of time.",Kitchen-And-Home-Appliances
385,"Yeti 12” Cube Tower Air Cooler| 3 in 1 Portable Air Conditioner Swamp Cooler, Cooling Fan with 3 Speeds, 40 Liters Water Tank & 4 Trolley Wheel for Home & Offices- (White & Grey)",,"4,990",New to Amazon,,"The Yeti Air Cooler 12""Cube Tower is a manual tower air cooler that operates using a 12'' high-speed motor with a maximum RPM of 2600. It uses QuickCool Honeycomb as a cooling medium, which is a high-quality cooling pad that provides efficient and long-lasting cooling. The water tank capacity of the air cooler is approximately 40 liters, which can last for several hours.The power consumption of the air cooler is 90 watts, which makes it energy efficient and economical to use. The air speed of the cooler is 30kmph, which allows it to quickly cool down a room. The air throw distance of the cooler is 16 feet, which means that it can effectively cool down a medium-sized room.The Yeti Air Cooler comes with three-speed controls - high, medium, and low. It has a 12'' 3-leaf blade blower/fan type, which ensures efficient and powerful airflow. The cooler has four push wheels/trolleys that allow easy movement from one place to another.The air cooler does not come with a dust filter or an ice chamber. It has automatic vertical louver movement and manual horizontal louver movement that helps in better air circulation. The dimensions of the cooler without packaging are 19''x17''x37'', and with packaging, they are 20''x18.5''x38''. The net weight of the cooler is 9.9 kg, and the gross weight is 11 kg.The product comes with a 12-month warranty, which covers any manufacturing defects. The recommended cooling area for the Yeti Air Cooler is up to 100 square feet. Therefore, it is an ideal air cooler for small to medium-sized rooms. Overall, the Yeti Air Cooler is an efficient and durable air cooler that provides quick and effective cooling.",Kitchen-And-Home-Appliances
386,Brayden Chopro Nex USB Rechargeable Chopper and Whisker For Kitchen | 5 Control speeds | Portable Beater | 45Watts Fine Copper motor | 1500 mAh Rechargeable battery | 300ML Toughned Cup | ABS body(Green),,549,3.0,55,,Kitchen-And-Home-Appliances
387,V-Guard VIH151 1500 W Immersion Water Heater (Multicolour),,625,4.0,303,,Kitchen-And-Home-Appliances
388,"Bajaj HB-20 Silent 300W Hand Blender, Green",,"1,259",3.7,35,"Bajaj HB 20 Hand Blender is designed with 300 Watts silent DC motor that ensures low noise level and hassle free blending. It comes with easy turn and lock mechanism for locking and detaching for easy to use and clean for your convenience. Bajaj HB 20 hand blender comes with ergonomically designed push button switch for convenient and safe operation. It has inbuilt hanger for wall mounting that helps to store and access at your convenience. With 2 years’ warranty and ISI approved, Bajaj Hand Blender ensures better safety, reliability and trust for customers.",Kitchen-And-Home-Appliances
389,"Bajaj Junet AVAB 1200 mm Full Aluminium Body Ceiling Fan With Anti-Bacterial Coating (Astronaut Blue and Champagne Fizz), regular",,"3,700",4.1,15,"Introducing Bajaj Junet AVAB Ceiling Fans specifically designed for customers seeking unique and intricate design patterns along with high speed operation. The Anti Viral and Anti Bacterial coating assures protection against the most common bacteria and specified virus and offers hygienic and safe homes. With High RPM of 400, this Bajaj Junet AVAB Ceiling Fan offers high air delivery, high air thrust and high rate of evaporative cooling for instant and enhanced comfort level. The unique diamond shaped trims and dual tone colour finish with superior product aesthetics enhances visual appeal and finer room orientation.",Kitchen-And-Home-Appliances
390,"USHA On The Go Blender NB30X1 350 W, 2 Jars (600 mL & 330 mL) with Easy To Carry Bottles, 2 years warranty",,"3,330",5.0,1,,Kitchen-And-Home-Appliances
391,"Parv Homes Mini AC USB Battery Operated Air Conditioner Mini Water Air Cooler Cooling Fan Blade Less Duel Blower with Ice Chamber Perfect for Desk,Office,Study,Library,Room,Home,car,Outdoor",,369,Previous page,,"Cools, humidifies, and purifies for better air. Can plug in USB to use Utilizing evaporative technology, the air Cooler can effectively turns hot dry air into cool moist air and refreshing air at the same time. Follow simple instructions given on the Packing. Upgraded filters and working mode to prevent water leaking. Easy-fill Water tank lasts up to 8 hours! MULTICOLOR AVAILABLE IN MINI USB COOLER Mini Cooler fan is available in multicolors like Pink, Rose Red, Blue, Green, Purple, Orange. Therefore the color you receive may vary as per stock availability. Personal Space Cooler that Lets You Create Your Own Personal Comfort Zone. It can adjust the angle of the left and right air outlet. Two up, two down, left up and right down, down left and right up. Cools, humidifies, and purifies for better air. Can plug in USB to use Utilizing evaporate technology, the air Cooler can effectively turns hot dry air into cool moist air and refreshing air at the same time. Suitable for home, office and outdoor use. Powered by: 3 X AA Batteries ( Not Included ) or USB Cable(included). Can Be Used To Hot Flashes Or Home And Office Other Use Scene, Muggy Air Again. This mini cooling device is a great refreshment when you are out such as Golfing, Traveling, Watching sports, Amusement park, Camping, Picnic and many more.",Kitchen-And-Home-Appliances
392,Bajaj Neo-Spectrum 400 mm Pedestal Fan (Blue),,"2,919",3.8,141,,Kitchen-And-Home-Appliances
393,"Aluminum Exhaust Fan (4 inch, Black) For Use in Bathroom & toilet HIGH SPEED CONTROL 220/240VAC 4 INCH FAN 120X120X38MM",,470,3.8,52,For use in bathroom and toilet. Current: 220/240vac 50/60/hz 0.18a 33w.,Kitchen-And-Home-Appliances
394,"Kiran Enterprise 6 Pizza's Oven suitable for restaurants, hotels and commercial purpose (6 Pizza Oven) (45 Liters, Multicolour)",,"10,516",3.6,50,"It is an Indian product. It is fully in Stainless Steel. Inner size of oven is 12 inches x 18 inches. It can be use for roasting and grilling. It is heavy duty product to fulfill commercial needs. It has a thermostat. It contains 3 coils with total of 3KW. It has 12 months warranty. Pizza oven is suitable for restaurants, hotels and commercial purpose.. It is made of high quality steel material. It has Glass Wool Insulation for Door and Body. Specialty: Glass wool Insulation for Door and Body, Auto Cutoff Thermostate, It contains 3 coils with a total of 3KW, It can be used for roasting and grilling",Kitchen-And-Home-Appliances
395,"Heaven Coil Winding Machine, 1/10 Motor Coil Winding Machine with Steel Gears,",,"1,139",4.0,43,"Hand grinder 1/10 Coil Machine175mm. This product is a manual tool, which is widely used for the purpose of cutting, grinding and polishing. Fabricated by our adroit personnel using superior grade factor inputs, these products are highly reliable in nature. Further, owing to robust design and long service life, these products are highly demanded in the market. Operations are faster and with minimum noise, size : 6.6 inch",Kitchen-And-Home-Appliances
396,"Maharaj Mall Meat Grinder, Food Chopper (5L 500W), Professional Stainless Steel Kitchen Food Processor for Meat, Vegetables, Fruits with Stainless Steel Bowl and 4 Sharp Blades",,"2,395",3.4,29,,Kitchen-And-Home-Appliances
397,Luminous Petalaire 600mm Ceiling Fan (Brown),,"2,239",3.8,10,,Kitchen-And-Home-Appliances
398,Racold CDR DLX Vertical Water Heater (15 Liter),,"7,435",4.2,53,"The all new CDR Dlx water heater is the latest addition to Racold’s world class range of products. It features Titanium Plus technology with titanium enamel coating which provides high durability and superior withstanding power making it a 5-star energy efficient water heater. The tool has a 2 speed high performance planetary gearbox. this gives high power in the 1st gear and high speed in the 2nd gear, which ensures superior lifetime, best power transfer and high running smoothness.",Kitchen-And-Home-Appliances
399,"EVERGREY Wood Charcoal for Barbeque Angeethi Logs (Use for BBQ,Tandoori, Grill & Dehumidifies,Natural Air Freshener and Oder Remover for Home) - 500g",,105,2.9,10,"Evergrey natural wood charcoals is used as multipurpose, it is used for Barbecue, home gardening. it is highly combustible and inadmissible to smoke. its is absolutely dry. its has no dust or powder and dust. it is used for tandoori grill angeethi. less ash content",Kitchen-And-Home-Appliances
400,"Havells Celia 55 Litres Desert Air Cooler with Honeycomb Pads, Powerful Air-Delivery, Collapsible Louvers (55L, White & Grey)",,"10,490",3.9,"1,165","One of the best brands for electrical appliances, Havells India Ltd brings in a wide range of air coolers to offer you an amazing cooling experience. When we talk about air coolers, we often hear the term, Desert Cooler, which is nothing but bigger air coolers, meant to cool larger spaces. So, if you have a big room or you want to cool your entire home, Desert Cooler is something you must look for. Havells has a variety of Desert Air Coolers, and one of its series is called Celia. The Celia series of air coolers is characterized with Breatheezee Technology, to ensure you get dust-free and breathable air in your space. This electronic cooling appliance is available online; you can easily check for various models and their prices before buying. When we talk about quality electronic products in India, Havells is a brand that rules the roster. The Celia series of Desert Coolers is unbeatable in terms of cooling and cost effectiveness. These air coolers are, moreover, durable that will work effectively to give you amazing air-delivery year after year. You can check its detailed features online, to know better. Bring home a Celia, and enjoy the ultimate cooling experience in your comfort zone. These desert coolers are efficient to cool larger spaces, so you can also install them in commercial areas like offices, factories, workplaces, etc. The Celia series of Desert Air coolers from Havells is truly amazing. Use it to believe it!",Kitchen-And-Home-Appliances
401,AIR O MATIC Plastic Multipurpose Home & Garden Water Spray Bottle (500ml),,149,3.7,5,"Multipurpose Home Garden Water Spray Bottle for Cleaning Multipurpose manual liquid sprayer It can be used as water spray bottle for plants / water spray bottle for Gardening / Water spray bottle for Hair / Water spray bottle for garden / Ironing spray bottles / Hair Sprayer / Hand sprayer / plant spray bottle / Garden Spray Bottle / Mist Spray. Overall it this spray bottle could prove to be a very useful tool for your home. >Very Convenient and Good Choice for Garden Lovers.Adjustable Nozzle can be set for a Mist spray or a long pointed spray.Can be used for Gardening, for Personal use and for Home and Cleaning use.We design products that provide solutions for organizing your everyday living space. Our product solutions are designed for the bathroom, Home Product, kitchen and many more. AIR O MATIC strives to make everyday living easier with innovative products designed to help people organize and enhance their home with style. Intermixing trending fashions with durability and functionality are what we bring forward in our collections.",Kitchen-And-Home-Appliances
402,Purifit ABS Plastic 10 Stage Filter Cartridge to Remove Hard Water and Chlorine for Shower and Taps (White),,599,3.5,33,,Kitchen-And-Home-Appliances
403,"Saptraag Gomti Chakra (1.5 cm, Brownish) -108 Pieces",,360,4.3,215,,Kitchen-And-Home-Appliances
404,"Eureka Forbes Atom Vacuum Cleaner With 600 Watts Powerful Suction || Compact & Lightweight , Red",,"1,999",Previous page,,"Eureka Forbes Atom Bagless vacuum cleaner with 600 watts powerful suction. Comes with a range of accessories for complete cleaning. Compact & Lightweight Designed to be easy to move around with when in use, while occupying very little storage space.",Kitchen-And-Home-Appliances
405,Bajaj Majesty Macho 2000 Watts Heavy Weight Steam Iron,,"2,749",3.4,32,,Kitchen-And-Home-Appliances
406,Ndeal Full-Automatic Egg Incubator | Hatcher 48 Eggs All-in-One | Transparent Eggs Hatching Machine | Chicken with 12V & 220V Duel Power - 80 Watts,,"5,999.",3.0,107,,Kitchen-And-Home-Appliances
407,WONDERCHEF Regalia French Press Coffee Maker | Brews in just 3 minutes | 600ml | With heat-resistant German Borosilicate Glass Carafe | 1 Year Warranty,,"1,284",4.1,738,,Kitchen-And-Home-Appliances
408,STARO STARQ Multidegree 5 PCS NOZZLE SET For Quick release adapter 1/4 inch,,645,4.0,154,"This Pressure Washer Quick Couple Nozzle Set (1/4 inch)is for use on pressure washers with 2.5 GPM,2.5 orifice size. Includes 0°, 15°, 25° and 40° stainless steel quick-connect nozzles, black brass quick-connect soap nozzle. Each in a different color for easy identification. Plus a 90 Degree Quick Connecting Pivoting Coupler, which is compatible with high-pressure washer wands of the known brands that support up to 4,500 PSI.",Kitchen-And-Home-Appliances
409,Hatchpro Egg Incubator Fully Automatic Hatching Machine (64 Egg Incubator ABS with Humidifier),,"7,850",4.1,13,"This is hatchpro 64 capacity automatic egg incubator with low price .It is high quality automatic egg incubator with automatic temperature control , humidity control and turning control . It can accommodate 120 quail eggs or 64 medium eggs like chicken , etc . It comes with multipurpose egg tray used to accomodate different types of bird eggs . It comes with inbuilt candling torch and transparent glass window to check the eggs from outside .It consumes only avg 80 w power .  Features    1. It is automatic low price egg incubator with aluminum rolling type egg tray  2. It controls the egg turning automatically  3. It controls temperature and humidity automatically .  4. Fan assisted airflow that distributes heat evenly around the eggs  Egg Incubator can accommodate different types of Bird Eggs 1. Quail 120 eggs  2 . Chicken 64 eggs  3. Duck 55 eggs  4. Turkey 60 eggs  . It is best small/mini poultry egg incubator available in India. It is very easy to use.",Kitchen-And-Home-Appliances
410,Chartbusters 750-Watt Popular Plus Light Weight Dry Iron Plus Crease Lightning(Multicolour),,459,4.5,2,"Power: 750 watts; Operating voltage: 230 volts Non-stick coated golden colour sole plate Super clean finish with pleasant aesthetics Cool touch body with comfortable hand grip and nowdays No outfit is completed without a good iron, and a good one will make pressing your clothes a breeze because lets face it no one wants to spend hours in front of the TV ironing.",Kitchen-And-Home-Appliances
411,"1/2 Inch Automatic Water Level Control Valve Inside Type, Side Inner Water Automatic Float Valve Good Water Level Control Valve Used for Water Tank, Solar Energy, Auto Pot, Aquarium",,479,4.2,7,"Water Level Control Valve 1/2 inch, Automatic Water Level Control Valve, Water Level Controller Valve for Tank, auto water cut off valve, Water Tank Overflow Valve, Water Motor Pump Auto On Off Automatic Water Control：The float valve controls the flow rate and opening and closing of the inlet pipe through the floating of the ball. When the water level rises to a certain level, the water injection will be cut off; when the water level drops to a certain limit, the water is automatically injected Water Level Control Valve 1/2 inch Material: ABS Plastic Working Pressure Range: 0.01MPa-1.0Mpa Applicable Medium: Clean water Package Contains : 1 Valve, 1 PTFE Tape and 1 Elbow",Kitchen-And-Home-Appliances
412,"Havells Enticer 600mm Decorative, Dust Resistant, High Power in Low Voltage (HPLV), High Speed Ceiling Fan (Pearl White Gold), SMALL",,"3,898",3.7,27,"No home in India is complete without ceiling fans. Whether you go to the smallest towns, villages or the cosmopolitan cities, you’ll find ceiling fans everywhere. Though a necessity, fans can be made a decorative element of your home décor. Havells range of designer fans is infused with creative, designer look to impart a special feel to your ceiling. You can browse online to check out the entire range of decorative fans by Havells. Havells India Ltd, a brand synonymous with best quality electrical products, offers a variety of ceiling fans, which are backed by the most-advanced technology. These fans offer superior air-delivery even at a low voltage. So, without any delay, give your home a designer makeover with decorative ceiling fans from the house of Havells.",Kitchen-And-Home-Appliances
413,"Havells 1200mm Mozel Energy Saving Ceiling Fan (Elegant White, Pack of 1)",,"2,250",4.2,401,"No home in India is complete without ceiling fans. Whether you go to the smallest towns, villages or the cosmopolitan cities, you’ll find ceiling fans everywhere. Though a necessity, fans can be made a decorative element of your home décor. Havells range of designer fans is infused with creative, designer look to impart a special feel to your ceiling. You can browse online to check out the entire range of decorative fans by Havells. Havells India Ltd, a brand synonymous with best quality electrical products, offers a variety of ceiling fans, which are backed by the most-advanced technology. These fans offer superior air-delivery even at a low voltage. So, without any delay, give your home a designer makeover with decorative ceiling fans from the house of Havells.",Kitchen-And-Home-Appliances
414,Aqua Beat Compatible with Pureit Cleaning Water Purifier Spare Part Bellow Pump,,254,3.8,25,"Product Description :- This Cleaning Pump is Compatible for HUL Pureit Classic 23 Liters, Advanced 23 L, 14 litres water purifier You can clean Compact Carbon Track from this pump",Kitchen-And-Home-Appliances
415,"INF Ironing Board Cover with 5 MM Thick Padding, Scorch & Stain Resistant, Heat Resistant, Fits Standard Large Boards of 125 x 46 cm (Large, Blue)",,499,3.9,65,,Kitchen-And-Home-Appliances
416,Jupiter Zphyr 5 Blades Fan With BLDC Motor (1200 mm) | Energy Efficient 5 Star Energy Saver | High Speed Anti-dust Decorative Ceiling Fan Remote Controlled (Black & Gold),,"4,499",3.7,8,,Kitchen-And-Home-Appliances
417,"SEAL PRO 12"" Heat Sealer Machine Replacement kit, Spare Heating Element Service Spare Repair Parts Kit Hand Held Heat Sealer (Pack of 10)",,699,No reviews,,"12 Inch Sealing Machine Impulse Sealer Replacement Parts Impulse Sealer Machine, Heating Element Service Spare Repair Parts Kit Heat Seal Strips Replacement Elements, Sealing Machine Element 300 Mm,",Kitchen-And-Home-Appliances
418,"Aqualex, Pokar RO 4"" inch UF Membrane Filter Original Hollow Fiber 0.001 Micron Suitable of All Branded RO Water Purifier+ 2pcs Connector.",,350,3.6,291,"Ultrafiltration (uf) is a type of membrane filtration in which hydrostatic pressure forces a liquid against a semipermeable membrane . A semipermeable membrane is a thin layer of material capable of separating substances when a driving force is applied across the membrane . Can ultrafiltration remove bacteria - a microfiltration filter has a pore size around 0.1 Micron, so when water undergoes microfiltration, many microorganisms are removed , but viruses remain in the water. Ultrafiltration would remove these larger particles, and may remove some viruses. As such the filters have no warranty as the life of filter depends on usage or hardness of water which may differ from place to place and also the above said two parameters cannot be monitored.",Kitchen-And-Home-Appliances
419,Livpure Plastic Anti Scalent Filter Removes Chlorine Fluoride Heavy Metals Hard Water Softener Water || 1 Pc,,799,3.9,16,Filter Removes Chlorine Fluoride Heavy Metals Hard Water Softener Water,Kitchen-And-Home-Appliances
420,Astberg AF150 (150mm/6) (530CMH/311CFM) Silent Mix Flow/Inline Duct Fan/Duct Exhaust/Inline Exhaust/Circular Inline Fan,,"7,400",4.0,37,,Kitchen-And-Home-Appliances
421,"Decorly Furnishing Water Purifier RO Cover for Kent Grand, Pulse Aqua, Ro Body Cover for Kent Grand Plus. (Blue)",,199,5.0,1,,Kitchen-And-Home-Appliances
422,Usha Janome Gathering Presser Foot for All Usha Janomoe Automatic Sewing Machines,,290,3.8,86,This product will be an excellent pick for you. It comes in a proper packaging.,Kitchen-And-Home-Appliances
