,title,brand,price,rating,reviewCount,description,categories
501,"KINGONE Wireless Charging Pencil (2nd Generation) for iPad with Magnetic and Tilt Sensitive, Palm Rejection, Compatible with Apple iPad Pro 11 inch 1/2/3/4, iPad Pro 12.9 Inch 3/4/5/6, iPad Air 4/5, mini6",Kingone,"2,599",4.4,"2,231","【2023 latest iPad Magnetic Charging】 The latest iPad pen developed by KINGONE provides true wireless charging without cables, just like Apple Pencil2. Automatic Bluetooth pairing and charging. You can keep charging your iPad while you carry it. It also perfectly solves the problems of obvious heating, slow charging, and sudden crash of the iPad when charging other wireless charging styluses. You can use it without any worries【Ultra-High-Precision 0-delay】KINGONE's latest iPad pencil is equipped with the latest ultra-high-precision chip, which solves various problems such as slow response, disconnection, delay, and misalignment of other styluses. Whether you're drawing or taking notes, you can use it comfortably and have the same writing comfort as the Apple Pencil as if you were writing on real paper【Excellent Easy of Use】This iPad stylus uses physical buttons. Compared with other touch switches, there will be no accidental power on/off, which greatly improves the ease of use and experience. 6 major functions such as quick screenshot, handwriting in the text box, shape correction, and return to the [home screen] with a single switch, enjoy iPad anytime, anywhere! Additionally, the nib is interchangeable with Apple Pencil 1st/2nd generation for a wide range of applications【Tilt Sensing & Malfunction Prevention】KINGONE's latest iPad stylus is equipped with anti-palm touch and tilt sensing functions, allowing your hands to rest naturally on the iPad, just like drawing on paper. You can dynamically adjust the thickness of the lines according to the placement angle of the chip, and draw and write as you like. The perfect gift for parents, kids, friends, colleagues, and classmates!【Compatible Models & Warranty】Pay attention to the applicable models! Please check your iPad model before purchasing. Compatible Models: iPad Pro 12.9-inch (3rd/4th/5th/6th generation), iPad Pro 11-inch, iPad Air (3rd/4th generation), iPad mini 6. If you have any questions during use, please don't hesitate to contact us",Electronic_accesories
502,"Redmi LCD Writing Pad with Stylus, 21.59 cm(8.5-inch), Smart Lock, ABS Material, Anti-Blue Light Screen, Handwriting Gifts for Kids & Adults, Black",Redmi,599,4.0,16,"Customized LCD screen: Redmi LCD Writing Pad comes with screen size of 21.6 cm uses a customized LCD film with Blue-green handwriting and a strikingly clear display. Combining the experience of writing on traditional paper with that of smooth LCD Screen.Pressure Sensitive Writing: Thanks to the high-sensitive pressure sensor technology and smooth, flexible LCD Screen, handwriting thickness is determined by the pressure applied, so the harder you press down on the screen, the thicker the handwriting and Viceversa. Use your fingertip or other objects for lag-free writing on the screen, or write with the supplied stylus for best performance.Anti-Blue Light LCD Screen: The screen emits no light and mimics the appearance of ink on paper, preventing eye fatigue after extended use. Pressure sensitive writing, dust-free and ink-free, safe and hygienic.Light Weight Stylus: Weighing lighter than 5g Redmi Writing Pad Stylus can be easily gripped by kids and adults. The surface is designed in a way to make long writing a fatigue freeOne-Press Clear Button: The Zero power LCD screen only consumes a small amount of power when the screen is cleared. The single button cell battery lasts upto ~20,000 cycles of clears later which the coin battery needs to be replaced. Easily clear the screen and start creating something new immediately. Lock Switch: One-tap lock to freeze the content on the screen so the content is not added or deleted.",Electronic_accesories
503,Portronics Adapto ONE POR-1104 3A Fast Charging Adapter with 1M Type C Cable (White),Portronics,290,3.9,"2,192","[3A QUICK CHARGE SINGLE USB PORT]- This Quick Charger charges up to 4x Faster than Normal Chargers. This adapter convert’s 240v AC wall output to 5-12V/1.5A single USB outputs and 1M Type-C cable comes with adaptor also[SAFE, DURABLE & RELIABLE]-Made specifically for Indian sockets, this is BIS approved, this adaptor protects your device from over-heating, over-current and over-charging[COMPACT SIZE]-Slim & Compact and lightweight body (51.15 grams) takes up minimal space and looks elegant too[WIDE COMPATIBILITY]- You can easily charge your smartphone, power bank, mp3 player, wireless headphones etc",Electronic_accesories
504,"boAt Micro USB 550 Stress Resistant, Tangle-Free, Sturdy Cable with 3A Fast Charging & 480mbps Data Transmission, 10000+ Bends Lifespan and Extended 1.5m Length(Martian Red)",boAt,399,4.1,"1,891","It Ensures 3A Fast Charging And Data Transmissions With Rapid Sync At 480 MbpsIts Aluminium Alloy Shell Housing Makes It Last Longer With 10000+ Bends Lifespan With Extended Frame Protection For Superior Strain Relief.The Micro Usb 550 Cable Offers A Perfect 1.5 Meters In Length For Smooth & Hassle-Free User Experience.The Premium Nylon Braided Skin Makes It Tangle Free, Sturdy And Invincible Against External Damage.The Boat Micro Usb 550 Cable Is Compatible With Smartphones, Tablets, Pc Peripherals, Bluetooth Speakers, Power Banks And All Other Devices With Micro Usb Ports2 years warranty from the date of purchase",Electronic_accesories
505,Lenovo Casual Laptop Backpack B210 15.6-inch(39.6cm) Water Repellent Black,,799,4.2,"54,342","Compatible With 15.6"" Laptop : The Lenovo B210 Backpack fits up to 15.6 inch laptop. Dimensions: 34cm x 15cm x 45.5cm; Weight: 453g.High Quality, Durable and Water Repellent Fabric : This backpack features in durable snow yarn polyester fabric and streamlined design with a padded interior to protect notebooks and important itemsConvenient Travel : Adjustable shoulder strap and padded laptop compartment together with a quilted back panel make it comfortable for all-day use. Fits Up To (L x D x H) 255 x 22 x 362 mmConveniently Placed Padded Laptop Compartments and Packets : The padded interior helps protect notebooks and important items. Quick access zippered front pocket for added storage. A quilted back panel make it comfortable for all-day use.High Quality, Casual yet Stylish Design : Very attractive and perfect for school, travel and outdoor activities. The perfect backpack for those needing stylish all-day protection for their laptopThere might be minor color variation between actual product and image shown on screen due to lighting on the photographyIn the Box : 15.6-inch BackpackCountry of Origin: China",Electronic_accesories
506,"DIGITEK® (DRL 12C) Professional (12 inch) LED Ring Light with Tripod Stand for Mobile Phones & Camera, 3 Temperature Mode Dimmable Lighting, Photo-Shoot, Video Shoot, Makeup & More",Digitek,"1,599",4.1,"13,795","[Upgraded Dimmable 12"" Selfie Ring Light] Digitek 12"" ring light adopted newest technology to emit more soft light with 3 colors lighting mode: white, warm yellow and warm white. 12 inch large size and 120 LED bulbs getting you an outstanding look when doing Make-Up, Live Streaming, Selfie, Video chatting, Vlog etc. Each lighting mode have 10 adjustable brightness to choose.[USB POWERED LED LIGHT]The USB ports can be used with multiple devices,such as connect USB charger，mobile power，computer host and laptop.You will be able to enjoy LED ring light at any time freely![PERFECT LED LIGHT DESIGN] The LED ring light is made of special energy-saving LED beads, constant current drive and low power loss,low heat output,safety and environmental protection,lightweight and portable.LED Ring Light 12"" with Cell Phone Holder, Makeup Ring Light Dimmable 3 Light Modes Temperature 3000K-5000K for Streaming, YouTube Video Shooting, Photography LightingFor any product related queries contact our Service Customer Support / Toll Free number 1800-123-544-444 with 12 lines to assist customer from morning 10 am to 6.30 pm Monday to Saturday except Govt. Holidays",Electronic_accesories
507,"Portronics Ruffpad 12E Re-Writable LCD Writing Pad with 30.4cm (12 inch) Writing Area, Single Tap Erase, Smart Lock, Long Battery Life, India's first notepad to save and share your child's first creatives via Ruffpad app on your Smartphone(Black)",Portronics,448,4.0,505,"[LATEST IMPROVED TECHNOLOGY] : Portronics New RuffPad 12E LCD Writing Tablet uses the Newest LCD pressure-sensitive technology and lets you draw thick and thin lines as per your preference based on the pressure on the stylus. It comes with a large 12 inches display. The LCD screen is totally safe, radiation free, glare free, non-toxic, light-weight, comfortable and perfect in your or your little one’s hands.[REUSABLE & ENVIRONMENT FRIENDLY] : The RuffPad 12E lets you do your bit for the environment by saving paper, pencils and erasers but it does not make you compromise on your creativity. The RuffPad 12E is erasable and re-usable making it the ideal tool for you or your child to harness their creative self. Use it to cultivate children's writing and painting ability and interests.[LOCK FUNCTION] : RuffPad 12E comes with and Anti-Erase Lock button that helps you save your or your child’s precious creations and prevents accidental deletion of your written / drawn contents or drafts.[SAVE YOUR DOODLES] : Keep creating and saving your doodles on your smartphone with the Ruffpad available in the IOS and Android stores to look at your notes and doodles from your smartphones.[GREAT FOR ALL AGES] : RuffPad 12E can be put to multiple uses no matter who you are. It is a must have for kids, designers, office goers and is ideal for gifting. Children can use it for writing, arithmetic, spellings or to learn to draw and doodle. Adults can use it to take notes and memorize important information in office. Designers can use it to save their ideas and drafts, no matter where they are.",Electronic_accesories
508,"Tizum Mouse Pad/ Computer Mouse Mat with Anti-Slip Rubber Base | Smooth Mouse Control | Spill-Resistant Surface for Laptop, Notebook, MacBook, Gaming, Laser/ Optical Mouse, 9.4”x 7.9”, Multicolored",Tizum,123,4.4,"3,480","9.4 Inches X 7.9 Inches) 240mm x 200mm x 2mm Size: This mouse pad is ideal for Gamers, Graphic Designers, Students, or anyone using mouse for long sessions. This helps to improve the gaming experience for gamers or the work efficiency in the office.Durable Manufacturing Design with Enhanced Presicion: High-density premium texture which was processed in high temperature and high-pressure chamber to ensure long-term use without deformation and degumming.Ultra-smooth Lycra Cover: Our mouse pad adopts high-quality Lycra cloth on cover for smooth gliding. It was optimized on fast movement while maintaining excellent accuracy and control. It is compatible with mechanical and optical mice.Works with Laser, Optical Mouse, Bluetooth Mouse.Non-slip Rubber Base: The soft and dense non-skid nature rubber base keeps the pad firmly in place. It provides stable operation of the mouse. Just immerse into your work or games without worrying about the annoying mouse pad movement.",Electronic_accesories
509,"Bebop High Speed HDMI Male to Male Cable Supports 4K @ 60Hz, UHD, HDR, 3D Content Ethernet & Audio Return Channel - 4K, UHD, 2160p, 1440p, 1080p, 1080i, 720p, 480p, 480i Latest Version (3 Mtr)",Bebop,499,Previous page,,"Please select appropriate display resolution & refresh rate for proper display output. HDMI A Male to A Male Cable: Supports Ethernet, 3D, 4K video and Audio Return Channel (ARC)Connects Blu-ray players, Fire TV, Apple TV, PS4, PS3, XBox one, Xbox 360, computers and other HDMI-enabled devices to TVs, displays, A/V receivers and moreCable allows you to share an Internet connection among multiple devices without the need for a separate Ethernet cableMeets HDMI 2.0 standards (4K Video at 60 Hz, 2160p, 48 bit/px color depth) that supports bandwidth up to 18Gbps and backwards compatible with earlier versionsCable Length 1.5 meters",Electronic_accesories
510,ARMOUR GUARDS JEEP MERIDIAN (10.1Inch) Car Accessories Navigation or Music System Stereo Touch Screen Guard (Transparent),ARMOUR GUARDS,450,2.6,3,"SUPERIOR PROTECTION. 9H Hardness with 0.26mm Thickness, this glass cover maintains the touch capabilities of your GPS Navigator/ Infotainment system while ensuring better smooth touch feeling, Anti-Scratch & Anti-explosion.CRISP AND CLEAR VISUALS. Installing the screen cover will not affect the color, icon size and touch screen capabilities of your GPS display. It will only keep it safe from dust, scratches, oil, water and fingerprints etc.NO MORE FINGERPRINT SMUDGES. Layered with an oleophobic hydrophobic coating that repels oil left from your fingerprints and adds an additional smoothness to the navigating screen.LASER CUT SCREEN GUARD FOR PRECISE FIT. No need to trim the edges, as it is compatible with JEEP MERIDIAN infotainment system.ENJOY HASSLE-FREE CLEANING. To keep your GPS screen protector clear and dust-free, simply wipe it with a microfiber cloth. No need to use harmful cleaning substances.",Electronic_accesories
511,"VIBLITZ® Background Accessories (Backdrop Stand & Background Curtains kit, Backdrop Stand & Background Curtains kit)",,"2,700",3.0,1,"Contents: (3) x, top pipe | (2) x 9ft Support Stands |(1) x Heavy Duty Portable Carry Bag | (1) x Curtains (Black)Professional lightweight photo backdrop stand kit, STELL construction for DURABILITY & PORTABILITYExtendable crossbar & support stand: width adjustable(5 ft.–9 ft.) & height adjustable (2.6 ft.–9ft.)head adapter fits onto support stand, equipped with 1/4"" standard screw, suitable for a variety of FLASH LIGHT, LED LIGHTFor any Product related query reach out to brand @ Toll free Number 1800121000251 Mon to sat 6 days a week 10am to 6pm, Email : contact@hiffin.in",Electronic_accesories
512,TheGiftKart Shockproof Crystal Clear Back Cover Case for OnePlus 11R 5G | 360 Degree Protection | Protective Design | Transparent Back Cover Case for OnePlus 11R 5G (Black Bumper),TheGiftKart,275,3.7,20,Compatible with OnePlus 11R 5G OnlyCrystal Clear Non Yellowing Transparent BackShock Proof & Protective Case360 Degree Protection DesignSleek and Lightweight Profile,Electronic_accesories
513,"TOUGH LEE 5 in 1 Cleaning Pen for Airpods Pro 1 2 3, Gadget Cleaner & Cleaning Kit Brush Set || Suitable for Earbuds, Mobile, Laptop, Keyboard, Airpod Charging Case, Headphone & Earphone",,227,4.1,422,"✅ ORGANIZED DOUBLE HEAD DESIGN: 5-in-1 computer cleaning kit with Nylon Bristles Brush, Flocking Sponge, High-density Brush, Metal Pen Tip and Keycap Puller, double head hidden is specifically design to meet a variety of cleaning of different gadgets we use every day. It is the best Keyboard Cleanning Kits, 5 in 1 Dust Cleaner Brush for Computer/Cell Phone/Earphone AirPods/PC/Laptop/Keyboard(with Key Puller).✅ MULTI-FUNCTIONAL CLEANER SET: Our multifunctional Cleaning Kit contains Flocking sponge which can be used to clean the dust in the wireless charging case of the earphone. Also, high-density brush can clean the dirt on the sound outlet hole of the earphone. The metal pen tip can be used to clean the stubborn dust on the earbuds.✅ HOW TO USE IT: The cleaning tool comes in 2 components a brush and a pen. You need to open the pen to access the metal cleaning pen tool and pull out the metal cleaning pen tool to access the Flocking Sponge✅ ALL IN ONE TOOL: 5 in 1 keyboard and earphone cleaner has 4 kinds of cleaning head for multi-purpose deep cleaning every corner of the keyboard earphones. It is now easy to pull keys with a simple key puller, the change of key cap is no more laborious and the removal of key cap is cleaner, more thorough and safe.✅ PROFESSIONAL & PORTABLE: Easy enough to carry in your bag. Professional enough to give your electronic device a neat and clean look",Electronic_accesories
514,"Portronics Konnect L 1.2Mtr, Fast Charging 3A Micro USB Cable with Charge & Sync Function (Grey)",Portronics,149,4.3,"7,313","MORE DURABLE- Konnect L Micro cable is unique in terms of design and multi-use and is positioned to provide the best comfort and performance while usingHIGH QUALITY MATERIAL- TPE + Nylon material to make sure that the life of the cable is enhanced significantlyCOMPATIBILITY- Compatible with most Android smartphones, windows phone, tablets, PC peripherals and other micro USB compatible devicesCHARGE and SYNC FUNCTION- It comes with Fast Charging and quick Sync FunctionLONG CORD- The Cable is extra thick 1.2 meter long, optimized for an easy use for your comfort at home or office",Electronic_accesories
515,"Gizga Essentials Laptop Bag Sleeve Case Cover Pouch with Handle for 15.6 Inch Laptop for Men & Women, Padded Laptop Compartment, Premium Zipper Closure, Water Repellent Nylon Fabric, Grey",GIZGA essentials,332,4.2,"2,017","Innovative Design: This Laptop Case is made of Soft Nylon Material inside which protects your device from scratches and also has foam cushion around which insure 360˚ protection to your laptop.Slim Profile: The slim design of Laptop handle sleeve allows men, women, girl, boy, college student you to use as a standalone case and carry only the essentials or place in your bag for added protection and Laptop is safe, easy to access, and glide smoothly and also has Front Accessories Hidden Pocket for your belonging.A much Safer Way to Carry Laptop: The Laptop Sleeve Case Cover is made of four layer protective material like Premium Nylon Fabric which protects your accessories from scratches and bumps.Designed for most 15.6 Inch Laptops and Ultrabook’s, Maximum Fit Size, and easy to use, practical design and exquisite workmanship.External Dimension: 28 cm X 42.5 cm X 3.5 cm, Light Weight: 168 Grams.",Electronic_accesories
516,HUMBLE® Spiral Charger Cable Protector Data Cable Saver Charging Cord Protective Cable Cover Set of 2 (8 Pieces),HUMBLE,109,4.1,"15,654","☛ 『Protect cables』: the cable protector was designed with highly flexible silicone, which can be applied as phone charger saver and charger protector to completely protect cables for all devices such as cell phones, computers, laptops, mouse cable, etc..☛ 『Protection effect』: these cable saver protectors can protect wires and power cords from dirt, frays, tangles and knots; Reduce the risk of fraying and breaking.☛ 『Touch comfortable』: the wiring protector is made of good quality TPU material, soft and touch comfortable, which can be applied to protect your headphone cords, charger cables and so on.☛『 Prolong life of cables』: the charger cable saver will help to prolong the life of your cable even the cable has been damaged.☛ 『Easy to install』: a detailed usage is provided; All you need to do is install according to the steps in the manual.",Electronic_accesories
517,"LCD Writing Tablet 8.5 Inch Screen, Toys for Kids, LCD Writing pad, Writing Tablet, Toys for 5+ Years, E-Note Pad, Educational Toys, Paperless Electronic Digital Slate (Multicolor)",Generic,125,4.4,14,"Pressure-sensitive screen lets you create thick and thin lines.Tablet displays your notes until you erase them with the touch of a button, One-touch button erases notes instantly.Durable case and recessed screen are safe for school, travel and home use.",Electronic_accesories
518,"ELV Aluminium Adjustable Mobile Phone Foldable Holder Tabletop Stand Dock Mount for All Smartphones, Tabs, Kindle, iPad (Moonlight Silver)",Elv,314,4.5,"29,646","Multi-angle adjustable stand: Free rotation of 270 degree viewing angle ensure the perfect angle of view and enhance the audio/video experienceStylish design: Durable aluminum body, with a sturdy construction, can hold your phone steadilyEnjoy life: It's convenient to cook meals when you learn cooking through video teaching, without worrying about soiling the smartphonesAnti-slip pad: The anti-slip pad works perfect to keep your devices in place while in use and prevent from daily scratches and slidingFully foldable: ELV cell phone stand for desk can be fully folded to pocket-size, which will save you plenty of space and make it easy to carry anywhere; Very convenient for daily life1 year warranty provided by the manufacturer from date of purchase",Electronic_accesories
519,"URBN 20000 mAh lithium_polymer Power Bank with 12 Watt Fast Charging, Camo",URBN,"1,499",3.9,"36,910","Proudly Made In IndiaIt will charge a 3000mAh phone battery up to 4.7 times & It will charge a 4000mAh phone battery up to 3.5 timesDual USB Output 2.4 Amp 5V Fast ChargeCompact body along with smooth touch finish gives the Power Bank its premium look, weighs only 354 gramsMicro USB Input. Takes up to 10-12 hours to charge the power bank",Electronic_accesories
520,CASE PLUS 3.5 mm Headphone Jack Lightning Adapter Connector Only Supported Music Control Audio Adapter for iPhone-New - 2023 (1),CASE PLUS,275,3.8,"1,239",Case Plus 3.5 mm Headphone Jack Lightning Adapter Connector Only Supported Music Control Audio Adapter for iPhone,Electronic_accesories
521,VMT Stock Xundd Back Cover Case Compatible with OnePlus 11R 5G (Armor | Clear PC and TPU),VMT STOCK WITH DEVICE,259,3.9,15,Color Name: Black Color TPU Bumper + Clear PCCase Cover Type: Shockproof TPU Bumper + Clear PC (Never turns yellow)Certification: This XUNDD Designed Case has received Official MIL-STD 810G Drop Test Certification by SGS [Shock Proof Edges] All 4 corners have Air Cushions which Absorbs Shock and keeps your phone safe,Electronic_accesories
522,"Amazon Basics 38W Mini Car Charger with Dual Output, Fast Charging (Type C 20W + Type A 18W) Compatible with All Smartphones (Black)",Amazon Basics,699,4.3,"4,127","With multiple safety certifications and built-in smart chip, Amazon Basics car charger with intelligent control chip offers multiple protection against overcurrent, short-circuit, overvoltage, under-voltage, over-temperature, overpower protection, which will guard the safety of your devices.With fast charging mode, this car charger can up to 3X faster on charging speed, can fast charge Note 10/10+, iPhone 11-14 Series, iPhone X/XS/XR/8s/SE, Pixel/8 Plu 3/3a/4/XL, etc.With tiny thumb-sized body, this car charger fits comfortably with car sockets, no extra space occupied. Dual USB ports can charge two devices simultaneously, compatible with all devices as long as compatible connector cables with USB C or A port are used.Amazon Basics car charger can charge 2 devices simultaneously at full speed with 3A in each port. The maximum total power can reach 38W, providing you with a high-speed and convenient charging experience on the go.With perfect snap-in design, Amazon Basics car charger tightly locks in the car socket. It is able to secure charging even on the bumpy roads, preventing poor contact and power outage caused by vibration during driving.",Electronic_accesories
523,"FLiX (Beetel USB to Micro USB PVC Data Sync & 2A Fast Charging Cable, Made in India, 480Mbps Data Sync, Solid Cable, 1 Meter Long USB Cable for Micro USB Devices (White)(XCD-M11)",FLiX,59,4.0,"9,958","Micro USB charging cable for android phones and any other device with Micro USB PortCharge & sync, this USB cable can charge and data sync simultaneously at 480Mbps speed, compatible with all devices with a Micro USB port. Core : Tinned CopperDurable PVC Outer Exterior: PVC cables are versatile, high in tensile strength, flexible, and good conductors.micro USB cable is 1 meter in length, optimized for easy use for your comfort at home or office, helps you to overcome distance restrictions.",Electronic_accesories
524,PHONOKART ADAM Plus Charger with Micro Cable,Phonokart,278,Only 1 left in stock.,,12 Watts(2.4 Amps) Charger with Cable,Electronic_accesories
