,title,brand,price,rating,reviewCount,description,categories
181,ARMOUR GUARDS HYUNDAI CRETA 2020 (10.25 INCH) Car Infotainment System Accessories Unbreakable Screen Guard (Petrol & Diesel) (Transparent),ARMOUR GUARDS,293,4.1,"1,162","✔ SUPERIOR PROTECTION. 9H Hardness with 0.26mm Thickness, this glass cover maintains the touch capabilities of your GPS Navigator/ Infotainment system while ensuring better smooth touch feeling, Anti-Scratch & Anti-explosion.✔ CRISP AND CLEAR VISUALS. Installing the screen cover will not affect the color, icon size and touch screen capabilities of your GPS display. It will only keep it safe from dust, scratches, oil, water and fingerprints etc.✔ NO MORE FINGERPRINT SMUDGES. Layered with an oleophobic hydrophobic coating that repels oil left from your fingerprints and adds an additional smoothness to the navigating screen.✔ LASER CUT SCREEN GUARD FOR PRECISE FIT. No need to trim the edges, as it is compatible with HYUNDAI Venue SX (Diesel) infotainment system.✔ ENJOY HASSLE-FREE CLEANING. To keep your GPS screen protector clear and dust-free, simply wipe it with a microfiber cloth. No need to use harmful cleaning substances.",Electronic_accesories
182,ARMOUR GUARDS JEEP MERIDIAN (10.1Inch) Car Accessories Navigation or Music System Stereo Touch Screen Guard (Transparent),ARMOUR GUARDS,450,2.6,3,"SUPERIOR PROTECTION. 9H Hardness with 0.26mm Thickness, this glass cover maintains the touch capabilities of your GPS Navigator/ Infotainment system while ensuring better smooth touch feeling, Anti-Scratch & Anti-explosion.CRISP AND CLEAR VISUALS. Installing the screen cover will not affect the color, icon size and touch screen capabilities of your GPS display. It will only keep it safe from dust, scratches, oil, water and fingerprints etc.NO MORE FINGERPRINT SMUDGES. Layered with an oleophobic hydrophobic coating that repels oil left from your fingerprints and adds an additional smoothness to the navigating screen.LASER CUT SCREEN GUARD FOR PRECISE FIT. No need to trim the edges, as it is compatible with JEEP MERIDIAN infotainment system.ENJOY HASSLE-FREE CLEANING. To keep your GPS screen protector clear and dust-free, simply wipe it with a microfiber cloth. No need to use harmful cleaning substances.",Electronic_accesories
183,"Portronics Ruffpad 15 Re-Writable LCD Screen 38.1cm (15-inch) Writing Pad for Drawing, Playing, Handwriting Gifts for Kids & Adults (Grey)",Portronics,"1,098",4.3,"3,713","[REWRITABLE LCD NOTEPAD] : The LCD notepad is the perfect tool for drawing, writing, taking notes, and being creative. Save yourself from the hassle of finding paper for your tiny notes, or ruining your diaries with doodles, just grab the Ruffpad 15 and get started.[EXTRA-LARGE & ULTRA-THIN] : The extra comfortable 15-inch LCD writing pad is bigger and better and is easy to store anywhere. Its lightweight and compact design allows you to carry your art wherever you go. Comes with magnetic strips on the backside and sticks to any metal base.[SMART LOCK] : With a single tap, switch on the in-built lock to guard your messages, drawings, or notes against being accidentally erased. No accidental erasing of content with this built-in lock button- safety at the tap of a button.[SINGLE-TAP ERASE] : A single tap on the ‘Clear’ button conveniently erases the content on the LCD Writing tablet, instantly. Keep that trash empty, and your content safe. Also protects your vision by being radiation-free, has no glowing colors or glares, and is fit for long hours- extra safe for your kids too!",Electronic_accesories
184,"Portronics Toad One Wireless 2.4GHz & Bluetooth Connectivity Optical Mouse with 7 Colors RGB Lights, Rechargeable Battery(Black)",Portronics,599,4.1,95,"[WIRELESS FREEDOM] - Enjoy up to a 10-meter wireless connection with the Toad One wireless mouse’s tiny plug-and-forget nano dongle. No software or driver installation is needed. The mouse automatically connects to your computer system. It is ready to go when you are.[ADJUSTABLE DPI RESOLUTION] - With the button to adjust DPI resolution, now adjust your mouse sensitivity as per your requirement. This feature gives you more room to enhance your gaming skills and even work on editing with pixel-based simplicity.[CARRY IT ANYWHERE, EVERYWHERE] - Toad One wireless optical mouse is the perfect accessory for those who travel for work, executives who give presentations, or anyone who wants greater control and freedom.[ADDING COLOURS TO LIFE] - This wireless optical mouse comes with a lighting feature to make your working experience a colourful one. Moreover, Toad One gives you 7 coloured light functionality to adjust the lighting as per your desire.[BATTERY THAT DOESN’T DIE EASILY] - This optical sensor mouse comes with a rechargeable battery through its Type-C charging port. Now work seamlessly for up to 9 days without any breaks or disruption",Electronic_accesories
185,"AirCase Protective Laptop Bag Sleeve fits Upto 13.3"" Laptop/ MacBook, Wrinkle Free, Padded, Waterproof Light Neoprene case Cover Pouch, for Men & Women, Black- 6 Months Warranty",AirCase,427,4.4,"9,114","Innovative Design: This Laptop Case is made of soft puffy fabric inside which protect your device from scratches and also has 3D foam cushion around which insure 360 ̊ protection to your laptop.Slim Profile: The slim design of Laptop sleeve allows men, women, girl, boy, college student you to use as a standalone case.Carry only the essentials or place in your bag for added protection and computer is safe, easy to access, and glide smoothly.Laptop Sleeve Case Cover is made of 4 layer protective material like High elastic canvas fabric,water-resistance neoprene,Impact-resistance neoprene,soft fluffy fabric.COMPATIBLE for all the major brands of 13.3-Inches Laptops",Electronic_accesories
186,boAt Dual Port Rapid 120V Car Charger (Qualcomm Certified) Smart Charging for Cellular Phones with Quick Charge 3.0 + Free Type C USB Cable Black,BoAt,599,4.3,"21,527","Charges compatible devices up to 4 times faster with qualcomm quick charge 3.0 technologyCompatible with all USB and type c powered devices including quick charge 2.0 etcBuilt-in safeguards to protect your devices against excessive current, overheating and overchargingBoAt rapid charge comes with exclusive smart IC optimum smart charging technology for apple and other non-qualcomm quick charge enabled devices up to 5 v per 3A",Electronic_accesories
187,"Portronics CarPower Mini Car Charger with Dual Output, Fast Charging (Type C PD 18W + QC 3.0A) Compatible with All Smartphones(Black)",Portronics,339,4.2,"5,313","[POWERFUL DUAL PORTS]: It is one most powerful car charging device that provides 18W output with dual ports. You can simultaneously charge two devices at one go.[COMPACT SIZE & PERFECT FIT]: Portronics Car Power Mini has the most compact size that can be installed in any dashboard. It is one powerful charging device for your car with Type C PD 18W + QC 3.0A. It is compatible with all most all car models.[FASTEST CHARGING]: With Portronics Car Power Mini, you can experience fastest charging. It provides you 50% charging at 30 minutes and it can be considered as one of the best travel partner for you.[ULTRA-LIGHT CAR CHARGING]: Along with the most compact size, it is one device that is ultra-light in weight. The entire device is just 15.3 gms, 5.5 cm in height and 2.5cm in diameter.[SMART PROTECTION CHIPS]: It has in-built smart protection chip that ensure protection from over-voltage, over- temperature, and prevent short circuits.",Electronic_accesories
188,"ZEBRONICS Zeb-Comfort Wired USB Mouse, 3-Button, 1000 DPI Optical Sensor, Plug & Play, for Windows/Mac, Black",ZEBRONICS,139,3.8,"3,468","DESIGN: Zeb Comfort+ is an ergonomically designed USB Optical mouse that has an easy plug-and-play mechanism.BUTTONS: The mouse comes with 3 buttons including the left-click, right-click, and scroll wheel buttons.OPTICAL SENSOR: The mouse has an accurate optical sensor for navigation with 1000 DPI.CABLE LENGTH: 1.2 MetresHardware Platform: Pc; Operating System: Windows 7",Electronic_accesories
189,"Redgear Pro Wireless Gamepad with 2.4GHz Wireless Technology, Integrated Dual Intensity Motor, Illuminated Keys for PC(Compatible with Windows 7/8/8.1/10 only)",Redgear,"1,699",4.2,"26,181","Gamepad comes equipped with2.4GHz wireless technology and supports up to 10 metres range, an ideal choice for those looking to enjoy your favourite games without the hassle of cables and wires.;The built-in lithium-ion battery in the gamepad can provide uninterrupted gameplay for up to 2 hours in a single charge for upto 30-minuteIntegrated dual intensity motor which allows a realistic gaming experience.Integrated force feedback. Reset : When an exception occurs, such as Keys disorder, or crash, unable to connect. Remove the USB connection from the gamepad and device and reconnect.The gamepad comes with illuminated keys on the back which light up and allow visibility even in low light conditions.; 1 year warranty from the date of purchaseItem Width: 74.0 mm; Item Weight: 340.0 Grams; Item Length: 180.0 mm; Power Source Type: Battery Powered; Item Height: 156.0 mm; Color Name: Black",Electronic_accesories
190,Zerfa 5 in 1 Soft Brush Multi-Function Cleaning Tools Kit for Keyboard & Earphone Cleaner Soft High-Density Brush Set with Keycap Puller Corner Gap Duster Gadget for Laptop Air pods Pro Camera Lens,Zerfa,199,4.3,922,"SEPARATED DUAL HEAD DESIGN : 5-in-1 Computer Cleaning Kit With Nylon Bristles, Flocking Sponge, High-density Brush, Metal Pen Tip And Keycap Puller, Dual Head Hidden Design To Meet A Variety Of Cleaning Needs.EASY TO PULL KEYS : With A Simple Key Puller, The Change Of Key Cap Is No Longer Laborious And The Removal Of Key Cap Is Cleaner And More Thorough.EASY TO DEAL WITH ALL KINDS OF CLEANING NEEDS : 4 Kinds Of Cleaning Head, Multi-purpose, Deep Cleaning Every Corner Of The Keyboard And Earphones, Make Dust Nowhere To Hide.SOFT BRUSH DOES NOT HURT KEYBOARD : Special Selection Of Nylon Brush With Moderate Softness And Hardness, Three-row Design With High Pore Strength, Good Elasticity, Stiffness And Compactness, More Labor-saving Friction.MULTIFUNCTIONAL CLEANING KIT : Flocking Sponge Can Clean The Dust In The Wireless Charging Case Of The Earphone. High-density Brush Can Clean The Dirt On The Sound Outlet Hole Of The Earphone. Metal Pen Tip Can Clean The Stubborn Dust.",Electronic_accesories
191,"Ambrane 20000mAh Power Bank with 20W Fast Charging, Triple Output, Power Delivery, Type C Input, Made in India, Multi-Layer Protection, Li-Polymer + Type C Cable (Stylo-20k, Black)",Ambrane,"1,699",4.0,"19,661","Massive 20000mAh Lithium Polymer capacity allows you to charge your devices multiple times. It can charge iPhone 12 – 4.6 times, Samsung M11 – 2.6 times, iPad – 1.4 times20W Fast charging output– Powerful 20 Watts PD and QC output for exhilarating charging speed, do you a great favour in an emergency. For instance, it can bring your new iPhone or android device back to 50% in as quickly as 30 minutes.Can Charge iPhone 8 upto 50% in 30 minutes or Redmi Note 9 up to 30% in 30 minutes20W Fast Charging Input – The powerbank itself can get charged in 7 to 8 hours as it has Power Delivery Technology that supports 20W fast charging input via Type C port.Charge 3 devices – With 2 USB ports and 1 Type C port for output, it can charge 3 devices at the same time & It comes with a 6 months warranty against manufacturing defects.",Electronic_accesories
192,"Mi 5V Charger|10W Wall Charger with USB Cable|Compatible for Mobile, Headphones, TWS, Game Console, Power Banks|Fast Charging + Quick Data Transfer + BIS Certified|(Adapter+USB to Micro USB Cable)",MI,499,4.2,"22,216","Compatible with all devices with micro USB port charging port including smart phone, bluetooth headsets, speakers, smartwatches, powerbanks. Output Current : 2 A. Customer CareOutput Power : 10W with upto 480 mbps data transfer speed via the cable, Input port : 50 - 60 Hz",Electronic_accesories
193,"Dyazo 6 Angles Adjustable Aluminum Ergonomic Foldable Portable Tabletop Laptop/Desktop Riser Stand Holder Compatible for MacBook, HP, Dell, Lenovo & All Other Notebook (Silver)",Dyazo,599,4.3,"5,301","Dyazo Height Adjusting Laptop Stand Or Laptop Ergonomic Stand Or Laptop Stands For Office Desk Improves Your Posture Scientifically Designed To Help You Balance You’re Sitting Posture Keeping Your Back Straight, Neck Relaxed And Wrists Natural Even After Long Work HoursMulti-Angle Adjustable Design: The Aluminium Laptop Stand Or Metal Laptop Stand Or Foldable Laptop Stand Or Better Known As A Aluminum Laptop Stand Provides 6-Speed Adjustable Height, Adjust To Comfortable Operating Angle And Height Based On Your Actual Need. And The Ergonomic Design Makes For Easy Watching And Typing, Relieving Neck, Shoulder And Spinal Pain.Compatibility: The Laptop & Tablet Stand Supports Most Devices From 10 - 15.6 Inches: Macbook, Thinkpad, Surface, Chromebook, Ipad Pro, Etc. Therefore Known As A 11.6 Inch Laptop Stand ,12 Inch Laptop Stand , 13.3 Inch Laptop Stand ,15 Inch Laptop Stans & 15.6 Inch Laptop StandDyazo Travel Laptop Stand Or Laptop Stand Metal Is A Laptop Foldable Stand Which You Can Fold And Carry Easly In Your Backpack Or Briefcase You Can Use It To Change Angle Of Your Laptop Therefore Use It As Laptop Incline Stand Or Laptop Height StandLaptop stand fully foldable, light weight at 260gm only and extremely handy to carry in your office bag [Increases laptop life]-keeps your laptop cooler so the battery life and internal components life also improvesEXQUISITE WORKMANSHIP: Machined from anodized aluminum alloy, with sand blasted and brushed processes. With Non-slip silicone mat, avoid from risking of any scratches to your devices and stable placement makes it the best laptop stand available in the marketOne year warranty",Electronic_accesories
194,"Ant Value FKBRI02 / Spill-Resistant, Silent Keys, DPI Mouse & KB Combo Wired Desktop KB, USB Keyboard Mouse Set (Black) Gaming mouse and Gaming keyboard",,349,3.9,17,"Ant Value FKBRI02 USB Wired Keyboard & USB Optical Mouse comboSlim Design, Soft Touch Keys, Laser Printed Keys, Full-size keyboard, Comfortable & Quiet typingHigh Quality Internal Key Membrane & Compact dimensionsMatte Surface, Ergonomic Design, 800 dpi optical mouse sensorCompatible with PS4, PS5 & Xbox",Electronic_accesories
195,"Bebop High Speed HDMI Male to Male Cable Supports 4K @ 60Hz, UHD, HDR, 3D Content Ethernet & Audio Return Channel - 4K, UHD, 2160p, 1440p, 1080p, 1080i, 720p, 480p, 480i Latest Version (3 Mtr)",Bebop,499,Previous page,,"Please select appropriate display resolution & refresh rate for proper display output. HDMI A Male to A Male Cable: Supports Ethernet, 3D, 4K video and Audio Return Channel (ARC)Connects Blu-ray players, Fire TV, Apple TV, PS4, PS3, XBox one, Xbox 360, computers and other HDMI-enabled devices to TVs, displays, A/V receivers and moreCable allows you to share an Internet connection among multiple devices without the need for a separate Ethernet cableMeets HDMI 2.0 standards (4K Video at 60 Hz, 2160p, 48 bit/px color depth) that supports bandwidth up to 18Gbps and backwards compatible with earlier versionsCable Length 1.5 meters",Electronic_accesories
196,"PROAIM SnapRig Universal Height Adjustable DSLR & DSLM Camera Cage with Top & Side Handles I Aluminum Made I Cold Shoe, Tripod & Accessory Mounting Options (CG219)",Proaim,"9,555",Only 1 left in stock.,,"PROAIM SnapRig Universal DSLR DSLM Camera Cage is a modular half cage that protects your camera, offers better mobility, comfy handheld use, and mounting flexibilityIt has a top handle that mounts on a top cheese plate, providing a secure grip for holding the camera at low anglesThe cage mounts directly to tripods with a 1/4""-20 or 3/8""-16 threaded mount &has multiple universal connections for mounting additional accessoriesIt has extendable side support that comes with two slide bars fitting different camera heights100% customer satisfaction guarantee; Buy with confidence",Electronic_accesories
197,"HIFFIN® Photography Accessories Backdrop Photo Light Studio Muslin Background Stand Backdrop Support System Kit (Stand with Curtain, White)",,"2,399",3.9,"1,327","Contents: (1) x, top pipe | (2) x 9ft Support Stands | (3) x Clip | (1) x Heavy Duty Portable Carry Bag | (1) x Curtains (white)Professional lightweight photo backdrop stand kit, STELL construction for DURABILITY & PORTABILITYExtendable crossbar & support stand: width adjustable(5 ft.–9 ft.) & height adjustable (2.6 ft.–9ft.)For any Product related query reach out to brand @ Toll free Number 1800121000251 Mon to sat 6 days a week 10am to 6pm, Email : contact@hiffin.in",Electronic_accesories
198,"Cyber Acoustics 3.5mm Stereo Headset (AC-5002) with Headphones and Noise Canceling Microphone for PCs, Tablets, and Cell Phones in The Classroom or Home…",Cyber Acoustics,"1,899",4.2,"18,454","Stereo Headset: Padded earcup and headband with in-line control on cable for easy access to control audio volume. Unidirectional microphone minimizes unwanted noise. Microphone only picks up sound from a specific side or direction of the microphone, minimizing ambient noise while speaking or recording. Perfect for K12 classrooms or home.Universal Fit: With an adjustable microphone boom, headband and leatherette earpads, this headset can be adjusted to fit most head sizes. Designed to be worn with the microphone boom on the left- or right-hand side.Durable Design: Adjustable headband with easy to clean leatherette earpads. Headset and tangle free braided TuffCord cable are designed for hard wearing and to be long lasting.Easy to Use: Simply plug in and play, no installation needed. Connect 3.5mm cable directly to your Mac, PC or any electronic device with a 3.5mm audio jack connection.Includes: Cyber Acoustics AC-5002 Analog Headset and User Guide. Includes 1 year factory warranty.",Electronic_accesories
199,Adofys 3 in 1 Bullet Time Handle with Foldable Tripod Extension Monpod Rod for Insta 360 One X 2 / Insta360 One X Accessories,ADOFYS,"2,869",3.9,143,"⭐ The handle and selfie are forInsta360 One x / Insta360 One/ Insta 360 one x 2 and one R series , and designed for bullet time shooting; Stick is invisible in photos and videos.⭐ Super lightweight convenient to carry around, thanks to the hidden retractable design,11 inches You can put it in pockets or other small bags. Whenver you want to record a beautiful moment, it always be there. It's only 46 inches for extension max.⭐ The 360 degrees rotation handle Stick are both sturdy, and easy to extend, Bullet time handle thread anti-smashing grip has a texture. Rotate stick to left to lock,and rotate stick to right to loosen.Handle bar is slippery-proof; There is standard 1/4"" screw at the bottom of handle.⭐ What's more, you will be using it as a desktop phone holder, doing live internet broadcast, binge-watching TV shows, etc. With a very flexible adjustable view height, the nape ache, shoulder pain will be substantially reduced.You can use it for a close self-photography or extend it to get a larger scenery.⭐ Material: Aluminum alloy + ABS, aerospace aluminum alloy material opens a new era of self-timer.⭐ As Handle or Tripod: The handle can be mounted on the selfie stick and you can make yourself a complete set accessories for bullet time camera. It can also be used as tripod, working tripod height is about 14.2cm / 5.59in",Electronic_accesories
200,Ferilinso [6-in-1 for Apple iPhone 14 & 13 Screen Protector Guard Accessories 3 Pack 9H Tempered Glass 3 Pack HD Camera Lens Protector Cover Protection Case Friendly mounting Frame,Ferilinso,"1,062",4.5,"3,375","❤️Cost-effective All-round Protection: Committed to providing one-stop purchase experience, no need spend more on other accessories. The Ferilinso 6-in-1 bundle includes: [3ⅩGlass Screen Protector for iPhone 14 & iPhone 13] [3ⅩCamera Protector for iPhone 14 & iPhone 13] [1Ⅹfull set of installation tools, Includes mounting frame and cleaning kit]Military-grade shatterproof: Glass by Ferilinso is glass adopts the same glass that is generally used in military and government areas, High quality materials combined with German-engineered technology, with extraordinary strength. (Awarded SGS Certification) Its hardness is much higher than other products on the market. Your screen is certified to survive even 10Ft drop to hard ground. What a remarkable achievement!Reinforced edge & Original touch: Heat treatment technology enhances the toughness of each edge, Provides edge-to-edge invisible protection for the entire iPhone 14 & iPhone 13 screen with no adverse effects. Maintains the classic look of your beloved Phone while providing full and lasting protection. Hydrophobic coating on top effectively reduces fingerprints and smudges by 98%, so your fingertips enjoy a smooth feel with every swipe.Camera Protector & Case-Friendly: Ferilinso camera protector made of 9H glass effectively protect entire lens from drops, scratches, other accidents and not easy to fall off. Special designed Black circle compatible night shooting function, brings you the original of beauty to every photo and video. This camera and screen protector designed to be compatible with most cases. Extra slight space around the bezel allows your case to wrap around the edge of your device without any interference.Face ID Compatible and Easy To Install: Precisely cut for the iPhone 14 & iPhone 13 6.1 inch, this tempered glass does not interfere with the Face ID feature. Comes with precision installation frame and complete cleaning kit, made the install very easy. We are committed to providing good service to every customer, whatever problems, You can send us information through Amazon's Message Center, we will provide you with satisfactory service within 24 hours.",Electronic_accesories
201,"Portronics Ruffpad 15 Re-Writable LCD Screen 38.1cm (15-inch) Writing Pad for Drawing, Playing, Handwriting Gifts for Kids & Adults (Grey)",Portronics,"1,098",4.3,"3,713","[REWRITABLE LCD NOTEPAD] : The LCD notepad is the perfect tool for drawing, writing, taking notes, and being creative. Save yourself from the hassle of finding paper for your tiny notes, or ruining your diaries with doodles, just grab the Ruffpad 15 and get started.[EXTRA-LARGE & ULTRA-THIN] : The extra comfortable 15-inch LCD writing pad is bigger and better and is easy to store anywhere. Its lightweight and compact design allows you to carry your art wherever you go. Comes with magnetic strips on the backside and sticks to any metal base.[SMART LOCK] : With a single tap, switch on the in-built lock to guard your messages, drawings, or notes against being accidentally erased. No accidental erasing of content with this built-in lock button- safety at the tap of a button.[SINGLE-TAP ERASE] : A single tap on the ‘Clear’ button conveniently erases the content on the LCD Writing tablet, instantly. Keep that trash empty, and your content safe. Also protects your vision by being radiation-free, has no glowing colors or glares, and is fit for long hours- extra safe for your kids too!",Electronic_accesories
202,"Wesley Milestone 2.0 Casual Waterproof Laptop Backpack/Office Bag/School Bag/College Bag/Business Bag/Travel Backpack (Dimensions:13x18 inches) (Compatible with 39.62cm(15.6inch laptop) 30 L, Charcoal black",,565,4.3,"9,666","30L Capacity: The Backpack has a padded laptop compartment that can fit 15.6 inch laptop. It can also accommodate essentials such as a Lunch box, Charger, Tablet, Books, Power Bank, Wallet, and Sunglass.Multi-Level Organizer: The backpack has a front zipper pocket for the ID card, Sanitizer, House keys, Pen. First compartment with pockets for the earphones, pens, notebook, Fitness Band. Spacious second compartment for all your electronics. Compatible Laptop Size 16 inchErgonomic Design: Thick cushioning around the shoulders and on the back panel makes the backpack super light and comfortable on the move. “S” Shaped shoulder strap distribute the weight of the backpack across your upper body.Made In India: Wesley Business Casual Backpack is fully manufactured in India and pass through stringent quality tests and checks1 Year Warranty: The Wesley Business casual backpack comes with 1 year of warrantyWater Resistant Material: Advanced IPX4 coating on the material ensures resistance to water entering from any direction.",Electronic_accesories
203,"Hp Wired On Ear Headphones With Mic With 3.5 Mm Drivers, In-Built Noise Cancelling, Foldable And Adjustable For Laptop/Pc/Office/Home/ 1 Year Warranty (B4B09Pa)",HP,599,3.5,"7,441",Powerful bass and clear treble soundsWired connectivityIdeal for long hours of listening. Enhanced Connectivity with 3.5mm DriversSuperior sound quality and lengthy cable for easy of useCompact and durable1 year manufacturer warranty on the device from the date of purchase,Electronic_accesories
