,title,brand,price,rating,reviewCount,description,categories
393,"SwooK Magnetic Flip Cover case for Old Kindle Paperwhite 1 2 3 7th Gen Generation Released in 2012 2013 2014 2015 2016 New 300 PPI Versions 6"" inch Display Flip Cover Case Shell (Constellation)",SwooK,499,4.5,"2,169","⚠️【COMPATIBILITY】Designed for Amazon Kindle Paperwhite (Fits All versions: 2012, 2013, 2014, 2015 and 2016 All-New 300 PPI Versions with 6"" Display and Built-in Light, will not fit Kindle or Kindle Touch)[Full Protection]: Front PU leather and PC Hard back cover to protect your e-Book well from every angle, Easy to disassemble. Precise cutouts, full access to all features without removing the case, scratch-resistant, full protection.[Auto Sleep/Wake] This e-Book case can auto wake or put your device to sleep by opening or closing the cover.[Top Quality Material & Rugged Workmanship] The soft scratch-free microfiber interior adds comfort and an additional layer of protection.[For a Fresh Looks]: Available in a variety of bright and fun colors - ranging from classic to vibrant",Electronic_accesories
394,Spigen Tough Armor Magfit Back Cover Case Compatible with MagSafe Designed for iPhone 14 (TPU + Poly Carbonate | Black),Spigen,"2,499",4.6,238,[Compatibility] Spigen Genuine Case Compatible with iPhone 14Compatible with Magsafe Products : Magnet integrated shock absorption caseProtection : Certified MIL-STD 810G-516.6 protection and Air Cushion Technology for anti-shock protectionCamera & Screen Protection : Raised lip to protects the screen and cameraPrecise Fit : All connections and buttons are easy to reach and use,Electronic_accesories
395,MOBITUSSION Liquid Silicone Microfiber Lining with Camera Protection Back Cover Compatible for iPhone XR (Black),MOBITUSSION,289,4.1,"1,930","Compatible Devices: iPhone XRColor: BlackCase Type: Back Cover CaseLIQUID SILICONE: Luxury New Square Fashion Design with Microfiber Lining inside, Shockproof case with Supreme Quality Hybrid Material, unique features of anti-skidding, anti-fingerprint.CAMERA PROTECTION: Raised covered Camera Protection Case, Covers each and every corner of phone , providing complete protection. Covered Buttons design: Easier buttons operations and provides dust resistance to phone.",Electronic_accesories
396,Amazon Brand - Solimo Rubber Soft & Flexible Hybrid Back Phone Case for Realme C3 (Black),Amazon Brand - Solimo,109,4.0,36,"No WarrantySnug fit for Realme C3 with perfect cutouts for volume buttons, audio and charging portsDurable, soft and flexible back caseProtects phone from scratches, falls, fingerprints and sweatRaised upper lip build design to help protect the screen against fall on a flat surfaceEasy to put and take off",Electronic_accesories
397,"Amazon Brand - Solimo Fast Charging Braided Type C Data Cable Seam, Suitable For All Supported Mobile Phones (1 Meter, Black)",Amazon Brand - Solimo,129,4.1,326,1 meter long braided Type C data cable with 2-in-1 featureSupports high transfer speed of up to 480MbpsSupports high charging up to 30W1 meter long braided Type C data cable with 2-in-1 featureSolid wire core with aluminum housing for safe and reliable chargingWorks with all USB Type-C devicesRecommended to use with the original charger/adapter for maximum efficiency6 Months Limited Warranty,Electronic_accesories
398,"ROTOPLY Laptop Stand 7 Height Adjustable, Aluminium, Ventilated, Foldable, Portable Laptop Holder for Desk & Table Mount Upto 15.6 inch Laptop with Carry Pouch (Silver) M-3",ROTOPLY,380,3.6,15,"It features 7 height adjusting ergonomic, office desk improvement laptop stand which improves your sitting posture. Scientifically designed to help you balance you’re sitting posture keeping your back straight, neck relaxed and wrists natural even after long work hours.Lightweight design comes with a portable storage bag. It can be put into a backpack or laptop bag and taken to cafe, office or meeting.Designed for minimizing excessive heating of you Office, Personal or Gaming laptop PC by increasing airflow. Cooler the laptop better the performance and less power consumption.Laptop stand using the principle of triangular fixing and computer stand is made of premium aluminium alloy, the whole structure is very sturdy. There are no wobbles when you type on it. And can absorb and discharge heat easily. Supports up to 20 kg weight on top.Open hollow design - the open hollow increase the significantly airflow around the areas of laptop most vulnerable to overheating, preventing your laptop from overheating during use.",Electronic_accesories
399,Spigen Ultra Hybrid Back Cover Case Compatible with iPhone 14 Plus (TPU + Poly Carbonate | Frost Black),Spigen,"1,599",4.6,49,[Compatibility] Spigen Genuine Case Compatible with iPhone 14 PlusMatte Finish : Semi-Transparent blackened PC back design gives the chic to your GalaxyProtection : Air Cushion Technology for shock absorptionPrecise Fit : All connections and buttons are easy to reach and useMaterial : Hybrid technology made of a TPU bumper with a durable PC back,Electronic_accesories
400,"AmazonBasics Mini DisplayPort to HDMI Cable - 3 Feet, Black",Amazon Basics,249,4.2,"17,835","Mini DisplayPort to HDMI cable transmits audio and video from computer or tablet to HD display. Only supports Full HD, please check resolution before connection for proper output.Lower the resolution of the input display when connecting the cable & increase the resolution gradually for compatibility issues. Please check product compatibility before purchase.Supported Models - MacBook Air (13-inch, Early 2015 - 2017), MacBook Air (11-inch, Early 2015), MacBook Pro (Retina, 13-inch, Late 2012 - 2015), MacBook Pro (Retina, 15-inch, Mid 2012 - 2015), iMac (Retina 4K, 21.5-inch, Late 2015) iMac (Retina 5K, 27-inch, Late 2014 - 2015), Mac mini (Late 2014), Mac Pro (Late 2013).Gold-plated connectors, bare copper conductors, and foil-and-braid shielding for strength and reliable connectivity. Measures 3 feet (0.91 meters)Supports video resolutions up to up to 1920x1200 and 1080p (Full HD); easy-grip treads; low-profile design. Seamless audio for uncompressed digital 7.1, 5.1, or 2 channels1 year limited warranty",Electronic_accesories
401,Stylish White Pearls and Colorful Beaded Phone Charm| Made with Colorful Beads with Beautiful White Pearls,,169,3.4,35,"this chain will hold your phone tightly and will not allow it to slip off from your hand when you bump into things.extremely durable, easy to use, and will stand against the test of time.Our phone chain will sit comfortably on your wrist and will not cause any irritation to the skin when you are wearing it for a long timeYou can use this for Handbags, USB flash Drives, Airpods, etc",Electronic_accesories
402,"POPIO Tempered Glass Screen Protector Compatible for OnePlus Nord CE 5G (2021) / OnePlus Nord 2 5G (2021) with Edge to Edge Coverage and Easy Installation Kit, Pack of 1",POPIO,269,3.9,"2,236","Compatible Device: OnePlus Nord CE 5G / OnePlus Nord 2 5G | Area of coverage: Edge to Edge Full Screen CoverageHardness: High hardness level provides protection from accidental drop & scratchesEasy Installation: Contains 1 Tempered Glass Screen Protector, 1 wet wipe, 1 dry wipe, 1 Dust Absorber & 3 Guide StickersAdditional features: Bubble proof, Scratch resistant, Anti fingerprint, Anti-glare, Anti-shatter, Touch sensitive",Electronic_accesories
403,Ringke Fusion Compatible with Samsung Galaxy S23 5G Case Cover Transparent Hard Back Soft Flexible TPU Bumper Scratch Resistant Natural Form Samsung S23 Back Cover - Clear,Ringke,,4.4,65,Compatibility : Samsung Galaxy S23 5GTransparency : Show off your new phone with Ringke Clear Case.Material : Durable clear hard Polycarbonate back and shock absorption TPU bumper frame provides better grip for comfortable handling.Protection : Raised bezel lip protects front display screen and back camera from potential scratches.Lanyard holes : Lanyard holes are available on both sides. (Straps not included),Electronic_accesories
404,Shopsy24 Bluetooth Remote for Mobile Camera | Bluetooth Remote Control Shutter Button for Selfie Click Weight Compatible with Android & iOS Devices | Selfie Stick Remote | Button Camera |Black,Generic,139,3.5,3,Digital Display,Electronic_accesories
405,Spigen Liquid Air Back Cover Case Compatible with OnePlus 9 (TPU | Matte Black),Spigen,"1,099",4.3,401,"[Original Design] Original patent design, genuinely designed and manufactured by Spigen[Protection] Air Cushion Technology applied to protect all for 4 corners. Protect against drops, scratches and accidental falls[Material] Flexible TPU, durable material. Anti-slip matte surface gives fingerprint-resistance and comfort in every grip[Perfect Fit] Exact fit, perfect cutouts with minimum bulk. All connections and buttons are easy to reach and easy to use[Compatibility] Spigen Genuine Case Compatible with OnePlus 9",Electronic_accesories
406,TECHTONIC Tempered Glass for OnePlus Nord Ce 2 5G with Edge to Edge Coverage and Easy Installation kit,TECHTONIC,299,4.6,9,"Protection against drops and impacts: TechTonic's Tempered glass is specifically designed to absorb impact and prevent your phone screen from cracking or shattering in the event of a fall or impactScratch resistance: TechTonic's glass is highly resistant to scratches and scuffs, which means it can help keep your phone looking new for longer.Improved touch sensitivity: Screen Protector is incredibly thin and transparent, which means it won't interfere with the touch sensitivity of your phone screen. In fact, it can even enhance the responsiveness of your touch screen.Easy to install: Installing a tempered glass screen protector is easy and can be done in just a few minutes. Most tempered glass protectors come with instructions and all the tools you need to get the job done.Improved durability: Tempered glass is an extremely durable material that is designed to withstand impact and resist damage. This means that your OnePlus Nord Ce 2 5G screen will be better protected against drops and other types of accidents.",Electronic_accesories
407,"Redragon GS520 Anvil RGB Desktop Speakers, 2.0 Channel PC Computer Stereo Speaker with 6 Colorful LED Modes, Enhanced Sound and Easy-Access Volume Control, USB Powered w/ 3.5mm Cable",Redragon,"1,890",4.4,"6,177","Enhanced Clear Sound - Equipped with advanced sound drive unit with full range 2.0 channel enhanced stereo core, GS520 ANVIL offers you superior auditory feast.Touch Controlled RGB Lighting - Not only the sound quality is solid, but also the lighting bar is attractive. 6 modes are choosable for different vibes by touch-control, switch off the light is also available.More Than Fancy - Minimalism modern urban design with brushed material style, the seamless blend of dynamic stylish and upscale textural feel.Easy-access Volume Control - Individual volume up and volume down buttons make adjusting the volume easy and accurate.Plug & Play for Broad Compatibility - USB powered with 3.5mm audio and mic cables allows this rockstar to party on wide types of stages for PC, TV, and Laptop. Up to 31 in (80 cm) cable length between two speakers.",Electronic_accesories
408,Spigen Tough Armor Back Cover Case for iPhone 13 (TPU + Poly Carbonate | Black),Spigen,"2,199",4.5,"6,809",[Compatibility] Spigen Genuine Case Compatible with iPhone 13[Color Name] Black[Case Cover Type] Back Cover Case[Armor Design] Certified MIL-STD 810G-516.6 protection and Air Cushion Technology for anti-shock protection[Protection] Protection from scratches on the back and camera of the phone. The display is protected by a slight increase in the edge,Electronic_accesories
409,"ELV Direct Tablet Stand Aluminium Adjustable Foldable Cell Phone Holder Mount Multi-Angle Dock, Aluminium Alloy, Anti-Slip Pads for Home, Office Desk, Study and Bed (4""-13"") - (Black)",ELV Direct,389,5.0,3,"Multi-Angle: This adjustable tablet stand can hold your tablet horizontally or vertically and meet your demands of multiple viewing angles when using the tablet.COMPATIBILITY: Tablet Stand is compatible for 4-13 inch Tablets such as new iPad, Samsung Tablet etc.ADJUSTABLE: Tablet Stand easily adjustble, supporting both vertical and horizontal viewingSTURDY CONSTRUCTION and RUBBER PADS: Rubber pads and feet of tablet stand can protect your device from daily scratches and sliding.SMART: Perfect for playing game, watching videos, viewing photos, reading typing and video recording",Electronic_accesories
410,Sounce Indoor Entertainment & Watching a Movie with This Cool Big Square Mobile Foldable Stand Holder (Pack of 2) (Black - Cyan),Sounce,99,3.8,"2,603","UNIVERSAL COMPATIBILITY: This phone stand works with all 4-10"" Smartphones Tablets and e-readers.Multi-angle free adjustment: The small mobile phone holder can be easily placed on the table or bed, and provides hands-free when watching videos, reading, videos, and viewing photos.STURDY & PROTECTIVE: The cell phone stand is made of quality ABS, it stays firmly in place, holds your phone steadily, not worry about any wobble at all. The rubber pads can protect your phone from any scratching and sliding.QUANTITY ADVANTAGE: You will get a pack of 6 mobile phone holders with different colors and the same quality. You can place them in the living room, kitchen, bedroom, office, or dormitory.WARM TIPS: Please set your device (4""-6"") in landscape or portrait mode, and set the device (6""-10"") in landscape mode, which will provide more stability.",Electronic_accesories
411,SUBTON ® Tabletop Overhead Tripod Mobile and Tablet Stand Holder with 360 Degree Rotation for Cooking Sketch Product Videos,SUBTON,899,4.3,135,,Electronic_accesories
412,Oaky Pencil Holder Case for Apple iPad Air 4 / iPad Air 5 [10.9 inch 2020/2022] Slim Trifold Stand with Auto Wake/Sleep Soft TPU Back Cover for Apple iPad Air 4th/5h Generation - Black,Oaky,849,4.3,"3,660","✔️[𝐂𝐨𝐦𝐩𝐚𝐭𝐢𝐛𝐢𝐥𝐢𝐭𝐲] : This Case is Specifically Designed for Apple iPad Air 4/5 10.9 inch 2020/2022 Model No's :A1980,A2013,A1934, A1979, A2316, A2324, A2325, A2072 . 𝐍𝐨𝐭 𝐜𝐨𝐦𝐩𝐚𝐭𝐢𝐛𝐥𝐞 𝐰𝐢𝐭𝐡 𝐚𝐧𝐲 𝐨𝐭𝐡𝐞𝐫 𝐢𝐏𝐚𝐝 𝐦𝐨𝐝𝐞𝐥𝐬.✔️[𝐇𝐢𝐠𝐡 𝐪𝐮𝐚𝐥𝐢𝐭𝐲 𝐒𝐡𝐨𝐜𝐤 𝐑𝐞𝐬𝐢𝐬𝐭𝐚𝐧𝐭 𝐦𝐚𝐭𝐞𝐫𝐢𝐚𝐥] - Premium PU Leather External +Soft Microfiber Lining + Soft TPU back shell make your tablet look very advanced. The back surface is honeycomb construction will help your iPad cooling soon. Unique corner protection with perforated shock absorber design to protect from extreme shock and impact.✔️[𝐒𝐭𝐚𝐛𝐥𝐞 𝐓𝐫𝐢-𝐟𝐨𝐥𝐝 𝐒𝐭𝐚𝐧𝐝] - The tri-fold front cover can support iPad in two standing position for viewing and typing witch offers you extremely comfortable viewing experience , no matter watching videos or drawing in school.✔️[𝐀𝐮𝐭𝐨 𝐖𝐚𝐤𝐞 𝐒𝐥𝐞𝐞𝐩 & 𝐏𝐫𝐞𝐜𝐢𝐬𝐞 𝐂𝐮𝐭𝐨𝐮𝐭𝐬] - Open the flap to wake your device up right away and close the flap to prevent the power from being wasted. Precise Cutouts Allow Full Access To All Features (Buttons, Speakers, Cameras).✔️[𝐁𝐮𝐢𝐥𝐭-𝐢𝐧 𝐏𝐞𝐧𝐜𝐢𝐥 𝐇𝐨𝐥𝐝𝐞𝐫]- Built-in Apple Pencil Holder makes it easy to pull out and store your pencil avoid falling out while walking. (𝐀𝐩𝐩𝐥𝐞 𝐏𝐞𝐧𝐜𝐢𝐥 𝐢𝐬 𝐍𝐎𝐓 𝐢𝐧𝐜𝐥𝐮𝐝𝐞𝐝)",Electronic_accesories
413,"Tukzer 4-in-1 Type-C Hub to HDMI 4K@30Hz, VGA 1080P@60Hz, USB 3.0 Data, 100W PD, MultiPort Adapter Compatible with MacBook Pro Air iPad, Dell, Samsung Galaxy & Other Type-C Device",Tukzer,"1,699",4.3,"2,538","【4-IN-1】Expand your usb c port to a HDMI, a VGA output, a USB 3.0 and a USB-C charging port. USB C to 1*HDMI port, 1*VGA port, 1*USB3.0 port, 1*USB C PD fast charging port. The Four ports can work simultaneously which allows you to enjoy the big screen all the time.【USB 3.0 and Power Delivery】The USB 3.0 port provide highest peak data transfer speed up to 5 Gbps, easy to transfer a HD movies in short time. Meanwhile,Type-C charging quickly output meet your needs.【HDMI and VGA Port】HDMI port max support 4K UHD 3840×2160@30Hz or VGA display in up to 1080P@60Hz Full HD. When two ports work simultaneously, the maximum resolution of the two is 1920 x 1080P@60Hz. The USB C to HDMI and VGA can be use at same time.【Convenient to USE】Plug and play, no need to install the any driver/software.Aluminum Plate for strong antioxidant capacity. Safety wire core for high quality insulation outer layer.【Wide Compatibility】 It can support a wide series of Type-C / Thunderbolt 3 equipped devices. Compatible with new MacBook and Macbook Pro/Air, iPad Pro 2021/2020, Dell-XPS, MateBook X, Chromebook pixel, Acer Spin7, Samsung S20/S8/S9 + and more.",Electronic_accesories
414,"Print Master India Premium Flat Lay Tabletop Photography Backdrop Background, Double Sided Waterproof Paper for Food, Small Product Professional Photo Shoot (56x90cm, Pack of 3) 6 Designs 2 (Winter)",Print Master India,999,4.4,243,"CONTENT - 3 Sheets of Flat Lay Photography background. One sheet has 2 designs so you get a total of 6 designs. One purchase meets your multiple needsMATERIAL: Thick High Quality paper with waterproof printing, Size - (22.3x35.5 Inch/ 56x90cm)SHIPPING - Sheets come pre-rolled in a high-quality white tube that can be used to store the sheets after use. After taking the sheets out of the tube trying to roll it up from the opposite side, if it is difficult to unfold or put tape heavy objects on the corners to make the sheet flat.FEATURES: Both sides are Anti Reflective, Different patterns, and Dust-Proof. The surface is waterproof. But the edge is not waterproof. So it can be wiped but not washed.USE: Designed for Online sellers, Bloggers, Professional photographers, hobbyists, and others for taking amazing photos. Can be used for Desktop Photography or videography, such as commercial advertisements. Amazing pictures can be taken without the need to add any filters.",Electronic_accesories
415,Meowster Silicone Case for Apple Pencil 2nd Gen and 1st Generation iPencil Storage Box with Lid - Apple Pencil Carrying Case - Pen Protective Case for iPad Pencil Case Holder (Grey),Meowster,699,4.4,505,"⭐ Compatibility - This Apple Pencil Storage Case ONLY fits Apple Pencil 1st / 2nd Generation without sleeve.⭐ High Quality - Exterior is made of matt ABS, with protective lid. Interior is made of soft silicone material, protects your Apple Pencil from daily scratches.⭐ All-in-One Storage - This case could holds Apple pencil, lightning adapter, pencil cap and extra pencil tip.(Not Include)⭐ Package Includes - 1 x Case for Apple Pencil. (Apple Pencil and Apple pencil accessories are not included)⭐ Premium Quality&Service - 100% Brand new and High quality. All our products are extensively tested to comply with rigorous and strict QC standards. We offer a 60-day refund guarantee.",Electronic_accesories
416,TheGiftKart Shockproof Crystal Clear Back Cover Case for OnePlus 8 | 360 Degree Protection | Protective Design | Transparent Back Cover Case for OnePlus 8 (Black Bumper),TheGiftKart,251,4.1,108,Compatible with OnePlus 8 OnlyCrystal Clear Non Yellowing Transparent BackShock Proof & Protective Case360 Degree Protection DesignSleek and Lightweight Profile,Electronic_accesories
417,TheGiftKart Sleek Back Cover Case for iPhone 14 Pro MAX | Slim Fit Protective Design | Ultra Matte Finish | Camera Protection Bump | Soft Silicon Back Cover Case for iPhone 14 Pro Max (Silicone | Matte Black),TheGiftKart,255,4.3,29,Compatible with Apple iPhone 14 Pro Max OnlySlim & Lightweight ProfileSuperb Ultra Matte Smudge Resistant FinishProtective Shock-Absorbing DesignRaised Lip for Camera & Screen Protection,Electronic_accesories
418,WOODENCLAVE Wooden Multipurpose Adjustable Laptop Table Portable Study Lap Desk with Foldable Legs Workstation Computer Stand for Bed Breakfast - (Wenge Finish),WOODENCLAVE,799,3.6,21,"The Foldable Table for Home has an ideal dimension i.e Length 60 cm, Width 36 cm, Height 25 cm. Also, The Wooden Bed Table for Laptop is an laptop table for bed adjustable foldable that is made of powder-coated metal tubes and high-quality Engineered Wood top board.NON-SLIP BOTTOM DESIGN - To prevent slippery of desk tables legs on the bottom keep your laptop safe while tilted, and provide you comfort and stability of the Foldable desk for home office while using.MULTIPURPOSE: Multipurpose Laptop table doesn't only work as a laptop table but also as a TV Dinner Tray, serving table for patients/kids, Standing Desk for office workers, Book Writing table for kids, Tablet Holder, Standing Desk/Stand Up table, wfh accessories for home, small table for study table for bed foldableGREAT GIFT - Instead of the usual, and conventional choices, you can just stand out from the crowd and offer to the people you love a super practical and smart Work From Home accessories furnitures for home that they will love! Our Laptop tables with desk foldable is a present that will save them time, space, and make their life more comfortable!Computer Table for Home Wooden Furniture for Home Interior Decoration Items is delivered to you in a pre-assembled form.",Electronic_accesories
419,Pikkme Samsung Galaxy M33 5G Back Cover for Girls | Cute Cat Leather Finish | Soft TPU | Case for Samsung Galaxy M33 5G (Pink),Pikkme,299,4.2,38,Design : Cute Cat Shockproof Cover For Samsung Galaxy M33 5G by Pikkme is ultra-thin premium quality cover that provides elegant look to your phone without losing its originality.Quality : Samsung Galaxy M33 5G Cover is built with high quality Looks : The Cat Shockproof cover for Samsung Galaxy M33 5G provides elegant look to your phone the back side of the cover is made of leather which protect your phone from scratches where as the raised sides protect it from falls. TPU Material which provide it sleek look and provide it superior protection.Precision : Mobile Cover For Samsung Galaxy M33 5G provide precise cut-outs and holes for easy access of buttons and other ports.Protection : Samsung Galaxy M33 5G Case provide best in class protection to your expensive phone with raised sides that protects it from falls and TPU sides which protects it from scratches and damages.,Electronic_accesories
420,"Wayona USB C Female to USB A converter [2 Pack] Adaptor compatible for iPhone 13, 11, 12 Mini/Pro/Max, Airpods, iPad, Samsung Galaxy Z Flip 5G, Note 10, S10/S20 Plus, S22, S21, S20 FE 2022, M53 5G, M33 5G, M52, M22, A52s, F23 (Pack of 2, Black)",,299,4.1,"1,511","With this little dongle plugged into an available standard USB port, your legacy devices (charger, power bank, computer) can turn into a USB-C enabled platform.This adapter offers fast charging support as well as data transfer speeds of up to 480 Mbps between connected devices and also supports up to 2 Amps of power output for charging your devices. Enjoy the fast and safe charging.Our aluminum-alloy-bodied dongle occupies very little space and can plug directly onto the end of your USB-A hardware, so you won’t have to worry about carrying it aroundYou can easily hook up any USB C peripherals (USB Type-C cable, USB Type-C flash drive, USB Type-C hub) that make use of the newer USB-C connector6-Months Warranty.",Electronic_accesories
421,"CRUST Car Bluetooth Device for Music System, FM Transmitter with QC 3.0 Dual USB Fast Charger & Call Receiver; 7 Colour LED Lights; Supports MicroSD, USB MP3 Audio Playback",CRUST,"1,399",4.4,"1,801","Transform Your Car Music System: - Pair your Smartphone with the Crust Car Bluetooth device to Stream Music, Get Turn by Turn Audio Navigation Assistance, Make & Receive Calls and much more on your Car Music SystemRadiant Design: - Slim, Sleek & Minimalist design with Swanky 7 colour LED lights to complement your car interirorsLightning Fast Dual USB Car Charger: - Supports Fast Charging using Quick Charge 3.0 which is 4x faster than Conventional Chargers & 38% More Efficient than QC 2.0. Dual USB (QC3.0 + 5V/1A) supports charging two devices simultaneouslyClearly Superior Sound: - Unmatched Echo Cancellation & Noise Suppression using Latest CVC Technology for Crystal Clear Calls and Great Sounding Music. Supports Bluetooth A2DP for High Quality Stereo Audio.",Electronic_accesories
422,10WeRun Magnetic Phone Holder in Car Airvent Mount Universal Magnetic Car Mount Mobile Phone Holder Stand Magnet Support Car Mobile Holder for All Smartphones,10WeRun,399,3.8,79,"Easy connect to Smartphones ,Computer, Laptop, PCs,Tablets.Built-in Rechargeable Battery for up to 4 hours of playtime. Built-in microphone for hands-free speaker phone calling. Its very lightweight - designed makes Bluetooth Speakers really easy to carry just anywhere (at home, at the gym, when exercising, camping, traveling, even camping).Compact Wireless bluetooth speaker loud sound: Powerful 52mm diameter speakers and Enhanced Bass Resonator play a full-range, abundant stereo audio and loud sound in such a small portable sizeMultiple interfaces allow the music to be played either through bluetooth, aux, microSD or a TF cardBluetooth Range :- 10 Meters",Electronic_accesories
