,title,brand,price,rating,reviewCount,description,categories
1051,Women's Cotton Non-Padded Non-Wired Full Cup Plus Size Bra-Beige,Clovia,476,4.6,5,Care Instructions: Hand Wash OnlyFit Type: regularProduct Type: Full Coverage BraFabric: CottonPattern: SolidWiring: Wirefree,Women-lingerie-wear
1052,"Women and Men Non Woven Disposable Underwear, Panties, Briefs for Travel, Hospital, Sport, Hotel, Spa, Massage, and Salon. (White, 12) a",D-Core,293,Previous page,,Care Instructions: Machine WashFit Type: Regular,Women-lingerie-wear
1053,"Combo of 3 Women Panty/Net G-String, G-Thong and Polyster Panty-Pack of Three/Soft & Comfortable Beach Wear Bikini Panty/Light Weight",BRONGS,349,Previous page,,"Care Instructions: Hand Wash OnlyThey comes in pop vibrant colors, with fully adjustable and stretchable straps, These Panties sets gives you utmost support and comfort, beautiful panty that looks elegant as well as classy, and is designed to suit your contours.This collection will be a trendy addition to your innerwear & nightwear wardrobe. Made from delicate and breathable fabric will hold their shapes,ethnic, these casual panty comes in different colors. These would go greatly with your every outfit and will make you feel comfortable throughout the day.These sets are made of Very smooth and comfortable Material with sexy look and breathable quality,This fabric is use to give you rich look that you deserve,So go for it.you will not regret it.; The fabric used in this material has been made after undergo additional processing to make it softer and smoother than other fabricOwn one for every day of the week. It will help you to prevent from harsh knickers lines that would appear in the folds of your legs and waistline.Ultra-soft delicate waistband elastic is exposed to give added design details. Smooth elastic that leaves no mark on your skin.The fabric used in this material has been made after undergo additional processing to make it softer and smoother than other .",Women-lingerie-wear
1054,Women's Girls Blended Camisole Lycra Cotton Stretchable Spaghetti Strap Samij Innerwear,KRITIK,210,Previous page,,"Care Instructions: Machine WashFit Type: FittedFabric: This camisole for women is made from premium quality lycra cotton material which makes it super soft, stretchable and a premium quality product.Color: This women's innerwear sando is in black color which makes it look elegance and classy.Ideal for: Perfect as loungewear, sleepwear, activewear, undershirt or everyday wearing. A basic essential camisole for all women's closet.Including Components: Camisole",Women-lingerie-wear
1055,Garter Set Belt Stockings Lingerie Set - Push up - Non Padded - Bikini Set - Underwired - Sexy Lingerie for Women - Honeymoon Dress - Babydoll NightyColor-BlackSize-Medium,Pratiharye,"1,039",Previous page,,"Care Instructions: Hand Wash OnlyFit Type: RegularFabric: 95% Polyester.Comfy and light Fabric, soft and comfortable to wear! Underwired lingerie set with lace cups are seamed for better push-up support, scalloped lace edge to enhance feminie and make sexy bust line,adjustable spaghetti straps to offer perfect fit,hook and eye back closure to help easy wearingDesign: Floral lace pattern, Adjustable spaghetti straps, Gartered belt with 4 adjustable straps features. Show off your feminine charm in the perfect way.Style: If you want to surprise lover, this bandage bra and panty lingerie sets is your best choice! It will shows all your femininity , Unique embroidery adorned perfectly shows sexy body line and full of temptationOccasion: Romantic Valentine's Day,Date night,Xmas evening,Honeymoon lingerie,Wedding night,Christmas,Boudoir shoot,Anniversary,and every sweet night.Package Content: 1 x Women Green Lingerie Set with Garter Belt(stockings are also included)",Women-lingerie-wear
1056,Women Panties Multi Color Lycra Cotton Panty Underwear/Strech Briefs Soft Seamless Plus Size Panty No Show Hipsters line Silky Panties Full Coverage Panty/Brief Innerwear Pack of 4,SHAPERX,499,Previous page,,Care Instructions: Hand Wash OnlyDouble Thin Waist Edge | Waistband is Comfortable And StrechyLinning | Breathable Comfortable HealthyFabric :Silk & Nylon & Cotton | Silk Feeling | StretchablePlease Note : Color May Vary as Par Availability,Women-lingerie-wear
1057,Women's Spandex Non-Padded Wire Free Minimizer Bra,juliet,609,2.9,4,"Care Instructions: Machine WashSoft double layer cups for comfort with broad straps.Attractive print and color combination.Wire-free for comfort and support Full coverage for maximum support and no spillage from top and sides.Drip Dry in shade , Do not Iron , Do not Bleach.",Women-lingerie-wear
1058,BOOMSHY Women's Non Padded Wire Free Bra Solid Full Coverage Bra Combo (Pack of 3),Generic,389,3.3,9,Care Instructions: Hand Wash OnlyCare Instructions: Hand Wash OnlySpecial Features- light Seamless padded bra for girls and WomenStraps - Soft and smooth adjustable strapscomfortable to wear in all weathersOccasion- Everyday Bra,Women-lingerie-wear
1059,"Women Ladies Girls Pure Cotton Full Rear Coverage Low Waist Everyday Day Wearing Assorted Multicolor Hipster Panties for Women,Panties for Women Pack of 6",Glus,399,3.8,5,"Care Instructions: Hand Wash,Machine WashFit Type: RelaxedFabric : 90% Cotton,10% elastaneFull Rear Coverage Low Waist Bikini Panties.Double Cotton Gusset (Crotch) for Comfort & Hygiene.Cotton Fabric Inner Elastic Full Rear Coverage PantiesWash Care : Hand Wash,Machine Wash.Pack of 6 Cotton Women Panties.Disclaimer: Assorted Colors Panties. Actual product Color/Print May be Different From Image ShownWaist Sizes :Small: 26-28 Inches, Medium: 28-30 Inches; Large: 30-32 Inches; X-Large: 34-36 Inches ; 2XL: 38-40 Inches",Women-lingerie-wear
1060,SweetFlirt Women's Lace Hallow Stripped Bra and Panty Lingerie Set,SweetFlirt Enterprises,459,Previous page,,"Care Instructions: Hand Wash OnlyFit Type: RegularMicro mesh, smooth transparent fabric for maximum comfort and attractionMaterial Composition: 95% Polyester, 5% SpandexThese lingerie set is suitable for Valentine's Day, date nights, wedding nights, honeymoon nights, bridal usage e.t.cSize : Small, Medium, Large, X-Large, XX-Large, 3X-Large II bust (30 to 40 inches) waist (28 to 38 inches)A make in India product, DISCREET PACKAGING . To protect your privacy",Women-lingerie-wear
1061,Women's Cotton Non-Padded Wire Free Full Coverage Bra,Clovia,299,3.9,15,Care Instructions: Hand Wash OnlyFit Type: regularProduct Type: Full Coverage BraFabric: CottonPattern: SolidPadding: Non PaddedWiring: Wirefree,Women-lingerie-wear
1062,Women's Sexy Lace Hand Tie Bra and Panty Lingerie Set Free Size,Psychovest,399,4.0,69,"Fit Type: RelaxedBrand: Psychovest Bra and Panty setSexy bra and panty sets, Sexy bra and thong set, Matching bra and panty sets, strappy lace halter bra top and matching peek-a-boo panty, hollow floral lace lingerie set for womenThis Sexy Bra and Panty Set include an unlined floral lace bralette and a panty, Top featuring a halter neck, sheer floral lace cups and racerback, the bottom of the bra has adjustable bands, a matching panty with a criss-cross detailing and a thong cut backOccasion: Perfect for Valentine's Day, date nights, wedding nights, honeymoon nights, role play and lingerie partySize:: FREE . One Size Fits most. Perfect for SMALL , MEDIUM and LARGE sizes. Size range : Bust ( 30 to 36 inch), Waist ( 28 to 36 inch)",Women-lingerie-wear
1063,"Women's Blended Silver Ring Thong, Size - Free",Glus,298,3.9,66,"Care Instructions: Gentle Hand wash/Machine wash, Don't BleachSize : Free -Size Fits Most. Best Fit For - Waist ( 28 to 34 inch) . Perfect for Small, Medium & Large Sizes.Ideal and Must to Wear Under Tight Fitting Jaggings,Skirts and Office Trousers . No show thongs for Women,GirlsMaterial Type : Spandex; Double Cotton Gusset (Crotch) For Comfort and Hygiene.Wash Care : Hand Wash,Machine WashPattern Name: Solid; Age Range Description: Adult",Women-lingerie-wear
1064,Womens Solid Non Wired Padded Plunge Bra,Triumph International,899,3.8,223,"65% Cotton, 29% polyester, 5% elastane and 1% polyamideNon wiredPaddedBack hookHand wash only, no bleaching, no direct sunlight, use mild detergent, no ironingMade in Germany",Women-lingerie-wear
1065,Women's Cotton Casual Bra,Triumph International,839,2.0,1,"Care Instructions: Machine WashModern Lace contains thin PU pads and seamless smooth cups for a perfect fit.The double-layered shoulder straps are textured for a good gripThe straps are fully adjustable in length for perfect fit and wearing comfortThese straps can be detached from the bra and style into multiple ways to compliment tricky necklines like halter, one shoulder, racerback etc.",Women-lingerie-wear
1066,Women Panties Cotton Anti-Bacterial (Pack of 6),CUBO,430,Previous page,,"Care Instructions: Machine WashFit type : regular classicCare instructions : machine washBreathable Combed Cotton: The panty is made of combed cotton that is extremely breathable and feels super soft against the skinNo Marks Waistband: The No Marks Waistband feels softAge Range Description: Adult , Pattern Name :printed",Women-lingerie-wear
1067,Women's Cotton Sleeveless Adjustable Strap Spaghetti - Pack of 2,Aimly,368,3.7,6,"Care Instructions: Machine WashFit Type: Regular FitAdjustable StrapSleeveless Design & Stretchable FabricCotton Rich Fabric Provides Excellent Comfort All Day LongTo Be Worn As Lounge Wear, Leisure Wear & Active Wear - For All Purpose Use.Machine Wash Cold (Gentle Cycle) Do Not Bleach, Tumble Dry Low, Do Not Iron, Do Not Wring, Do Not Dry Clean.",Women-lingerie-wear
1068,Women's Beechwood Modal Bikini Briefs | Pure Soft Breathable Briefs | Lingerie for Women,Tailor & Circus,399,4.9,19,"Care Instructions: Machine WashFit Type: RegularHigh-quality Fabric - The bikini brief womens underwear is comfortable, silky, smooth, soft, reduces sports friction and dries quickly after washing. The natural cotton lining is breathable and comfortable, protecting women's private parts and allowing the skin to breathe freely day and night, offering a comfy stretch for your perfect fitComfort You Deserve - We master in providing the best innerwear for women, the ultra-soft waistband moves with you without pinching or binding. The no ride up briefs fit is designed with a low waist and full-seat coverage, with leg bands that stay in place, are must haves for women. Bikini Briefs are no pilling, no fading, no shrinking and no skin irritation. Our sexy underwear is an ingenious combination of comfort and sexy for ladies.Bikini Cut, Beyond Fit - True to size, no issues with sliding around or wedgies while wearing with jeans or leggings, also suitable for panties pads. With full back coverage & double layer crotch, this lady's bikini briefs underwear will provide you with more support and confidence. The lightweight, cool, comfort moisture-wicking fabric keeps you cool and dry all day.An Ideal Choice - Our bikini underwear for women are made from modal fabric which is made from beechwood tree fibers. It's an eco-conscious alternative to synthetic rayon. Plus, it's more breathable & makes it a perfect lingerie for women with comfort and durability. The soft elasticized waistband feels great and stays smooth without chafing, digging, or pinching.Easy Wash Care - Womens underwear is entirely machine washable, for easy, stress-free care. Zero impact soft layered waistband. Throw them right in the washing machine on laundry day. It is a total comfort at the leg openings. The modal material used holds its shape that helps it last long.",Women-lingerie-wear
1069,Women's Cotton Sleeveless Long Kurti Camisole Slip Spaghetti Pack of 1,Aimly,349,3.7,6,"Care Instructions: Machine WashFit Type: Regular FitLongline CamisoleSleeveless Design & Stretchable FabricCotton Rich Fabric Provides Excellent Comfort All Day LongTo Be Worn As Lounge Wear, Leisure Wear & Active Wear - For All Purpose Use.Machine Wash Cold (Gentle Cycle) Do Not Bleach, Tumble Dry Low, Do Not Iron, Do Not Wring, Do Not Dry Clean.",Women-lingerie-wear
1070,Women's Cotton Sleeveless Camisole Slip Spaghetti Pack of 3,Aimly,629,3.3,8,"Care Instructions: Machine WashFit Type: FittedSleeveless Design & Stretchable FabricCotton Rich Fabric Provides Excellent Comfort All Day LongTo Be Worn As Lounge Wear, Leisure Wear & Active Wear - For All Purpose Use.Machine Wash Cold (Gentle Cycle) Do Not Bleach, Tumble Dry Low, Do Not Iron, Do Not Wring, Do Not Dry Clean.",Women-lingerie-wear
1071,Women's Cotton Three Fourth Sleeve Camisole Slip Spaghetti - Pack of 3,Aimly,759,1.0,1,"Care Instructions: Machine WashFit Type: Regular FitThree Fourth SleevesStretchable FabricCotton Rich Fabric Provides Excellent Comfort All Day LongTo Be Worn As Lounge Wear, Leisure Wear & Active Wear - For All Purpose Use.Machine Wash Cold (Gentle Cycle) Do Not Bleach, Tumble Dry Low, Do Not Iron, Do Not Wring, Do Not Dry Clean.",Women-lingerie-wear
1072,Bodycare Black Solid Women Thermal Camisole Top,Bodycare Insider,298,4.2,31,Care Instructions: Machine WashFit Type: FittedWorks in harmony with body during coldest of conditionsDesigned to skin fit sizeInsulates & wicks moisture away from the bodyCrated with state of the art technology,Women-lingerie-wear
1073,Women Round Neck Dry Fit Gym Sports T-Shirt Maroonn Size XL,CHKOKKO,329,New to Amazon,,"Care Instructions: Machine WashFit Type: Regular FitNOTE:-Please follow the size chart given in the last image.Material: This women gym tshirt is fabricated with 95% Polyester and 5% Elastane which gives allowance to wear in every season. It is ultra-soft breathable fabric with the double hemmed shoulders.This gym tshirt is an actual combination of comfort and ease with double stitching at borders. It has various designs with astonishing colors and neon plates. It is perfect for the gym, sports, jogging, running, yoga, athletic, cycling, stretching, gymnastics, work-out etc. In body heat-up activities human body generally goes wet; it protects the body from being damp.This sports tshirt for women has anti-odour properties which never let you smell in any weather. The 4-way stretch women tshirt construction allows better movement in every direction and renders natural movement. Its stretch construction enhances mobility for a superior range of motion. It has the antimicrobial and sweat-wicking technology.Wash Care: Machine wash with cold water and wash the Light Color T-Shirt Separately with Mild Detergent. Do not Wash in Hot Water.",Women-lingerie-wear
1074,ANESHA Women Padded Sports Bra Fitness Workout Running Shirts Yoga Tank Top Free Size (26 Till 32) Pack of 1 Black Color,Generic,399,New to Amazon,,"Care Instructions: Normal washPull on the closureA nice crop top style, wire-free designed with adjustable shoulder strapsWidened elastic bottom band & Removable pads, offers light support for daily wearing and the pads are easy to take out if needed.V neckline & U-back design, this nice lounge bra is sexy and suitable to wear with low-cut shirts or dresses.Soft & lightweight materials: this longline bralette is comfortable to wear all day & night, or as a sports bra for Yoga, Pilates, dance , etc.SOFT AND COMFORTABLE TO WEAR: The bralettes for women padded are made of polyester cotton material, the lightweight, soft, and comfortable sports bras can be worn during sports and sleepingSPECIAL DESIGN: These bando bras for women are designed with v neck, the straps add charm to every wearer and the removable pads make it more comfortable and easier to clean",Women-lingerie-wear
1075,Silk & Lace Thong,Marks & Spencer,"1,499",New to Amazon,,Care Instructions: Machine Wash,Women-lingerie-wear
1076,Fashiol Women's/Girl's Lightly Padded Spaghetti Strap Full Floral Net/Lace Camisole with Removable Pads,F FASHIOL.COM,325,No reviews,,Care Instructions: Machine WashFit Type: Regular FitCare Instructions: Machine Wash OnlyAbout-Size- this Product Has (Comfortable For 28-34 bust-Size)Padding : Smooth & Lightly PadsMaterial: Cotton & LaceIt is very comfortable to Touch and WearEasy to wear slip-on style.,Women-lingerie-wear
1077,Sexy Women's Moulded Lace Push-up Bra with Box Packing,LaOrra,499,5.0,1,Care Instructions: Hand Wash OnlyMedium Coverage with no spillageUnderwires and side boning provide optimum supportMedium padded cups for fine shaping & nipple coveragePadded seamed cups for enhanced support & nipple coverageLaOrra Box packing included.,Women-lingerie-wear
1078,Cotton White Bra Combo Full Coverage D Cup Non-Padded Non-Wired Pack of 2,DILISHA,479,3.6,51,"Care Instructions: Hand Wash OnlyFit Type: regularMaterial - high quality non-itchy soft pure cotton fabricAdjustable and broad straps - stretchable and broad elastic straps with sliders to provide comfortable fit and prevent marks on shoulders. The broad straps offer better lift and comfortable fitFull coverage wire free mould cup - stays light on breasts and doesn't make the breast look saggy. It also prevents love handles and bulges. Cups are designed for plus size women and heavy breastsHorizontal seamed white bra - this seamed and refreshing white bra provides perfect support and fit and has best features like broad straps, fuller cups and better coverage the bra has 3-hook closurePackage includes - set of 2 non-wired white wirefree womenâ€™s bra",Women-lingerie-wear
1079,Women's Silicone Lightly padded Wire Free Stick-On Bra (Women Silicone Bra_Beige_M),ayushicreationa,261,3.3,15,"Care Instructions: Dry Clean OnlyFit Type: regularCondition: 100% Brand new and high quality.; It is suitable for wearing under all kinds of dresses at weddings, parties, functions etc.It will instantly push up your bust and gives a deep cleavage.Great shape, comfortable, durable and breathable.The silicone bras are reusable and washable as well.Pattern Type: Solid; Age Range Description: Adult",Women-lingerie-wear
1080,"Women Panties, Nylon & Lace Thong Panty Set",NIMRA FASHION,199,3.8,6,"Care Instructions: Hand Wash OnlyFit Type: RelaxedCare Instructions: Hand-wash only, hang dry, do not bleachSize : Free Size. One Size Fits Most. (Waist: 28 to 34 inch).Perfect for Small, Medium and Large sizesStyle : Women G-string panty with embellished bow design on back.Occasion: Perfect for Bedroom, Special nights, Nightwear, Valentine's day dress, Honeymoon. Perfect gift for ladies, wife and girlfriend on valentine's day, wedding night, honeymoon or every hot night.Packaging : DISCREET PACKAGING . To protect your privacy",Women-lingerie-wear
1081,Women's Cotton Non-Padded Non-Wired Regular Bra (Pack of 3),Ultimate Bra,399,3.2,39,"Care Instructions: Hand Wash OnlyFabric: Cotton,HosieryFeel and look great in a superior comfort Cotton Front Open bra for women of all shapes and sizes.Bra Type : Non Padded, Wirefree Bra which provide Half coverage and great comfortNightwear, Sleepwear. Perfect for Special night, Valentine's Day, Honeymoon Gifts, Wedding night, Bridal Gifts.Hook and Eye closure,customizable fit",Women-lingerie-wear
1082,"Women's Cotton Camisole (Bhar3914_P191_White_90 cm, Large) (Pack of 3)",Amul Comfy,,3.8,255,Fit Type: Regular FitFabric Type: CottonPattern name: SolidSleeve Type: Sleeveless,Women-lingerie-wear
1083,"Soch Period Panty for Women| Organic Cotton| Reusable and Washable| Absorbent and Leakproof| Full Front Back Coverage| Suitable for Low to Medium Flow |Hipster (M, Black)",SochGreen,799,New to Amazon,,"Fabric: Body Fabric: The panty is made of soft, breathable 95% Organic cotton and 5% spandex. Absorbent Pad: Easy to wash, quick drying, moisture wicking lightweight polyester fleece sewn into the panty. Leak Proof layer: laminated fabric backing that keeps everything off your clothes.Usage: Light to Moderate Period Flow, Spotting, White Discharge, Backup for Menstrual Cup /Tampon and Light Urinary Incontinence or Urine leaks.Usage: For very heavy flow and/or Postpartum or After Delivery Bleeding, we suggest using panty with insert and interlabial pads.Size: 90-95 cm . Items Included: 1pc Panty and Packaging.Light to Moderate Flow: The panty is ideal for light to moderate flow and can be worn on its own without any additional pads for upto 7 hours or overnight.Heavy Flow: The panty on its own will last around 2-4 hours to wear it for a longer duration, you can use interlabial pads or cloth pads along with the panty.Wash Care: We have used delicate organic fabrics for that supersoft and comfortable feel. Make sure that you do not use a brush to clean it. To remove stains, soak in regular or cold (not hot) soapy water for 30min to 2 hours and gently rub with hand or use gentle machine wash. It is best to be dried under the sun. If you still have stains, gentle stain removers can be used but do not use any fabric softeners.",Women-lingerie-wear
1084,Panties for Women Combo Pack of 3 | Sexy Panty for Hot Women | Women Panties | Women Thong Panty | Sexy Thong Underwear for Women | Sexy Lingerie for Women | Penti Women's Wear (5050),ZeroKaata,289,5.0,2,"Care Instructions: Hand Wash OnlyFit Type: RegularContains 3 thong seamless panties for women (Assorted color)Fabric: Looking for soft and comfortable lace panties for women? Your search ends here. This pack of thong panty for women is made with indian fabric that will feel super soft on your skin.Soft and Skin Friendly Waistband: All 3 lace thongs for women have a soft and comfortable elasticated waistband that will not itch or leave a mark on your skin. It will keep you comfortable all day/night long.Occasion: These women s underwear are perfect for first nights, honeymoon, date nights with your partner, valentine's day, or just a regular romantic night with your partner.Care Instructions For Women Briefs: Hand wash, Drip dry in shades, Do not iron",Women-lingerie-wear
1085,"Poly-Cotton Saree Shapewear Petticoat for Women, Cotton Blended,Petticoat,Skirts for Women,Shape Wear Dress for Saree-All Saree-Shapewear Black",UTHAMMA,499,4.1,50,"Care Instructions: Machine WashCare Instructions: Machine WashThe first impression is that it's a tight product because of high compression.Please wear it for 15 minutes and give it time to take the shape of your curves.It's the right fit if you are able to breathe.About Compression: Targeted Area - Abdomen, Hips, and Thighs || Type - MediumNote: [1] The Shapewear is meant to be skin-tight. If you can breathe easily, It's the right fit [2] To find the right fit, refer to the size chart in product photographsSide Slit: A thoughtfully designed Side Slit on hemline for confident and easy movement",Women-lingerie-wear
1086,"Women Push Up Bras For Self Adhesive Silicone Strapless Invisible Bra Reusable Sticky Breast Lift Up Size(30 till 38), Color (Beige), Pack of (1 Pair)",ELEG & STILANCE,392,2.6,2,"Care Instructions: Machine WashFit Type: skinnyCare Instructions: Hand Wash Only ifting bra made of Hypoallergenic,skin-friendly,soft and comfortable to wear Medical grade silicone S Covers B Cup 2Xl covers C & D Cup .Thin edge and thicker centre is better to protect and hide nipples.These nude seamless nippleless covers make them natural look and invisible even under sheer clothings.Tapered edges blend seamlessly into skin for the smoothest coverage possible without ridges or bumpsENHANCED DESIGN: Breast lift nipple covers combine the power of a push up bra and the convenience of traditional nipple covers, BREAST LIFTS: Newest design which helps keeping your breast supported and perky. The rabbit bra stickers come with an adhesive breast lift tape which make your breast instant lift and firm.Go Bra-Less & REUSABLE: Specially designed for backless/strapless dresses, t-shirts, wedding gowns and so on. The women Silicone Pasties are Waterproof and WashableDo not use this product if you are nursing or have wounded skinâ€¦. After each use, simply hand wash them with warm water and mild soap and let them air dry.",Women-lingerie-wear
1087,Women & Men Sauna Weight Loss Upper Thigh Arm Slimming Belt Arm Thigh Shaper Band Black,Generic,899,2.5,19,"Comfortable and easy to use during any workout exercise.In addition, to help losing water weight, they also help in detoxifying the body and building up muscles.A Safe and healthy alternative for weight loss by enhancing the bodyâ€™s natural thermogenic rate.You can wear this trimmer under your clothes and go about your normal business of the day",Women-lingerie-wear
1088,Womens Solid Non Wired Padded Plunge Bra,Triumph International,899,3.8,223,"65% Cotton, 29% polyester, 5% elastane and 1% polyamideNon wiredPaddedBack hookHand wash only, no bleaching, no direct sunlight, use mild detergent, no ironingMade in Germany",Women-lingerie-wear
1089,Womens Solid Non Wired Padded T-Shirt Bra,Triumph International,"1,799",4.3,156,"56% Polyamide, 28% Polyester and 16% ElastaneT-ShirtFull CupHand wash only, no bleaching, no direct sunlight, no ironing",Women-lingerie-wear
1090,Triumph Triaction 64 Wireless Non Padded Comfortable Support Bra,Triumph International,949,4.0,389,"50% Polyester 40% Polyamide 10% ElastaneNon Padded Non WiredMedium SupportFull CoverageBroad Strap for better support, cross backMachine wash-water temperature maximum 60`C, No Bleaching, No Tumble dry, No direct sunlight, Use mild detergent, No Ironing, No dry cleaning",Women-lingerie-wear
1091,Triumph Mamabel Wireless Non Padded Comfortable Support Cotton Maternity Bra,Triumph International,"1,049",4.0,496,"100% CottonNon Padded Non WiredSoft CupFull CoverageFront Buckles for easy feeding, pure cottonMachine wash-water temperature maximum 60`C, No Bleaching, No Tumble dry, No direct sunlight, Use mild detergent, No Ironing, No dry cleaning",Women-lingerie-wear
1092,Side Lace Padded Underwired T-Shirt Bra,BLOSSOM,659,5.0,3,"Care Instructions: Hand Wash Only92% Cotton, 8% ElastaneProduct Type: Full CupPattern: Plain / SolidWash Care: Handwash 30Â°C, Do not bleach, Do not iron, Drip dry in shade.",Women-lingerie-wear
