,title,brand,price,rating,reviewCount,description,categories
672,"Cotton Panty Cotton Bras Set for Girl's , Floral Printed Women Lingerie Innerwear Underwear Set for Everyday Use, Pure Cotton Bra & Penty",Iconic Deeva,340,5.0,2,"Care Instructions: Gentle machine or hand wash. Do not bleach, do not use too hot water wash with even colors. Try to avoid hard chemicals and detergents also for better product life.Fit Type: Modernâœ¿Get a boost from this gorgeous, Cotton full coverage bra and panty set by Iconic Deeva. This simple and sobour comfortable bra and panty set features adjustable straps, spandex cotton Lycra mesh material. Brings you whole day comfort. Fresh vibrant lively colors and romantic design is meant for everyday wear. Its light elastic doesn't leave marks on your skin. This is made of breathable light fabric to provide best comfort and fit. So, grab this bra panty set and add comfort to youâœ¿âœ¿The shoulder straps have plenty of room for adjustment. We firmly believe that the sexy lingerie can help you increase confidence and sexiness which is overflowed from the soul. As women, we all have experienced it. How a bad bra can ruin your whole day! But it doesnâ€™t have to be like that. Here at Iconic Deeva, we take your comfort seriously.With many years in the business, we have never stopped striving to provide our customers with only the best.âœ¿âœ¿Size Guide: - We do have a wide range of products with different styles, colors, patterns and sizes. It has adjustable shoulder straps which help to have better control of your bust. Available in regular Small(30""), Medium(32""), Large(34""), XL(36""), XXL(38"") & XXXL(40"") sizes. Enhance your wardrobe today with these beauties. Quality of our products is extra ordinary and we assure you once you got this pair in hand you will just fall in love with the stuff and may recommend other also.âœ¿âœ¿Crafted from soft mesh cotton hosiery with lycra blend ensures comfort fit and freedom of movement all day long for the woman who appreciates attractive styling but doesn't compromise on ease of wear, fit and hygiene. Beautiful detailing with beautiful floral prints enhance its all over look and gives this set a classy and attractive finishing. Our fabric quality is as smooth like butter & you can feel the coziness once you rub your hands on the fabric of these beauties.âœ¿âœ¿Pack of 1 bra and 1 panty with B size Non-padded cups. This romantic stylish bra panty set is a must-have for your everyday lingerie drawer. Very smooth comfortable material, sexy and breathable, 100% imported fabric to give you rich look that you deserve. We constantly inspire passion, desire and excitement that touches everyone and everything we do. We bring the WOW factor. With innovative fashions and support team, exceptional fit and quality.âœ¿",Women-lingerie-wear
673,"Women/Girl/Teenager Spaghetti Camisole Vest Top Inner Wear Camis/shameej with Adjustable and Detachable Strapï¿½,Pink, Pack of 1(SP-Pink-8)",TunTun,,Previous page of related Sponsored Products,,"Care Instructions: Machine WashFit Type: Regular FitVibrant colors, perfect fit, long lasting fabric and elasticFit Type: Regular | Bio washed |100 Percent Premium Cotton FabricAdjustable straps with slidersCan be worn as an undergarment or as its with invisible pantyline, Can be wear in as sports wearMachine wash normal cycle with like colors.Â Do not bleach. Do not tumble dry.Do not dry clean.Do not iron on print.Low iron.",Women-lingerie-wear
674,"Women's Super Heavy Padded Full Coverage Non Wired T-Shirt Bra | Best Comfort Bra | Regular Use Bra | Womens/Ladies/Girls | Shaper Bra | Comfortable Bra |Seamless Bra| (Black, 32B)",Tweens,449,5.0,1,Care Instructions: Hand Wash OnlyFit Type: relaxedTweens Super Heavy Padded bra can be used for everyday wear under t-shirts and tops to kurtis and shirts.It has been specially designed to give support and make you feel confident and comfortable.The seamless cups provide for a smooth finish with no shows on your outfit and the brushed back hook & eye provides for extra comfort.Fit Type : RelaxedHeavy Padded and Full Coverage with Adjustable Straps Bra is Ideal for Everyday wear.,Women-lingerie-wear
675,Camisole Slips for Women's Spaghetti Top Innerwear Pack of 5,QD Fashion,479,4.2,142,"Care Instructions: Hand Wash OnlyFit Type: Regular Fitâž¡ï¸MATERIAL-100% PURE COTTON.It was an Folding camisole fit on shoulder perfectly. It make you feel better in everyday.âž¡ï¸MATERIAL-100% PURE COTTON.It was an Folding camisole fit on shoulder perfectly. It make you feel better in everyday.âž¡ï¸YARN TYPE-This Camisole is made by colored YARN, So there is no way to get fade quickly. We are trying to give a QUALITY product to our customer..âž¡ï¸COLOR OPTION-We are providing 10 Multicolor Camisole. The color selection was yours, We provide Multicolor option, which can match your different styles of dress.âš ï¸GREMENT CARE-Machine wash. Detergent wash. Don't bleach. lay flat to dry.âž¡ï¸QD Fashion is only for Customer satisfaction. We are trying to provide a quality product to our lovable CUSTOMER.Thankyou For Spending Your Valuable Time With Us.Have an nice day.",Women-lingerie-wear
676,"Shapeup Super Shaper Bra (C, Skin",DAISY DEE,375,3.8,86,,Women-lingerie-wear
677,Women Net Bikini Sexy Panty_Pack of 12,KETKAR,999,Previous page,,"Care Instructions: Hand Wash OnlyFit Type: RegularStyle : Women lace panty. Boy shorts panty offers great coverage for all-day comfort. Seamless and well-trimmed lace makes very comfortable to wear, enjoying a close-fitting dress all day longPerfect ShapeLace Decorated PantiesPattern Type: Floral PrintAge Range Description: Adult; Pattern Name: Solid",Women-lingerie-wear
678,Women Lightly Padded Sleevless Cotton & Spandex Full Coverage Bra (32 Till 34) (Pack of 1) (Multicolor),Fashiol,425,4.5,2,"Care Instructions: Machine WashFit Type: relaxedThe antibacterial ultra fresh technology on the fabric helps you stay fresh for longerUltra soft fabric ensures no marksIdeal for travelling, camping, fitness,Machine wash cold gentle cycle without fabric conditionerLabel free for all day comfort",Women-lingerie-wear
679,Violet Women's Regular Non Padded Bra Pack of 2,SONARI,780,3.7,38,"Care Instructions: Hand Wash OnlyFit Type: regularSeamed, non padded cups for great supportMedium coverage for natural cleavage under low necklines.Wire-free for comfort and supportSewn-in bump gives a hint of push-up for a natural lift",Women-lingerie-wear
680,Menâ€™s Sweat Shaper Vest for Weight Loss Sauna Slimming Workout Tanktop (Black),shophere,498,3.8,25,"Care Instructions: Hand Wash OnlyFit Type: SlimADVANCED SWEATWEAR: Sweat Shapewear uses a heat-trapping polymer fabric to accelerate your natural body heat and promote sweating. Wearing Sweat Shapewear while working out and during daily activities creates a sauna-like experience. With Sweat Shapewear you can burn more calories and get results faster.WAIST SIZE: Medium / Large (30-36 Inches) | XL / XXL (38-44 Inches) | FABRICATION : Polymer FabricCOMFORT & VERSATILITY: Sweat Shapewear is lightweight and comfortable, so it moves and stretches with you: during workouts at the gym, yoga, cardio, cycling, sports, and so much more. Wear Sweat Shapewear under or over your clothes for a flat, toned look.SLIMMING BODY SWEAT SHAPEWEAR : Sweat Shapewear unique polymer fabric and compression instantly slims your body, and acts like shapewear under your clothes. Quickly tucking your tummy and shaping your chest & waist, giving you that flat, toned look instantly.ULTRA-PREMIUM FABRICATION: Sweat Shapewear's special blend of fabrics come together to create the ultimate tank top in Advanced Sweatwear. The inner heat-trapping polymer fabric increases your core temperature to promote sweating for more calories burned and faster weight-loss results and also supporting your muscles.",Women-lingerie-wear
681,Women's Cotton Non-Padded Non-Wired Full Cup Bra & Hipster Panty,Clovia,355,Previous page of related Sponsored Products,,"Care Instructions: Handwash 30Â°C, Do not bleach, Do not iron, Drip dry in shadeProduct Type: Full Coverage Bra, Full Figure Bra & Hipster Panty SetFabric Type: CottonPattern Type: SolidPadding: Non PaddedWire Support: Wirefree",Women-lingerie-wear
682,FENICAL 6Pair Women Foam Bra Pads Insert Removable Triangle Bra Enhancer Cup for Swimwear Sports Bra Bikini (Beige),FENICAL,399,4.2,11,"Made from eco-friendly comfortable material for women who fits cup.Creating visible push up and lift in the bust area, giving your bust for a lovelier, perkier appearance.Small and lightweight enough to be carried during travel.Providing a securely fit all-day long - also can be reused multiple times.",Women-lingerie-wear
683,"Girl's Ice Silk Seamless Padded Tube Bra with Removable Pad Bra_Pack of 01(Size-28 to 32,White)",WKLOUYHE,399,Previous page,,"Care Instructions: Hand Wash Only?Breathable and Comfortable Fabric?? The tube top bra is made of nylon and spandex, which is comfortable and soft for summer everyday wearing.?Removeable Padded?? Sexy bandeau bras provides cover and support like normal bra with elastic straps. The tube top bra comes with removable soft foam pads can be take off and put on any time.?Free Size Tube Top for Women Girls?? The camisole bandeau tube top bra with good elasticity which is suitable for women with small boobs and teen girls.?Wide Application?? When having sports dance classes, yoga classes, strapless underwear give you a sense of comfort, or just match with summer dresses, evening dress and off shoulder clothes to attend party and more.Colors: All trendy and cool colors to fill your wardrobe with cool set of choice",Women-lingerie-wear
684,myaddiction Silicone Breast Forms Lifelike False Fake Boobs with Adjustable Strap AA Cup,MYADDICTION,"3,486",,,,Women-lingerie-wear
685,"Poly-Cotton Saree Shapewear Petticoat for Women, Cotton Blended,Petticoat,Skirts for Women,Shape Wear Dress for Saree-All Saree-Shapewear Yellow",UTHAMMA,499,4.4,16,"Care Instructions: Machine WashCare Instructions: Machine WashThe first impression is that it's a tight product because of high compression.Please wear it for 15 minutes and give it time to take the shape of your curves.It's the right fit if you are able to breathe.About Compression: Targeted Area - Abdomen, Hips, and Thighs || Type - MediumNote: [1] The Shapewear is meant to be skin-tight. If you can breathe easily, It's the right fit [2] To find the right fit, refer to the size chart in product photographsSide Slit: A thoughtfully designed Side Slit on hemline for confident and easy movement",Women-lingerie-wear
686,Women Sports Bra,Amazon Brand - Symactive,468.,3.3,3,"Care Instructions: Hand Wash Only88% POLYSTER , 12% SPANDEX , 230 GSM InterlockFittedRound NeckQuality knit fabric with stretch for better mobility and comfortrelective branding at chest",Women-lingerie-wear
687,Women's Tummy Controller High Waist Panty,Fabme,225,3.6,3,Care Instructions: Hand Wash OnlyWaist Shaping Panty,Women-lingerie-wear
688,Women's Cotton Padded Underwire Strapless Bra,Zivame,349,3.3,25,"Care Instructions: Machine WashMedium padded cups for fine shaping & nipple coverage High wired for increased support and enhanced shaping 3/4th coverage for enhanced support and no spillage The bigger the bra size, the broader the back band Fabric: Cotton Do Not Dry Clean Do Not Bleach Dry In Shade Do Not Iron Hand Wash Allowed Do Not Tumble Dry",Women-lingerie-wear
689,"Boxer Panty, Shorts, Briefs for Women's and Girl's Cotton Lycra Free Size (Size 28 to 40) - Black, White and Beige - Pack of 3",TRASA,389,3.4,152,"Care Instructions: Machine WashFit Type: RegularTrasa Boxer Panty, Shorts, briefs for Women's and Girl's is a Seamless BoyShort made of Cotton & SpandexIts Seamless characteristics helps in Hassle-Free movement compared to the regular Cut & Sew pantiesThis product from the house of ""Trasa"" gives you both comfort and style, embrace urself with Girl Shorts Brief s/Boxers for all your multipurpose activitiesWash Care: Do not use Washing Machine, Avoid Rubbing & Twisting. Wash in Cold Water Keep Away from HeatSize : - 28 to 40",Women-lingerie-wear
690,Women's Cotton Blend Soft Invisible Hipster Panty for Woman High Waist Bikini Set Briefs Underwear Pack of 3 ( Multicolore ),PREMIUM STORE,349,5.0,4,"Care Instructions: Hand Wash OnlyFit Type: Regular1. Assorted Pack; Color May Differ from Image; attractive three-piece PREMIUM STORE panty set. Women's hipster-style pantys fall around two inches below the navel button. Grippy panties for women that make you feel safe.2. For outstanding all-day comfort, the rear coverage panty offers exceptional complete coverage. A mild grasp on the stomach is ensured by the mid-waist shape. Pants' leg openings: A low cut sits comfortably at the crease of your leg.3. The inner elastic is on the leg as well as the waist of the panties.4. Panties are made of 100% cotton jersey for the body. Panty Crotch:- 100% cotton with an antimicrobial treatment that inhibits the growth of microorganisms that cause odours and a stain-release finish that makes it easier to remove stains. Colors may differ from what is seen in the photograph.5. This panty's fabric has been dyed a certain colour so that the colour won't fade even after washing.",Women-lingerie-wear
691,"SOQO Period Panty Reusable with Anti Rash Drip Proof Technology, Mid Rise Bikini Bamboo Cotton Fabric, Leak Proof Period Underwear, Irritation-Free, Washable (4XL, Black)",Soqo,599,Only 2 left in stock.,,"Total Protection: From period stains & bladder leaks, so you can thrive in comfort.Soft & Safe Fabric: Our soft Bamboo fabric blend is 100% natural and safe for your delicate area.Conscious Choice: Choose our undies and say goodbye to disposables; the planet will thank you.100% GOTS Certified Fabric: Uses only GOTS Certified fabrics to produce underwear free of any toxic substances. Size inclusive: 8 size options for you to choose from to give you the perfect fitSturdy and Long Lasting: Lasts up to 2 years. Easy on your pocket and the planet. Multiple styles to complement all your favorite dresses",Women-lingerie-wear
692,Women Cotton Non-Woven 25 GSM Disposable Spa Massage Panty Color-Black Pack of 20,MSIU- MY STYLE IS UNIQUE,297,3.8,18,"Care Instructions: Use and throw disposable; This Cotton Disposable Panties will give you the confidence to be ready always PACK OF 10, 20, 30, 40, 50 in avelibleA special use and throw disposable panties for single time use . 100 percent skin-friendly . Compact and light weight to carryQualities: Great Elasticity, Easy to Carry, Premium Quality Material, No odor.this panty in cotton material and use 25 GSM class cloth; Age Range Description: Adult; Bottom Style: BikiniPattern Name: Solid; Size Name: Xl; Style Name: Nappy; Pattern Type: Solid",Women-lingerie-wear
693,SweetFlirt Women's Hight Waist Lace Lingerie Set.,Generic,559,3.5,20,"Care Instructions: Gentle Hand Wash in Lukewarm Water, Do Not BleachFit Type: RegularMicro mesh, smooth transparent fabric for maximum comfort and attractionMaterial Composition: 95% Polyester, 5% SpandexSize : Small, Medium, Large, X-Large, XX-Large, 3X-Large II bust (30 to 40 inches) waist (28 to 38 inches)These lingerie set is suitable for Valentine's Day, date nights, wedding nights, honeymoon nights, bridal usage e.t.cA make in India product, DISCREET PACKAGING . To protect your privacy",Women-lingerie-wear
694,Women's Cotton Non-Padded Non-Wired Animal Print Bra,Clovia,275,3.7,8,"Care Instructions: Handwash 30Â°C, Do not bleach, Do not iron, Drip dry in shadeProduct Type: Full Cup Bra, Everyday ComfyFabric Type: CottonPattern Type: Animal PrintNon Padded||WirefreeBra Closure: Back Open",Women-lingerie-wear
695,Women Bralette Lace Bra Panty Lingerie Set,Xs and Os,189,5.0,1,"Care Instructions: Hand-wash only, hang dry, do not bleachSize : FREE. One Size Fits Most. Bust ( 30 to 36 inch) ,Waist ( 28 to 34 inch).Perfect for Small, Medium and Large sizesStyle : Women Lace design halter neck bra with side tie panty . Solid colour combinationOccasion: Perfect for Bedroom, Special nights, Nightwear, Valentine's day dress, Honeymoon. Perfect gift for ladies, wife and girlfriend on valentine's day, wedding night, honeymoon or every hot night.Packaging : DISCREET PACKAGING . To protect your privacy.Package Includes : 1 x Women Lace bra panty lingerie set",Women-lingerie-wear
696,Women's Cotton Blend Non-Padded Wire Free Full-Coverage Bra,Framino,339,3.5,335,"Care Instructions: dry in shadeFabric: Cotton mixTarget audience: girls and womenNon-padded, non-wired cups provide full coverageFancy braWash care: warm wash, do not bleach, do not iron, do not dry clean",Women-lingerie-wear
697,Soft Cup Bra,DAISY DEE,365,5.0,3,Care Instructions: Machine Wash70% Cotton and 30% polyesterNon Wired,Women-lingerie-wear
698,"Combo Pack of 6 100% Pure Cotton Soft Elastic Waistband All Day Comfort Multicolor Hispter Panty and Underskirt Short | Panties for Girls - Multicolor, Color May Vary",ARLA APPAREL,486,Previous page,,"Care Instructions: Machine WashFit Type: SkinnyFabric : 100% Pure Cotton, is a perfect balance of lightness and stretchable. | Combo Pack Of 6 Panty | Color : MulticolorSoft fabric with cartoon prints to give you a fresh feel.Soft fabric waistband offering smooth feel & gentle touch.Modern fit, sits just below the waistSince the actual color may vary, please refer image block for colorÂ Since the actual color may vary, please refer image block for color | Colors And Prints Are Subject To Availability And May Vary From The Images Shown. Due To Hygiene Issue We Are Unable To Accept Returns For This Product.",Women-lingerie-wear
699,"Women Crop Top Bralette (1 pc, Free Size) Padded Bralette, Removable Pads, Slip On Bra, T-Shirt Bra, Cute Bralette, Crop Top Bralette,",The Purple Tree,399,Previous page,,"Care Instructions: Machine WashFit Type: regularBackless, Breathable, Lightweight, PaddedSize- Free Size . This Comfortable Backless Bralette / Crop Top / Sports Bra Can fit 28 inches to 36 inches bust size easily.This fashion shoulder strap design this bralette /crop tops are the must-have item in your wardrobe for this summer.Fit Type: relaxedCare Instructions: Machine Wash",Women-lingerie-wear
700,"Comfy Womenâ€™s Cotton Fabric Panty Set Ladies Lady Bra Set,Girls Panty Set",LPX,199,4.5,6,"Care Instructions: Machine WashFit Type: WesternWestern Innerwear & swimwear with Cotton Lining, Stylish Lingerie Set, Comfortable Fashionable Trendy, Trendy Colors, Brazilian Design, Swimwear Sexy, Period Fantastic Normal, and Women Girls Honeymoon.This collection will be a trendy addition to your innerwear & swimwear wardrobe. Made from delicate and breathable fabric,hosiery,cups will hold their shapes,ethnic,casual,western bra and panty comes in different colors featuring a beautiful print. These would go greatly with your every outfit and will make you feel comfortable throughout the day. These innerwear & swimwear are been well designed of their straps and cute cups.This bra & panty set is what a young at heart wants add it to your daily innerwear & swimwear drawer and feel elated. Adjustable strap, full coverage, Beautiful print and centre of the panty are surly going to win your heart. Normal Daily Purpose Women Girls Honeymoon Set.Sexy set Comfortable Fashionable Trendy Stylish Lingerie SetCare Instructions: Hand Wash Only",Women-lingerie-wear
701,Collection Women's Boyshort Panties,MNP,199,Previous page,,"Care Instructions: Machine WashSIZE: One Size (Fits Best upto Waist Size 36) .SOFT FABRIC - Breathable durable fabric 92% Polyamide+8% Elastane offers a soft and smooth feelSEAMLESS BOYSHORT - Seamless boyshort featuring stay-in-place legs and comfort waist band. Moisture wicking to help stay dry. Seamless Style Knitting (No Side Seams) - Seams at Inside Leg Stitchâ€¦ALL PURPOSE BRIEF :: Ideal for wearing these boyshorts to dance, work out, ride on a bike, you could also wear them around your house and yoga or sexy sleep shorts or perfect under dress panty .These safety shorts can prevent thighs from rubbing and sweating, it also has good air permeability and do not feel hot when exercising, it accentuates your slim figure.BOYSHORTS ARE THE MOST COMFORTABLE WOMENâ€™S UNDERWEAR! Seamless boyshort with comfortable waistband featuring stay in place legs.They cover the hips and thighs of the wearer for comfort. Comfortable design for women to provide a long lasting comfort fit for all day wear ability.Care Instructions: Machine Wash",Women-lingerie-wear
702,Women Bra,Triumph International,"1,399",Previous page,,Care Instructions: Hand Wash OnlyTrenslo bone at sides and higher back part provides more support than traditional form & beauty style.Large cups with laceFull CoverageIt is Non-Padded Non-Wired,Women-lingerie-wear
703,Comfortable Girls & Women's Panty/Briefs/Underwear Net Cotton Mix febric,AzeoTop,299,4.5,9,"Care Instructions: Hand Wash OnlyAzeoTop girls & women's Net pattern panties are in best quality pantys with new design and fashion that Feel you Lite.AzeoTop ladies underwear/innerwear are Made from ultra soft & cotton and net mix stretchable febric With premium Quality material COLOR & PRINT Panties for keeping your body fresh and comfortable and The Antibacterial Ultra Fresh technology on the panty fabric helps you stay fresh for longer making it a perfect choice for intimate hygiene.AzeoTop COMFORTABLE WOMENS UDNERWEAR: Soft cotton stretch Net blended underwear for women. Enjoy a smooth soft touch. girls/ladies panty/briefs absorbs your sweat, and the toxins you release from your body.All Size Avilabale: AzeoTop Soft Breathable girls/ladies Panties keep you at ease in daily use and Soft inner elastic waistband panties style is ideal for wearing with all type of outfit.Disclaimer: female brief hose / women panty in a variety colors (Black, Blue, Pink, Red). The Panties color may vary.",Women-lingerie-wear
704,Women's Every Day's Tshirt Padded Underwired Pushup Bra,Brachy,329,2.2,5,"Care Instructions: Hand Wash OnlyThis bra is a combination of luxury and comfort ,Soft smooth fabric with elegant Cups gives luxurious feel & wired and soft cups gives all day comfortTshirtÂ Demi Cup Bra Comes with multiway strapsIt Comes with convertable Detachable straps And also label free for all day comfort.Size: 30BColour: Black",Women-lingerie-wear
705,Women's Nylon Padded Wired Demi Molded Balconette Bra,Candour London,899,3.4,13,Care Instructions: Machine WashFit Type: regular,Women-lingerie-wear
706,Cotton Mid Waist Full Coverage Hipsters Panties for Women | Colors and Prints May Vary,Dixcy Slimz,395,Previous page,,Care Instructions: Machine WashFit Type: RegularDisclaimer: The final product delivered might vary in colour and prints from the ones displayed here|Soft fabric with floral prints to give you a fresh feel.Comfort fit that fits just above the natural waistline.Soft fabric waistband offers smooth feel and gentle touch.High performance nylon seams that ensures durability.Available in attractive modern prints.,Women-lingerie-wear
707,Women's Polyester Classic Bra,Rosaline by Zivame,279,3.6,5,Care Instructions: Hand Wash OnlyWired for support and shapingMedium padded cups for fine shaping & nipple coverage3/4th coverage for enhanced support and no spillage,Women-lingerie-wear
708,Women's Beechwood Modal Bikini Briefs | Pure Soft Breathable Briefs | Lingerie for Women,Tailor & Circus,399,4.9,19,"Care Instructions: Machine WashFit Type: RegularHigh-quality Fabric - The bikini brief womens underwear is comfortable, silky, smooth, soft, reduces sports friction and dries quickly after washing. The natural cotton lining is breathable and comfortable, protecting women's private parts and allowing the skin to breathe freely day and night, offering a comfy stretch for your perfect fitComfort You Deserve - We master in providing the best innerwear for women, the ultra-soft waistband moves with you without pinching or binding. The no ride up briefs fit is designed with a low waist and full-seat coverage, with leg bands that stay in place, are must haves for women. Bikini Briefs are no pilling, no fading, no shrinking and no skin irritation. Our sexy underwear is an ingenious combination of comfort and sexy for ladies.Bikini Cut, Beyond Fit - True to size, no issues with sliding around or wedgies while wearing with jeans or leggings, also suitable for panties pads. With full back coverage & double layer crotch, this lady's bikini briefs underwear will provide you with more support and confidence. The lightweight, cool, comfort moisture-wicking fabric keeps you cool and dry all day.An Ideal Choice - Our bikini underwear for women are made from modal fabric which is made from beechwood tree fibers. It's an eco-conscious alternative to synthetic rayon. Plus, it's more breathable & makes it a perfect lingerie for women with comfort and durability. The soft elasticized waistband feels great and stays smooth without chafing, digging, or pinching.Easy Wash Care - Womens underwear is entirely machine washable, for easy, stress-free care. Zero impact soft layered waistband. Throw them right in the washing machine on laundry day. It is a total comfort at the leg openings. The modal material used holds its shape that helps it last long.",Women-lingerie-wear
709,Lacy Copper Lingerie Set,CUKOO,699,No reviews,,"Care Instructions: Hand Wash OnlyFit Type: RelaxedFabric : NylonColor : CopperClosure : Back ClosureWash Care : Nylon and Elastane, Hand Wash only, Do not IronBottom & Upper Type : Hipsters & Lacy Bra",Women-lingerie-wear
