,title,brand,price,rating,reviewCount,description,categories
311,Kiss Bra Silicone Adhesive Stick on Strapless Backless Bra for Women Multicolour,Generic,329,Previous page,,"Care Instructions: Dry Clean , hand washBreathable and Lightweight: Ultra light weight won't make any sense of uncomfortable. Absolutely soft & invisible under low-cut clothing. The holes of bra will keep your breast has a good permeability, give your chest the gentlest care,which make you feel cool and relax all day. good feelBetter feel Perfect for evening dress, backless strapless dress, halter blouse top, club/party dress or most low-cut outfits. Strapless plunge bras are suitable for wedding, party, dinner, prom, homecoming and daily wearFit Type: RegularReusable, skin-friendly silicone adhesive. Perfect for strapless and low-cut outfits, backless dresses and topsFor Many Occasions--- Strapless invisible bra well wear under any sexy dress style, backless halter top, deep V-neck clothing, backless/strapless evening dress, Wedding Dresses, low-cut outfits, cocktail dresses, party dress and more. Make you be the focus, more elegant, more attractive .",Women-lingerie-wear
312,Ice Silk Seamless Underwear Ladies Cotton Crotch Mid-Waist Girl Summer Winter Thin Briefs Panty Multicolor (Pack of 1),Avittam,249,Previous page,,"Care Instructions: Hand Wash OnlyFit Type: Regularâœ¯ Invisible, Seamless & Lightweight: Made of 75% polyamide and 25% Spandex, these premium quality panties have a seamless style that you can wear under tight-fitting dresses without worrying about visible panty lines.âœ¯ Fit Type: Regularâœ¯ Full coverage brief panties features front soft trim and elastic waistband.âœ¯ Made of soft cotton stretch fabric for everyday comfortâœ¯ Label free comfort - no label on the product to ensure no itching",Women-lingerie-wear
313,Womenâ€™s Seamless Hipster Underwear No Show Panties Invisible Ice Silk Stretch Bikini Underwear Breathable Panty Free Size Multicolor 3 Pieces,MYYNTI,379,Previous page,,"Care Instructions: Hand Wash OnlyFit Type: RegularPerfect label-free design. Say goodbye to disgusting tags. Tag less design eliminates scratches and makes it more comfortable and relax.Classic cut with elastic ruffle, soft leg opening, comfortable to wear every day. No ride up, any wedgies, no rolling down and up.The medium waists underpants serve well for mid raise pants. Perfect choice for everyday use, home, bedtime and working.Machine washable and tumble dry with low heat, although these hipster briefs have ruffle detailing around the waist.Women's Briefs with breathable crotch for more protection, sweat wicking and breathable. Leg openings for chafe free comfort, no roll up with any type of movement.",Women-lingerie-wear
314,Women Padded Sports Bra with Removable Pads for Girls,Blush n Bloom,395,3.5,2,"Care Instructions: Hand Wash OnlyCare Instructions: Hand Wash,drip dry in shade, do not iron, do not bleach, Remove pads before washRemovable Pad It Is Very Comfortable To Touch And Wear. Designed To Make A Women Look More Young And Ravishing. & Type: Sports Bra With SupportTHIS GIRLS PADDED SPORTS BRA Quick-Dry Fabric Technology Wicks Sweat, And Keeps You Cool And Dry. Racerback Design Allows A Wider Range Of MotionQuick Dry Feature keeps you cool and comfortable Breathable Cotton Blend for a soft fabric handfeel",Women-lingerie-wear
315,Women's Cotton Non-Padded Non-Wired Full-Coverage Essential Bra - Forever Assorted Solid Colours (Pack of 1),VIP Feelings,246,3.6,20,Care Instructions: Hand or Machine WashFabric: 66% Cotton 34% PolyesterColours: Assorted Solid ColoursCoverage: Full; Closure: Back Cloure; Straps: Regular Adjustable StrapsPadding: Non-Padded; Wiring: Non-WiredProduct comes in assorted colours - actual colours and prints may vary from the images shown,Women-lingerie-wear
316,Women's Spandex & Cotton Lightly Padded With Removable Pads Non-Wired Bralette Bra,ChiYa,460,3.6,375,"Care Instructions: Hand Wash; Do Not Bleach; Shadow; Do Not Iron; Do Not Dry Clean; Wash With Similar ColorSexy Lace Blouse Cut Out Shirt Summer Beach BraMaterial: Blended ( Cotton & Polyster)Bust:- 76 cm - 91 cm / 32-36 inch & Length:- 30 cm / 11.8 inchCUP : Full Cup & Straps : Stretchable LaceWash Care : Warm wash, do not bleach, do not iron, do not dry clean",Women-lingerie-wear
317,Super Support M-Frame Non Padded Everyday Cotton Bra (BR133),Groversons Paris Beauty,349,Previous page of related Sponsored Products,,Care Instructions: Hand Wash OnlyMoulded Seamless Bra || Triple hook at back closure || Full coverage braAdjustable straps that prevent strap slippageWire free frame gives complete under bust support with flexible lift.Wide bottom band designed keeping in mind comfort and support for your body type.,Women-lingerie-wear
318,Beautiful Blue Elegant Lace Sexy Bikini,Quttos,199,Previous page,,Care Instructions: Hand Wash OnlyFit Type: RegularBikini PantyLace PantyMid Rise PantyLow Coverage PantySexy Bikini Panty,Women-lingerie-wear
319,"Retailvibes Women Regular Fit Stretchable Strapless Girls Cotton Camisole for Home Indoor & Outdoor Sports Exercise, Gym, Yoga, Jogging, Cycling, Camping, Running, Workout for All Ages",Generic,130,Previous page,,"Care Instructions: Hand Wash OnlyFit Type: Relaxed FitPerfect For You Designed to create the perfect shape with a breathable cup Perfect for casual wear Sports: Cycling / Camping / Outdoor / Running / Jogging / Fitness / Workout / YogaSilky-smooth Modal pairs up with Elastane fabric to provide maximum softness, comfort, and stretch.Sleeveless design, Stretchable, Easy to wear pullover style, Tank Top Made of Soft Modal Fabric, Round Neckline for Full Front & Back CoverageExtremely soft cotton fabric which is comfortable and fit to your skin. Keeps dry you whole dayIt's suitable for all ages women.Care Instruction: Do not Bleach.Color may be Differ lightly due to photography effect.",Women-lingerie-wear
320,Women Panties Cotton Anti-Bacterial (Pack of 6),CUBO,430,Previous page,,"Care Instructions: Machine WashFit type : regular classicCare instructions : machine washBreathable Combed Cotton: The panty is made of combed cotton that is extremely breathable and feels super soft against the skinNo Marks Waistband: The No Marks Waistband feels softAge Range Description: Adult , Pattern Name :printed",Women-lingerie-wear
321,Women's Cotton Sleeveless Halter Neck Camisole Slip Spaghetti Pack of 3,Aimly,489,2.6,2,"Care Instructions: Machine WashFit Type: Regular FitHalter NeckSleeveless Design & Stretchable FabricCotton Rich Fabric Provides Excellent Comfort All Day LongTo Be Worn As Lounge Wear, Leisure Wear & Active Wear - For All Purpose Use.Machine Wash Cold (Gentle Cycle) Do Not Bleach, Tumble Dry Low, Do Not Iron, Do Not Wring, Do Not Dry Clean.",Women-lingerie-wear
322,Women's Cotton Sleeveless Adjustable Strap Spaghetti - Pack of 3,Aimly,498,4.0,24,"Care Instructions: Machine WashFit Type: Regular FitAdjustable StrapSleeveless Design & Stretchable FabricCotton Rich Fabric Provides Excellent Comfort All Day LongTo Be Worn As Lounge Wear, Leisure Wear & Active Wear - For All Purpose Use.Machine Wash Cold (Gentle Cycle) Do Not Bleach, Tumble Dry Low, Do Not Iron, Do Not Wring, Do Not Dry Clean.",Women-lingerie-wear
323,Sports Bra for Girls Sports Bra for Women |Full Coverage | Broad Strap| Non-Padded (Pack of 2),kamison INTERNATIONAL LINGERIE,599,5.0,2,Care Instructions: Hand Wash OnlyFabric - 100 % Hosiery Cotton FabricBra type: SportsStraps: RegularClosure: Back closureThere might be minor color variation between actual product and image shown on screen due to lighting on the photography,Women-lingerie-wear
324,Floral Lace Crisscross Bow Front - Garter Underwire Teddy Bodysuit Set - Sexy Lingerie for Women - Garter Belt with Stockings,Pratiharye,"1,499",Previous page,,"Care Instructions: Hand Wash OnlyFit Type: RegularColor: Black , Red , White & Pink , Type: Garter set , Pattern Type: Plain , Bra Type: Underwire , Details: Cut Out, Criss Cross , Number of Pieces: 2 Piece SetFabric: Slight Stretch , Care Instructions: Hand wash or professional dry clean , Chest pad: No Padding , Bodysuits Material: Fabric , Bodysuits Composition: 95% Polyester, 5% ElastaneGarter belt feature: Attached Garter lingerie set with 2 garter straps tipped with metal clips for strong hold, At the rear of the garter belt, hook-and-eye clasps give you an adjustable fit for comfort and feminine touchOccasion: The garter lingerie set is perfect for wedding night, honeymoon trip, Valentine's Day, anniversary, lingerie party, bondoir session, Christmas party, girl's night, bridal gift, bridal outfits cosplay, bedroom and every special day.Package Content: 1 x Women's Lingerie Bodysuit with Garter Belt. 1 x matching pair of stockings , Comes in 100% discreet packing , Pratiharye value your privacy",Women-lingerie-wear
325,"Women Stretchable Breathable Soft Lycra Fabric, Bra Panty Set, Lingerie Set for Women, Non-Padded Bridal Set",MSIU- MY STYLE IS UNIQUE,299,4.0,2,"Care Instructions: Hand Wash OnlyFit Type: RegularFancy, attractive and latest designs.MSIU-My style is unique presents PACK OF 3 BRA PANTIES SET Cotton fabric for all the romantic, stylish ladies and girls. They come in pop vibrant colors .The set comes with fully adjustable and stretchable straps, this non padded, non wired bra gives utmost support and comfort, beautiful lingerie set that looks elegant as well as classy, and is designed to suit your contours.This bra & panty set is what a young at heart wants add it to your daily innerwear & swimwear drawer and feel elated. Adjustable strap, full coverage, Beautiful print and centre of the panty are surly going to win your heart. Normal Daily Purpose Women Girls Honeymoon Set.Sexy set Comfortable Fashionable Trendy Stylish Lingerie SetVery smooth comfortable Material, sexy and breathable, AND Stretchable 100% Imported fabric to give you rich look that you deserve , Honeymoon, beach Wear Bra Panty set, swimwear bra panty set.This Bra Panty collection will be a trendy addition to your innerwear & swimwear. Made from delicate and breathable fabric, hosiery, cups will hold their shapes, ethnic,casual,western bra and panty comes in different colors featuring a beautiful print. These would go greatly with your every outfit and will make you feel comfortable throughout the day. These innerwear & swimwear are been well designed of their straps and cute cups.",Women-lingerie-wear
326,Women's Net Padded Wire Free Bralette Bra _Color: Maroon,Cresale,369,3.6,107,"Care Instructions: Hand Wash OnlyCare Instructions: Hand wash, wash dark colors and print separately, do not bleach or soak, do not tumble dry, dry in shadeIt is very comfortable to Touch and WearHIGHLY STRETCHABLE COMFORT FIT.For wearing underneath t-shirts and fitted tops.Age Range Description: Adult; Underwire Type: Wire Free; Strap Type: Regular; Pattern Type: Floral",Women-lingerie-wear
327,Women Pack of 2 Lingerie Bra Panty Set (Gift Wrapped),Xs and Os,389,3.7,67,"Fit Type: RegularSize : FREE. Fits well for regular Small, Medium sizes. Perfect for size range : Bust (30 to 36 inch), Waist (26 to 34 inch).Style : Pack of 2 Women super hot bra panty lingerie set. Animal print bra panty set. Soft, High stretch Lace bra panty set. Peek-a-boo style bra, g-string panty. Super hot sexy designOccasion: Perfect for Bedroom ,Special nights, Romantic Nights, Valentine's day dress, Honeymoon. Perfect gift for ladies, wife and girlfriend on valentine's day, wedding night, honeymoon or every hot night.Packaging : Product is shipped in 100% DISCREET PACKAGING. We value your privacy. SPECIAL VALENTINE OFFER : FREE Beautiful GIFT WRAPPED PACKAGING (as shown)Package Content : 1 x Women Animal Print bra panty lingerie set, 1 x Women Lace bra panty lingerie set.",Women-lingerie-wear
328,Women's Cotton Thong (Pack of 1) (BJAC0218._Black_Free Size),BJAC,400,3.6,67,"Care Instructions: Hand Wash OnlySeamless Low Rise Sexy Soft Panties.; Material - Polyester,Spandex,Cotton; Wash Care - Hand Wash.Size - One size fits for most. Waist: 26 inch to 32 Inch and Panties High: 18 cmBJAC Lace Transparent Jacquard Girl Underwear Perspective Straps Brief Ladies Sexy Thong PantiesBottom Style: Thongs; Age Range Description: AdultPattern Type: Solid",Women-lingerie-wear
329,"Women's Ultra Thin Disposable Nipple Pasties Cover/Bra Pad Patches/Self Adhesive Sticker Cotton Peel and Stick Petals, Round Shape, Color- Beige, Pack of 6 Pasties (3 Pairs)",Buransh,195,Previous page,,"Care Instructions: Dry Clean OnlyFit Type: SkinnyULTRA-THIN BREATHABLE - The nipple covers made from 100% premium natural cotton and satin breast covers are hypoallergenic, 100% skin-friendly and comfortable to wear for sensitive skin.TOTALLY INVISIBLE - The bra petals's thin edges help to better protect and hide the nipples, ensuring they won't be seen under the clothes and providing a natural look.BEST KIT for ANY OUTFIT - The breast petals are suitable for formal dresses, low-cut dresses, bikini backs, strapless or backless tops, T-shirts and etc.ERGONOMIC DESIGN - With invisible micro-edge design,our breast pasties can seamlessly fit your body for maximum safety.",Women-lingerie-wear
330,Diya_Seamed Single Layered Medium Coverage Bra,VSTAR,186,Previous page,,"Care Instructions: Hand Wash OnlyMade of 100% soft combed cotton fabric provides superior comfort.Soft seamed single-layered cups with deep neckline.Bra ensures enhanced support with broad U-shaped back wings with smooth & adjustable straps.Available in white, black, & skin colors.",Women-lingerie-wear
331,Women Assorted Multicolor Pack of 3 Hipster,C9 Airwear,,4.0,1,Care Instructions: Hand Wash OnlyFit Type: Regular4-way stretch enables perfect fit according to your body.Breathable fabric with rapid dry technology.Rib waistband allows no-mark experience along with firm grip.Moderate rear coverage.,Women-lingerie-wear
332,Women Sports Bra,Puma,989,4.5,5,Care Instructions: Machine WashStyle Name:-Underwear TopModel Name:-Mid Impact Strong BraBrand Color:-BlackActivity:-TrainingMachine Wash,Women-lingerie-wear
333,Women's Cotton Plain Solid Panties Hipster Briefs Combo (Pack of 4) - Multicolored,Generic,299,Previous page,,Care Instructions: Machine WashFit Type: RegularFabric: 100% Pure CottonPattern: SolidDisclaimer: Product comes in assorted colors. Actual colors might vary from the image shown on the website.,Women-lingerie-wear
334,"Poly-Cotton Saree Shapewear Petticoat for Women, Cotton Blended,Petticoat,Skirts for Women,Shape Wear Dress for Saree-All Saree-Shapewear Yellow",UTHAMMA,499,5.0,1,"Care Instructions: Machine WashCare Instructions: Machine WashThe first impression is that it's a tight product because of high compression.Please wear it for 15 minutes and give it time to take the shape of your curves.It's the right fit if you are able to breathe.About Compression: Targeted Area - Abdomen, Hips, and Thighs || Type - MediumNote: [1] The Shapewear is meant to be skin-tight. If you can breathe easily, It's the right fit [2] To find the right fit, refer to the size chart in product photographsSide Slit: A thoughtfully designed Side Slit on hemline for confident and easy movement",Women-lingerie-wear
335,"Poly-Cotton Saree Shapewear Petticoat for Women, Cotton Blended,Petticoat,Skirts for Women,Shape Wear Dress for Saree-All Saree-Shapewear Black",UTHAMMA,499,4.3,53,"Care Instructions: Machine WashCare Instructions: Machine WashThe first impression is that it's a tight product because of high compression.Please wear it for 15 minutes and give it time to take the shape of your curves.It's the right fit if you are able to breathe.About Compression: Targeted Area - Abdomen, Hips, and Thighs || Type - MediumNote: [1] The Shapewear is meant to be skin-tight. If you can breathe easily, It's the right fit [2] To find the right fit, refer to the size chart in product photographsSide Slit: A thoughtfully designed Side Slit on hemline for confident and easy movement",Women-lingerie-wear
336,Women's D Cup - Plus Size -Jiggle Control Full Support Combed Cotton Bra - Non-Padded Wirefree Full Coverage Size,SENSITRA,499,3.9,26,"Care Instructions: Hand Wash OnlyMake the most of your curves! Lift panels in cups five beautiful natural-looking shapingHides your side bulge and gives you full round coverage.Hides away extra flesh to offer firm shape.Its a plus size - D cup bra / People with regular B cup size will find it too large. So, Kindly refer to your perfect size and order the product.Its a highest selling bra from the house of Sensitra...Best cotton and Elastic Used in Center of The Cups for Ventilation. 3 Row Cushioned Hook and I Of Stainless Steel Used for Extra Comfort and Durability.",Women-lingerie-wear
337,"Shapewear- Womenï¿½s Blended High Waist Tummy & Thigh, Slim n Lift Body Shaper (Best Fits Upto- 32-38)â€¦",INNERSTYLE,300,3.2,20,"Care Instructions: Machine Wash in Cold Water, Do not Iron, Trumble Dry Clean, Do Not BleachFREE (Best Fits upto 32 To 38 Waist Size) (Fits upto- L, XL, XXL). Material: Breathable Cotton lycra fabric.SEAMLESS, COMFORTABLE AND EFFICIENT.MIDSECTION AND BACK SUPPORT : Helps to relieve back pain, smooth & toned under clothes,designed to give you full coverage and ultimate comort.A High compression panels covers the entire waist and abdomen.Tummy Control High Waist ShapewearUltra breathable fabric keeps you cool & dry. No Visible Panty Lines. Stretchable Microfiber.",Women-lingerie-wear
338,Women's Cotton Non-Padded Wire Free Minimizer Bra,SONA,398,4.0,144,"Care Instructions: Hand Wash OnlyFit Type: regularFabric: One of the best fabrics to consider when buying a bra is cotton. It is hypoallergenic and guaranteed safe for the environment. However, a cotton bra is very different from the synthetic ones out in the market.Bra Type: Full coverage bras have a high neckline which covers full or most of the breast area. Women who are not the flaunting type are likely attracted to an everyday bra. Just because everyday bras offer full coverage it doesn't mean that they can't make you look sexy. Choosing the right style and fit of full coverage bra can you fetch you a flawless and sexy look.Padding: A full coverage non-padded bra is advisable to heavier busted women as these bras not only provide complete support but also make you comfortable throughout the all day. When you wear a bra all day long, you need to make sure that you feel cozy and supported all of the time.Closure: U Back shape bras are recognized as the true support for women. It has multiple hooks and eye closures. Back open bras give more center support. Whether you are a skinny woman or a curvy woman, the back open bra will flaunt your figure regardless of your outfit.Straps: Fully Adjustable straps to suit all heights, wider straps on bigger sizes for better support and comfort to your CUPs and Body. That way you can enjoy your bra a lot longer and save yourself some money.",Women-lingerie-wear
339,Tummy Tucker Panties Shapewear Panties Panty Sets for Women Panty Combo Panties for WomenPanties for Women Women Cotton Panties Hipster Panty,FIMS - Fashion is my style,599,3.1,42,"Care Instructions: Machine Wash75 MM wide belt for tummy.100% Cotton Fabric PantyAssorted Color & Print, Pattern will remain same.Best panties for Tummy , Tummy Tucker, Shapwear Panties",Women-lingerie-wear
340,Womens Cotton Multicolour Plain Boyshort Panties (Pack of 5) Combo,YAMKAY,399,3.6,19,"Care Instructions: Dry Clean OnlyFit Type: RegularBoyshort panties with comfortable coverage, soft covered the hips and thighs of the wearer to provide a long lasting comfort fit for all-day wearabilityCircular knit fabrication for a completely seamless look.Lightweight and comfortable design makes these boyshort panties perfect for workouts or anytime.Bottom Style: Boy Shorts; Size Name: 90 Cm; Pattern Name: Solid; Age Range Description: Adult",Women-lingerie-wear
341,Women's Cancer Bra-1 Full Coverage Non Padded Cotton Mastectomy Bra(White_40D) Pack of 1,SONA,427,Previous page,,Care Instructions: Hand Wash OnlyFit Type: Regular FitNon Wiredhand washLight Weight For Optimum All Day ComfortRemovable And Washable Fabric Cover To Keep It Fresh,Women-lingerie-wear
342,Women's Polyprene & Cotton Disposable Panties,GLAMORAS,299,3.3,8,"Fit Type: SnugMaterial: Made of strong Polyprene and cotton. Disposable panties - pack of 6Soft multi color printing on white base, Compact & Light weight to carryElastic waistband and leg openings gives a snug and comfort fitEvery garment is individually roll folded and wrapped for easy transport in your pouchIdeal for travelling, spa, body massage, surgeries, maternity and periods.",Women-lingerie-wear
343,Women's Cotton Mid Waist Hipster Panty in Black with Animal Print Lace Waist in Black,Clovia,279,Previous page,,"Care Instructions: Hand Wash OnlyFit Type: RegularProduct Type: Hipster PantyFabric: Spandex,CottonWaist Rise: MidWaistband: Soft elastic at the waistband leg openings for a snug fit.Features: Panty has Double-layered gusset for hygiene.",Women-lingerie-wear
344,Cotton Padded Bra U Back,Girl Basket,299,Previous page,,"Care Instructions: Hand Wash OnlyThe style is our addition in the comfort series. This cotton rich underwire bra makes for a fabulous choice for customers seeking the comfort of cotton. Wide softly padded self fabric shoulder straps ensure firm yet easy comfort even for heavier cups. High centre bridge combined with wide side wings and full cups contain the bust fully; under cups are lined with soft cotton and padded for good shape & optimum supportJacquard double layered design, moulded seam free cups, broad self fabric straps, specially made for bigger bustsAnti Bacterial: Designed with Van Heusen's Anti-Bacterial technology, our bra keeps you cool, dry and comfortable while making the bra look new for long. Stay fresh for longer.Breathable Perforated Cup: The Breathable Perforated Cup elevates the functional appeal and provides comfort all day.Machine wash-water temperature maximum 60`C, No Bleaching, No Tumble dry, No direct sunlight, Use mild detergent, No Ironing, No dry cleaning",Women-lingerie-wear
345,Women Bra,Marks & Spencer,719,4.4,11,"Care Instructions: Machine WashFit Type: Skinny FitBra47% cotton, 42% polyester, 10% elastane and 1% polyamide ( of trimmings)",Women-lingerie-wear
346,Valentino Lycra Shape Wear for Women,SMOWKLY,239,5.0,5,"Care Instructions: Machine WashIt's made up of extremely smooth material so you don't have to worry about redness around your waistIt is so comfortable that it can be used in every day lifeCan be gifted to your Mom, Sister, Friend and wifePlease do prefer the size chart attached at the last image",Women-lingerie-wear
347,AVFASHION Women's Halter Neck Shiny Non Padded Crossback Bikini Bra Panty Lingerie Swimwear Bikini Set,Generic,349,Previous page,,"Care Instructions: Machine WashFit Type: RelaxedWomen's 2 Pieces Bikini Set Halter Bra Tops with G-String SwimwearPerfect for swimming, pool party, lingerie night or honeymoon night, elegant look makes you more appealing for your PartnerFree Size with adjustable tie knot strap easily fits women of any sizeSexy Playful Costume exotic bikini set. It is your sexy secret, spice up your love life, flaunt your shape with this sexy piece of workOccasion: Bedroom, Special nights, Nightwear, Valentine's day dress, Honeymoon. Gives a perfect feminine look",Women-lingerie-wear
348,Women's Wirefree Non Padded Super Combed Cotton Elastane Stretch Full Coverage Plus Size Bra with Lace Styling and Adjustable Straps_Style_ES14_Light Skin_40B,Jockey,899,Previous page,,Care Instructions: Machine WashStyle Number - ES14Super combed Cotton Elastane stretch fabric.Non-padded seamed cups.Full front coverage.Soft and smooth adjustable straps.Wirefree for a light fit & comfort all day long.Regular U back with back closure.Delicate lace styling.Label free for all day comfort.,Women-lingerie-wear
349,Women's Multicolor Panty Combo Pack,C9 Airwear,,Previous page of related Sponsored Products,,Care Instructions: Hand Wash OnlyFit Type: RegularProvides 4-way stretchArray of trendy prints and colorsTag-free waist band that leaves no marks on your skinSnug fit for utmost comfort and support,Women-lingerie-wear
350,"Lycra Saree Shapewear Petticoat for Women, Cotton Blended,Petticoat,Skirts for Women,Shape Wear Dress for Saree (X-Large, Beige + Black + Mustard)",Symvi,699,2.4,2,"Care Instructions: Hand Wash, Machine WashFABRIC: Our saree silhouette is made from a high-quality stretchable polyester-lycra fabric which is very soft, breathable, non-allergic, and skin-friendly.It is not a compress wear but a comfort wearIt Can Not Only Be Used For Sarees But For Other Outfits Like Lehengas And Gowns As WellThis Saree Silhouette is designed for hug close to your body and it allows the Saree to follow the figuration of your legs and gives you the perfect curvy lookEASY MOVEMENT: The Mermaid/fishtail design has more circular fabric at the bottom, so, now you can walk very easily and you can feel comfortable even sitting cross-leggedDRAWSTRING & ELASTIC : Mehrang saree silhouette comes with a removable drawstring and high-Quality Elastic at waist round which will never be loose and hold the saree right exactly where you want",Women-lingerie-wear
351,Pack Of 6 Camisole,Generic,449,2.0,2,Care Instructions: Hand Wash OnlyFit Type: Regular FitFit Type: Slim Fit100% cotton CamisoleBroad neckline for front and back coverageFull adjustable shoulder strapsCan be worn as liner & loungewear,Women-lingerie-wear
