,title,brand,price,rating,reviewCount,description,categories
0,TheGiftKart Back Cover for Xiaomi Mi 10i 5G (Poly Carbonate | Black),TheGiftKart,349,4.3,"2,104",360 DEGREE PROTECTION: This Sturdy Armor Case has a Rugged Construction which provides the phone All-Round Protection. Raised Lips on Front & Back provide Proper Camera & Screen Protection.RING HOLDER: Innovative Ring Holder Design is Highly Adjustable which allows you to hold phone with Extreme Ease & Comfort.IN-BUILT STAND: The Inbuilt Stand Provides you a Handsfree Experience while watching any Movie or Video Content.METAL PLATE INSIDE: A High-Density Metal Plate is Installed in this case which makes it Compatible with that Magnetic Car Holder in your Car.,Electronic_accesories
1,"Fedus Cat6 Ethernet Cable, 1 Meter High Speed 550Mhz 10 Gigabit Speed Utp Lan Cable, Network Cable Internet Cable Rj45 Cable Lan Wire, 6 Wires For Laptop, Pc, Television, Router, Modem - White",FEDUS,199,4.4,"8,961","✔️HIGH-PERFORMANCE INTERNET CABLE IS CAT6 RATED - The Ethernet cord with 24 AWG CCA wire provides universal connectivity for LAN network components such as PCs, computer servers, printers, routers, switch boxes, TV, Gaming Devices, network media players, NAS, VoIP phones, PoE devices, and more.✔️UPTO 10 GIGABIT SPEED - This FEDUS rated cat 6 lan cable is 24 AWG with 4 pairs (8 conductors). Suitable for 1 and 5 Gigabit speed up to 328 feet and 10 Gigabit speed up to 165ft depending on the installation environment. Bandwidth tested up to 550 MHz. Supports PoE, PoE+, and PoE++ (IEEE 802.3af/at/bt) up to 60W and 300V DC.✔️THE RJ45 METAL-SHIELDED CONNECTORS WITH GOLD-PLATED CONTACTS - Metal-shielded shell eliminate cross-talk and prevents electromagnetic interference (EMI) that be caused by nearby power lines or appliances, molded strain-relief boots, and Snagless molds resist corrosion, provide durability, and ensure a secure connection; CCA Ethernet cables enhance cable performance and comply with specifications for communications cables✔️FLEXIBLE AND DURABLE - RJ45 cable with high bandwidth of up to 550 MHz guarantees high-speed data transfer for server applications, cloud computing, video surveillance, and online high-definition video streaming✔️LIFETIME FRIENDLY CUSTOMER SERVICE ? 6 Month worry-free warranty. Each Cat 6 internet cable goes through rigorous testing to ensure a secure wired internet connection with exceptional speed and reliability. If for any reason you are not satisfied with the item, you will get a replacement✔️QUALITY CONTROL - Each Cat 6 internet cable goes through rigorous testing to ensure a secure wired internet connection with exceptional speed and reliability.",Electronic_accesories
2,"Enflamo Soft Back Cover Case for iPhone 13 Pro (Black, TPU) | with Camera Protection",Enflamo,199,4.1,109,"ULTRA THIN: Only 0.03 inches. The ultimate thin case if you are looking for elegant protection without adding bulk to your pocket or purse. This Phone case is slim, lightweight and one of the thinnest cases you can find.PERFECT GRIP: Most of ultra slim cases are too smooth and slippery but not this one. For extra anti-slip grip this case features a slightly brushed finish that helps prevent your iPhone from slipping out of your hands.SLIM BUT PROTECTIVE. Get that extra peace of mind knowing your Phone is protected from scratches, bumps and Scratches. This case is manufactured using flexible yet sturdy polypropylene that is more durable and protects your phone form all sides.PREMIUM DESIGN. This case features no visible branding for a clean, classy look. Well designed and guaranteed to fit perfectly. The finish is matte and frosted. The material is soft silicone. This keeps your Phone looking cool and pristine while showing off its original design.Compatibility - Enflamo Back Case Compatible with iPhone 13 Pro 6.1 Inch",Electronic_accesories
3,Amozo Back Case Cover for iPhone 13 Pro Max (Poly Carbonate | Black | Frameless),Amozo,260,3.9,411,"Compatible Cover Case for iPhone 13 Pro Max 6.7Camera Protection all aroundPrecise cutouts, Matte finish, Anti sweat, No smudges on back.Flexible case with Translucent finishFrameless Design - With finger hanging ring",Electronic_accesories
4,HP Wings Backpack for 15.6'' Inch (39.6 cm) Laptop/Chromebook/Mac (Black) 1D0M4PA,,749,3.6,83,Classic style with modern appeal: A backpack with the storage you need in a refined design that's noticeably different.Compatibility: Separate compartments fit a notebook up to 15.6 inches (39.6 centimetres) diagonal and a tablet.Special Features: Laptop Compartment; Age Range Description: Adult; Water Resistance Level: Water Resistant,Electronic_accesories
5,"Amazon Basics Adjustable Portable Laptop Table, Bed Table, Notebook Stand, Laptop Standing Desk, Portable Standing Table with Foldable Legs, Foldable Lap Tablet Table for Sofa Couch Floor",Amazon Basics,"1,399",2.0,1,"You can use the table as a bed table, a notebook stand, a laptop standing desk, and more.Foldable legs allow you to store the table easily.The legs can be extended vertically, enabling you to use the table while standing.The flat top features soft notches which keep things from rolling down when the table is tilted.Owing to its size and strength, the table is compatible with all laptops.The smooth tabletop can be easily cleaned with a moist cloth.The table is highly versatile and has multipurpose use- from a standing workstation to a couch desk to a breakfast-in-bed tray.",Electronic_accesories
6,"Anjaney Enterprise Smart Multipurpose Foldable Laptop Table with Cup Holder, Study Table, Bed Table, Breakfast Table, Foldable and Portable/Ergonomic & Rounded Edges/Non-Slip (Wood)",Anjaney Enterprise,249,3.8,226,"> ★ ★------->EASY TO FOLD OUT: Clever folding design allows the legs to fold flat so you can easily put it behind the door or the corner of home when not in use. No need to install everytime you use.>★★------->LARGE, STABLE, PORTABLE FOLDING TABLE: The folding size of our laptop desk is about 60cm(L) * 39.5cm(W) * 27cm(H) such that it fits upto 11-17inch laptops and also a space for mouse. Built-in iPad stand groove for holding ipad or kindle. Our table comes with a table cup holder to keep your favorite drink within reach.>★ ★------->MULTI-PURPOSE LAPTOP DESK: Laptop bed tray is perfect lap desks for work, games, reading, eating and school from the comfort of your bed, floor, sofa or couch. Great work from home gift & bed accessories!> ★ ★------->NON-SLIP BOTTOM DESIGN: The steel feet are covered with black sponge for good anti-slip effect to keep your laptop safe without slipping when in tilted position. Also provides you a comfort and stability while using.>★ ★------->ENVIRONMENTAL FRIENDLY MATERIALS: Laptop Bed Table is made of MDF solid wood particle board, safe and environmentally friendly. The surface is smooth, non-toxic, not easy to stretch, moisture-proof, scratch-resistant, high-temperature resistant. While the legs are made of aluminum alloy tube with powder coated finishing work, it is more strong, sturdy and curved ergonomic tabletop designed for sitting. This table will last for a lifetime and will remain corrosion-free",Electronic_accesories
7,ELV Direct Tabletop Universal Mobile Phone Stand Holder Mount with Inbuilt Cable Organiser for Phones and Tablet Upto 17.78 cm (Upto 7 inches) - Black (Earphone NOT Included),ELV Direct,84,4.2,359,"Metal phone stand: This Phone stand is portable, lightweight and it works perfectly well with almost all phones.Wide compatibility: Compatible with all mobile phones (all size), eBook readers and most tablets (up to 7 inch), even with the heavy case onPerfect for watching movies and reading: Cell phone stand perfect for desk or table to watch movies, read, sync charging your phoneAnti-Skid Rubber protection: The Anti-Skid rubber protection at the bottom of the stand keeps your device from scratches and slidingWarranty: 3 months manufacturer warranty",Electronic_accesories
8,"Sounce 360 Adjustable Mobile Phone Holder, Universal Phone Holder Clip Lazy Bracket Flexible Gooseneck Clamp Long Arms Mount for Mobile Tabletop Stand for Bedroom, Office, Bathroom, White",Sounce,499,4.0,"1,628","【PERFECT FOR ANY PLACES】: Perfect for watching movies & enjoying music in the bedroom, cooking in the kitchen, exercising in the gym and working in the office. Fine details and craftsmanship, make life easier. Lazy bracket for you, free your hands.【HEAVY DUTY & STURDY HOLDER】: Large Base for Stable Mounting without Vibrations, tight and bendy arm, secures your smart phone, iPad or tablet and other electronic devices tightly to prevent the unit from falling or moving around.【360 º ROTATION】: Designed with flexible long arms clamp, working at 360-degrees, making holder adjustable to view your device at any angle.【COMPATIBILITY】: This ergonomic gooseneck tablet holder, compatible with all 4. 7 - 10. 5 inch cell Phones and tablets, such as iPad mini 2 3 4, iPad Pro 9. 7 10. 5, iPad 9. 7 2018/ 2017, 2018 new iPad Pro 11, iPad Air, iPad Air 2, iPad Air 4, Galaxy Tab a 10. 1 10. 5 9. 7 8, Galaxy Tab s 8 9. 7, Galaxy Tab E 9. 6, Switch.【QUALITY GUARANTEE】: If there is any quality problem of the product itself, do not hesitate to contact us immediately. We will solve the issue to your satisfaction. Customer service is our business philosophy.",Electronic_accesories
9,"TheGiftKart Back Cover for Samsung Galaxy A52/A52s 5G (Poly Carbonate, Polymer | Black)",TheGiftKart,399,4.4,"1,081",360 DEGREE PROTECTION: This Sturdy Armor Case has a Rugged Construction which provides the phone All-Round Protection. Raised Lips on Front & Back provide Proper Camera & Screen Protection.RING HOLDER: Innovative Ring Holder Design is Highly Adjustable which allows you to hold phone with Extreme Ease & Comfort.IN-BUILT STAND: The Inbuilt Stand Provides you a Handsfree Experience while watching any Movie or Video Content.METAL PLATE INSIDE: A High-Density Metal Plate is Installed in this case which makes it Compatible with that Magnetic Car Holder in your Car.,Electronic_accesories
10,"Synqe USB C to USB C 60W Nylon Braided Fast Charging Type C to Type C Cable Compatible with Samsung Galaxy Note 20/Ultra, S20 S22 S21 S20 FE A73 A53 A33 (2M, Black)",Synqe,349,4.3,949,"【NOTE before purchase】:This is a USB-C to USB-C cable, which means it has the same USB C plug on both ends, please be aware that this is not a USB-C to USB-A cable. Besides, you may need a USB C wall charger to charge your device.【NYLON BRAIDED, EXTREME DURABILITY】: with a tested 20000+ bend lifespan, Synqe USB C charging cable with heavy duty braided and strong metal connections is far more durable【3A Rapid Charging】 ： Built-in smart chip, which makes this USB-C to USB-C PD cable strong enough to support max 3A current 65W power through, as well as support fast charging for more phone,like Pixel 2 XL,Samsung Galaxy Note 10,Nexus 5X/6P and more Type-C devices. You need a USB C wall charger to charge your device and we recommend using the original wall charger.【60W High Speed Charging】: Output power up to 20V 3A, which is ensured by high-speed safe charging, and the USB 2.0 supports data transfer speed can reach 40~60MB/S (480Mbps). NOTE: This product DO NOT support video output and monitor connection.【12-months warranty】: 12 months warranty and friendly customer services, ensures the long-time enjoyment of your purchase. If you meet any question or problem, please don't hesitate to connect with us.",Electronic_accesories
11,"Venganza Wireless Bluetooth Shutter Remote Control Button Self-Timer Long Distance Camera Remote Compatible with All Smartphones,iOS Device",Venganza,289,4.1,320,"*CONVENIENT AND EASY HANDS FREE SHUTTER CONTROL FOR MOBILE DEVICES: Perfect for taking selfies and steady tripod shots.*OPERATIONAL UP TO 30 FEET (10M): Take photos even when at a distance from your device.*CAPTURE STUNNING PHOTOS & VIDEOS REMOTELY WITH EASE - Say goodbye to blurry photos. Eliminate camera shake for razor crisp photos every time. Snap photos and Start/Stop video recording with the click of a button.*HANDY LITTLE GADGET :This Bluetooth remote makes it exciting to take selfies, group and steady shots hands-free! Post amazing photos and videos on Snapchat, Instagram, Facebook or YouTube with the help of this shutter.*LIGHTWEIGHT AND CONVENIENT TO CARRY :The remote is easy to store. You can bring it anywhere! Just slip it in your pocket and keep it on a keychain.",Electronic_accesories
12,"TEQTA 4 in 1 USB Hub, 4 x USB MultiPort Hub for MacBook, iPhone, Windows Laptops & Android (USB C to A Hub)",TEQTA,499,3.9,50,"USB Hub 3.0: TEQTA 4-Port USB 3.0 Hub simply helps you to connect up to 4 USB devices to your PC or Laptop, such as external hard drives, USB flash drives, mouse, keyboard, USB headphone, speakers, memory cards, keyboard, mouse and much more USB devices etc. It keeps you away from the trouble of plugging& unplugging repeatedly.Slim, Light & Portable: This USB hub Weighs only 30 grams (included package) and measures 16x8x1.5 cm, which is compact, portable and convenient, ideal for your traveling with ultrabook.5Gbps Data Transfer Speed: USB 3.0 data hub supports super faster data transfer up to 5Gbps - 10X faster than USB 2.0 (480 Mbps), which allows you to transfer HD movies or large files in just seconds. It is backward compatible with USB 2.0, 1.1 and 1.0. Through the LED indicator, you can easily monitor the connection status.External Micro USB Power Port Supply: This USB data hub could be powered by your 5V USB power adapter, easily connect it with micro usb charger and cord, don't need to worry about insufficient power supply of 2.5"" and 3.5"" HDD. (Note: Power adapter and micro USB cable are NOT included)Great Compatibility: 4-port USB data hub is compatible with Windows10/(32/64 bit) 8.1 / 8 / 7 / Vista / XP, Mac OS X 10.6 to 10.9, Linux 2.6.14 or above, Android & iPhone, plug and play.",Electronic_accesories
13,"TheGiftKart Tough Armor OnePlus 10 Pro 5G Bumper Back Case Cover | Ring Holder & Kickstand in-Built | 360 Degree Protection Back Case Cover for OnePlus 10 Pro 5G (PC, Polymer | Black)",TheGiftKart,399,4.2,191,COMPATIBILITY: Mobile Back Case Cover for OnePlus 10 Pro 5G only.360 DEGREE PROTECTION: This Sturdy Armor Case has a Rugged Construction which provides the phone All-Round Protection. Raised Lips on Front & Back provide Proper Camera & Screen Protection.RING HOLDER: Innovative Ring Holder Design is Highly Adjustable which allows you to hold phone with Extreme Ease & Comfort.IN-BUILT STAND: The Inbuilt Stand Provides you a Handsfree Experience while watching any Movie or Video Content.METAL PLATE INSIDE: A High-Density Metal Plate is Installed in this case which makes it Compatible with that Magnetic Car Holder in your Car.,Electronic_accesories
14,"Cosmic Byte GS430 Gaming Headphone, 7 Color RGB LED and Microphone for PC, PS5, Xbox, Mobiles, Tablets, Laptops (Red)",,949,4.1,"13,583","IMMERSIVE 3D GAMING SOUND & EXHILARATING GAMEPLAY: Muffled sound will cause bad gaming experience. It’s important for gamer to hear footsteps and distant gunshots from different direction in Fortnight, PUBG or CS: go etc. With high precision magnetic neodymium driver, Cosmic Byte headsets offer a 360-degree soundscape, add a sense of realism to your gaming session and reproduce crystal clear sound.FLEXIBLE NOISE CANCELLATION BOOM MIC: Designed for people who suffer from the annoying keyboard noises and other background sound, Cosmic Byte headsets accurately pick up your voice and differentiate between background noise and your voice. With 120° flexible design, easy to adjust mic position at your will and better for game chatting and other application scenarios.ERGONOMIC SOFT EARMUFF+ADJUSTABLE HEADBAND+LIGHTWEIGHT: Many people complain that wearing headphones for a long time will hurt their ears. Cosmic Byte headset shape are designed to naturally fit the human head, the earmuff is filled with soft memory foam, and adjustable headband help to fit different people. Made of light material, weight only 0. 95lb,MULTI-PLATFORM COMPATIBILITY & PLUG AND PLAY: With 3. 5mm jack, compatible with PS4 Xbox One (Older version of Xbox One needs an extra Microsoft adapter, not included), Xbox One S/X, PC, Laptop, Mac, iPad, Tablets, Mobile phone. The USB is to power the RGB led light.RELIABLE AFTER-SALE SUPPORT: Your using experience is what we mostly cherish. We will make our greatest effort to take responsibility for your shopping experience. We will be happy to answer any of your questions, we will reply you in 24 hours.",Electronic_accesories
15,"Wayona 20W Dual Port USB C+USB A Fast Charging PD/QC 3.0 Charger Compatible with iPhone 14 13 12 11 Pro/Max/Mini Samsung Galaxy S22,S10,Note 20,10,M31,M51,A71,A51 (USB C + A Dual Port Charger, White)",Wayona,699,4.0,"1,167","【Fast Charging】: Wayona adapter is equipped with 2 fast charging dual ports, USB A QC3.0 (18W) & USB C PD (20W) which allows you to charge two mobile devices together.【Universal Compatibility】: Supports all iPhones and Android Phones with multiple fast charging protocols like Fast Charge, QC3.0 (Quick Charge), PD (Power Delivery), Dash Charge, VOOC, etc. Perfectly fits the charging needs of iPhone 14, 14 Plus, 14 Pro, 14 Pro Max, 13, 13 Mini, 13 Pro, 13 Pro Max, 12, 11, 11 Pro, 11 Pro Max, XS, XR, SE, X, 8 Plus, AirPods, iPad series, Galaxy S21/S20 series, Note 20, Note10, S10, S9, Pixel series and more.【Dual Port Fast Charging Charger】: Unlike other chargers have a single charging port, Wayona Fast Charging Adapter is designed with dual ports with fast charging, USB C port and USB A port to meet your different demands. Charge iPhone 12 up to 50% in 30 minutes.【Compact Design】: Lightweight and Compact design which won't jam the other ports on the wall outlet. It saves space and convenient to pack into bags and pockets.【Intelligent Safety】: Wayona Dual Port Fast Charger equipped with a smart chip, which can adjust the input power of the phone to your devices from overheating, shortages, and short circuit.",Electronic_accesories
16,EMUNKS OnePlus 11R 5G Back Camera Lens Screen Protector Anti Shock/Anti-Scratch/Clear/Camera Tempered Glass for (pack of 2),EMUNKS,148,Previous page,,"[Crystal Clear] Glass Screen Protector is 100% Touchscreen Sensitivity and Compatible with 3D Touch. Protects your screen from scratches and impact[Crystal Clear] Glass Screen Protector is 100% Touchscreen Sensitivity and Compatible with 3D Touch. Protects your screen from scratches and impact[Made for ]OnePlus 11R 5G]The Smiling Screen Protector forOnePlus 11r 5G "" inch is an ultra-thin screen protector designed to provide ultimate protection for your OnePlus 11R 5G phone screen[Screen Protector]Ultra slim - Screen Protectors are 0.25mm thin, making them hardly noticeable for your viewing pleasure. Specifically made for OnePlus 11R 5G DisplayAnti-Scratch]Protect the phone from scratch, coated with hydrophobic and oleophobic clear layers, the privacy film protects against sweat and oil residue from fingerprints, keeping your phone screen pristine all day long",Electronic_accesories
17,"ProElite Deer Flip case Cover for Realme Pad X 11 inch Tablet, Wine Red",ProElite,399,4.5,171,"✔【This Case is exclusively designed for Realme Pad X 11 inch. This Case allows Full Access to all Features & Controls (Cameras, Speakers, Ports & Buttons) without removing the case. Perfect fit, precise cut-outs provide easy access to all of the features & functions of your Tablet✔【Full Front & Back Protection using Slim Folio Case Profile】 Premium PU Leather Soft-Touch Exterior, Soft Scratch-Free Microfiber Interior offer great Protection. High Quality Lightweight Material & Excellent design makes this case feel very Stylish & Premium & Fully Protects your device against Shock, Abrasion, Scratch, Fingerprint, Slips, Dirt & Corner Damages. This Case is Sturdy and Easy to Install/Remove.✔【Multi-Angle Viewing/Typing】 Built-in Multiple Angle Viewing/Typing Stand makes it much more comfortable for Typing, watching videos, surfing web & reading while keeping both your Hands Free & avoids any Joint Pain. Allows unobstructed gesture swipes & enhances the beauty of your tablet due to its exclusive Bezel-Free design. Exclusive stand design also helps to hold your tablet steady while using Multi-Angle Stand feature & prevents your tablet from falling.Slim lightweight protective hardback with premium quality synthetic leather, the no-scratch soft interior adds comfort and an additional layer of protectionVery Light Weight and easy to carry",Electronic_accesories
18,VMT Stock Samsung Galaxy M33 5G Flexible Crystal Clear TPU Ultra Protective Back Case Cover - Transparent,VMT STOCK WITH DEVICE,159,4.5,6,"Compatibility: Premium Case for Samsung Galaxy M33 5G . Easy access to all Ports including microphone, speaker, camera and all buttons.Design: “Clear Transparent Back” Highlights the contour of your mobile device by giving it a sleek and compact look. Extremely Thin Profile and highly durable due to the High Density TPU Used.Especially Designed TPU : Sophisticated design which Embrace the Original Looks Of your Device. Non-Fading| Non-Yellowing MaterialAll-Round Protection: Well Wrapped 4 corners offer 360 Degree Protection against drops and bumps. Raised Lip helps to protect the Phone screen when faced down on a flat surface.High-Grade Material: Made up of high quality and durable soft silicon TPU plastic. Scratch Proof Coating for lasting Durability. Provides a comfortable grip, added protection against accidental drops. Fingerprint proof, Anti-dust, washable & tear-resistant.",Electronic_accesories
19,"SAVIAURA 1 Sheet 2 in 1 Photography Backdrop 3D Flat Lay Tabletop Double-Sided 34x21 Photo Background PVC Wrinkle-Free for Small Products Food, Cosmetics Shoot (#5- Dark Brown Wood Plank Pattern)",SAVIAURA,373,4.4,165,"Both sides are totally different patterns of the sheet. A background meets your two needs! Great photos can be taken without the need to add any filters.Create your superb desk flat lay images. Taking lovely flatly images on your meals, cosmetics, flowers, jewelry, clothes, and so forth.Perfect for tabletop pictures, in addition to for Instagram Facebook posts, pictures, and youtube video vlog backdrops or displays.Pack right into a roll to facilitate transportation. Materials: Paper & PP, It's lined with a plastic coating, and the material is waterproof.Selecting totally different patterns to showcase a theme, show-off superior gadgets you own, impressing your Social Media accounts.",Electronic_accesories
20,"ProElite Smart Flip Case Cover for Samsung Galaxy Tab A7 Lite 8.7"" SM-T220/225 Translucent Back with Stylus Pen, Dark Blue",ProElite,499,3.9,76,"This Case is Specifically Designed To Fit The Tab A7 Lite 8.7"" SM-T220/225 model. Please Confirm Your Tab Model Prior Purchase.Keeping Your Convenience In Mind, This Case For New Tab A7 Lite 8.7 inch is Designed To Give You The Best Utility and User Experience Possible.Perfect Fit and Precise Cut-outs Ensures Easy Access To All The Ports and Buttons On Your New Tab A7 Lite So That You Rarely Need To Remove The Case.Built with Highest Quality Material, This Case For Protects Your New Tab Against Scratches, Bumps and Accidental Drops Keeping Your Precious Device Safe and Sound.Sleek Design and Classy Look, This Case For New Tab A7 Lite is Crafted with Elegance That Surely Will Be An Add-On To Your Style While On The Go.",Electronic_accesories
21,Original 25W Charger Super Fast Charger for Samsung M51/M42/F23 5G/M53 5G/M52 5G/M33|Type C to C | Travelling Charger (Adapter and Cable - White),The Black Store,"1,299",Previous page,,"3X Faster charging than conventional chargers.Intelligent fast charging with Quick Charge Technology at 5V/4A, 10V/6.5A output. The charger auto detects your device and charges it at its fastest supported speed.The charger is backwardly compatible with all versions of quick charge, Dash, Warp, Dart, Flash, Super Vooc, Super Sonic, Fast technologies, smartphones that are not equipped with quick charge technology.",Electronic_accesories
22,Robustrion Smart Trifold Hard Back Flip Stand Case Cover for Apple iPad 10.2 inch 9th Gen 2021 Cover 8th Gen 2020 7th Gen 2019 Generation - Gold,Robustrion,549,4.3,"5,861","This Case Is Specifically Designed To Fit iPad 10.2 inch 7th 8th 9th Generation Only. It will not any other model. Please confirm your model number prior to purchase.Keeping Your Convenience In Mind, This Case by Robustrion For iPad 10.2 inch 7th 8th 9th Generation Is Designed To Give You The Best Utility & User Experience Possible.Perfect Fit & Precise Cutouts Ensures Easy Access To All The Ports & Buttons On Your iPad 10.2 inch 7th 8th 9th Generation That You Rarely Need To Remove The Case.Built With Highest Quality Material, This Robustrion Case Protects Your iPad 10.2 inch 7th 8th 9th Generation Against Scratches, Bumps & Accidental Drops Keeping Your Precious Device Safe & Sound.Sleek Design & Classy Look, This Case For iPad 10.2 inch 7th 8th 9th Generation Is Crafted With Elegance That Surely Will Be An Add-On To Your Style While On The Go.",Electronic_accesories
23,CEDO Lenovo Tab M8 / M8 2nd Gen 8inch TB-8505 X/F/N Flip Cover | Leather Finish | 360 Degree Rotate Flip Cover | Shockproof Style Cover Case for Lenovo Tab M8 / M8 2nd Gen 8inch TB-8505 X/F/N-Black,CEDO,349,4.1,41,COMPATIBILITY: This cover is compatible with Lenovo Tab M8 / M8 2nd Gen 8inch TB-8505 X/F/N model onlyRotaional & Hard PC : 360° Rotational Hard PC for Horizontal & Vertical View.Double Angle Stand : Adjustable and Double Angle Stand for Multi Angle View.Strap Holder : Tough protection and strong grip for Tablet Inside.Multi-Angles : You can adjust the Cover as per your Comfortable Viewing Positions.,Electronic_accesories
