,title,brand,price,rating,reviewCount,description,categories
265,"Arctic Hunter Gaming Backpack Laptop Bag for 15.6 inch Laptop Biking Backpack for Men Water-Resistant Stylish Semi-Hard Armored Backpack with USB Port for Men and Women Daily Use Students, Black",,"2,659",4.3,150,"Armored Gear: The backpack is made of high quality semi hard water resistant Fabric, with high density nylon lining will keep your expensive electronics safe and secure. Comfortable adjustable shoulder straps. Serve you well as casual daily backpack, student backpack for men, women, teens, adultsOrganizer Pockets: 1X Main Compartment to keep key board, headphones, cloths ., desired compartment for laptop upto 15.6inch like Omen, alienware, ASUS, MSI ., One Desired pocket for 10inch iPad, tablet ., 1 X inner Zipper Pocket, 1 X inner mesh Pocket, and 1 X anti-theft pocketInternal Defenses: dedicated, padded pockets protect your laptop and tablet Device in addition to the included charging cable Bag to help keep your accessories protected from ScratchesUSB Charging Port: This laptop backpack comes with a built-in USB charging port outside and USB cable inside. This USB backpack offers you a more convenient way to charge your phone while walking. Please noted that power bank is not included, the USB charging port only offers an easy access to chargeExternal Dimension: 44× 15 ×29 cm (L×W×H). Fits for 12-15.6 inch laptop. It is a great backpack for daily life. You can take it to school, cycling, weekend traveling",Electronic_accesories
266,"UGREEN USB 3.0 Sharing Switch, 2 Computers 4-Port USB Peripheral Switcher Adapter Box Selector for PC, Printer, Scanner, Mouse, Keyboard with One-Button Swapping and 2 Pack USB A to A Cable",UGREEN,"2,259",4.5,"7,269",Comes with One-Button Swapping and 2 Pack USB A to A CableDurable and Long-lasting,Electronic_accesories
267,Jkobi Back Cover Case for Redmi Note 7 | Note 7S | Note 7 Pro (Inside Fiber Cloth | Smooth Matte Finish | Elegant Professional Look |Green),Jkobi,150,4.4,27,"Case Type: Back Case CoverPrecision-cut Design for Easy Access To All Buttons And Ports and Does Not Obstruct The Camera LensNOTE -Images Are for Reference Purpose Only, Color Might Slightly Vary.",Electronic_accesories
268,TheGiftKart Back Cover Case for iQOO Neo 6 5G Back Cover Case | Soft Silicon Rubberised Matte Cover | Protective Sleek Profile | Camera Protection Bump Back Case for iQOO Neo6 5G (Silicone | Black),TheGiftKart,279,4.3,356,"COMPATIBILITY: Compatible / Suitable for iQOO Neo 6 5G only.PREMIUM MATTE FINISH: Multi-layer OITX coating provides the case a Premium Matte Touch & Feel due to which the Case has an Ultra Rich Feel & Finish to it.SLIM DESIGN: This Slim Fit Cover is designed with Advanced Dual-Layer Technology to provide necessary protection while keeping Itself slim and light.COMPLETE ACCESS: The Case features precision cutouts & buttons which provide seamless & easy access to all Buttons, Ports, Camera, Speakers & Microphone.SLEEK PROTECTION: This Slim, Light & Sturdy Silicone cover has an Ultra Thin dual-layer construction which protects the phone from all 4 sides from scratches, smudges, stains & bumps while ensuring that your phone stays as good as new, for a long time.",Electronic_accesories
269,RPPMSP USB 3.0 to Type-C OTG Cable Male-Female Adapter Compatible with All C Type Supported Mobile Smartphone and Other Devices {Multicolor Wired C Type to USB} RP-OTG-02,,129,Previous page,,"Type C on the go Cable enables you to connect flash drive, keyboard, mouse, game controller or other standard USB-A device to USB-C mobile phones or tablets(as the HOST). Please make sure your USB Type C cell phone can support OTG function before your purchase.Premium polymer usb c to usb connector housings designed to provide the optimal support during charging and data transferring, which is safer compared to other metal-based adapters because of possible shock while handling wet-handed. The abrasion resistant tangle-free cable is rugged enough for your everyday use and can stand strong tension forces.Slow data transfer? Worry no more! The USB 3.0 standard provides the speed up to 5 Gbps data transfer so you can transfer even the heavy files quickly. It makes a perfect mobile accessory to carry around when you need to quickly connect your pen drive or other compatible devices with your smart phone.This USB 3.0 to USB-A connector is the key to connecting the past, present, and future of USB. It turns a USB-C port on your new computer into a standard USB port and enables convenient data transfer & device charging between your old and new USB devices.Compatible with OnePlus 6T, OnePlus 6, OnePlus 5, OnePlus 5T, OnePlus 3T or OnePlus 3, Samsung S8/S8 Plus, Google Nexus 5X/Nexus 6P, Google Pixel, Microsoft Lumia 950 XL/950, LG V20 G5 G6. Also, compatible with USB Type C supported laptops.",Electronic_accesories
270,RGY [1-Pack] Ola S1 And Ola S1 Pro Screen Protector 9H Hardness Touch Screen Guard For Ola S1 And Ola S1 Pro Accessory - Glossy,RGY,225,5.0,18,"☑️ Precise Fitted For Ola S1 | Ola S1 Air | Ola S1 Pro EV Scooter☑️ Not reduce the visibility of the screen, but keep your touchscreen brand-new. Does not interfere with the sensitivity of the touch screen or reboot your system, it provides a glossy feeling for your screen instead.☑️ HD Clear SMOOTH Touch：so easy to clean, just gentle wipe. Ultra thin, Ultra clear, made with polished, rounded edges and provide 99.99 percent HD clarity and touch accuracy.☑️ 0.26mm thickness makes your screen smooth and clear. 6-layer coatings of the protector can reduce oil left from your fingerprints and provides smoothness to the screen.☑️ Protective hydrophobic and oleophobic coating protects your screen from fingerprint marks and liquid residue. Also comes standard with a fully loaded kit for a quick and easy installation experience.",Electronic_accesories
271,ARMOUR GUARDS RENAULT TRIBER (8 INCH) Car Infotainment System Accessories Unbreakable Screen Guard (Petrol & Diesel) (Transparent),ARMOUR GUARDS,293,3.7,40,"✔ SUPERIOR PROTECTION. 9H Hardness with 0.26mm Thickness, this glass cover maintains the touch capabilities of your GPS Navigator/ Infotainment system while ensuring better smooth touch feeling, Anti-Scratch & Anti-explosion.✔ CRISP AND CLEAR VISUALS. Installing the screen cover will not affect the color, icon size and touch screen capabilities of your GPS display. It will only keep it safe from dust, scratches, oil, water and fingerprints etc.✔ NO MORE FINGERPRINT SMUDGES. Layered with an oleophobic hydrophobic coating that repels oil left from your fingerprints and adds an additional smoothness to the navigating screen.✔ LASER CUT SCREEN GUARD FOR PRECISE FIT. No need to trim the edges, as it is compatible with RENAULT DUSTER RXZ 110PS AMT (D)✔ ENJOY HASSLE-FREE CLEANING. To keep your GPS screen protector clear and dust-free, simply wipe it with a microfiber cloth. No need to use harmful cleaning substances.",Electronic_accesories
272,ARMOUR GUARDS HYUNDAI CRETA 2020 (10.25 INCH) Car Infotainment System Accessories Unbreakable Screen Guard (Petrol & Diesel) (Transparent),ARMOUR GUARDS,293,4.1,"1,164","✔ SUPERIOR PROTECTION. 9H Hardness with 0.26mm Thickness, this glass cover maintains the touch capabilities of your GPS Navigator/ Infotainment system while ensuring better smooth touch feeling, Anti-Scratch & Anti-explosion.✔ CRISP AND CLEAR VISUALS. Installing the screen cover will not affect the color, icon size and touch screen capabilities of your GPS display. It will only keep it safe from dust, scratches, oil, water and fingerprints etc.✔ NO MORE FINGERPRINT SMUDGES. Layered with an oleophobic hydrophobic coating that repels oil left from your fingerprints and adds an additional smoothness to the navigating screen.✔ LASER CUT SCREEN GUARD FOR PRECISE FIT. No need to trim the edges, as it is compatible with HYUNDAI Venue SX (Diesel) infotainment system.✔ ENJOY HASSLE-FREE CLEANING. To keep your GPS screen protector clear and dust-free, simply wipe it with a microfiber cloth. No need to use harmful cleaning substances.",Electronic_accesories
273,CEDO Samsung Tab A 8.0 (2019) Tempered Glass | Screen Protector Tempered Glass for Samsung Galaxy Tab A 8.0 inch (2019) (SM-T290 / SM-T295),CEDO,275,4.2,"3,174","DISCLAIMER: Compatible with Samsung Galaxy Tab A 8.0 inch (2019) (SM-T290 / SM-T295) only.The IMAGE here is for reference only. Actual product may differ in size and shape. Scratch Proof: Your device will not get any scratches on the actual screen.Anti-Shatter: If broken, the glass will break into small parts but stay in one piece, making it safer for glass screen of your iPad / Tablet.HD Clear and Easy to install: High-grade iPad / Tablet glass provides ultimate clarity. Glass features a sleek adhesive layer that goes on quickly and cleanly. Simply align it, press it, and watch as it does the rest.Sensitive and Easy Maintenance: Glass offers ultimate touch-screen sensitivity with no hindrance in normal usage. It has human friendly chemical coating which repels natural skin oils making Glass simple to keep clean and looking great.",Electronic_accesories
274,POPIO Full Screen Coverage Except Edges Tempered Glass Screen Protector with Easy Installation Kit for Xiaomi Redmi Note 8 (Transparent) -Pack of 2,POPIO,197,4.1,"2,175","Compatible Device: Xiaomi Redmi Note 8 | Area of coverage: covers full screen except edgesHardness: High hardness level provides protection from accidental drop & scratchesEasy Installation: Contains 2 Glass , 2 wet wipes, 2 dry wipes, 2 Dust Absorbers & 6 Guide StickersAdditional features: Bubble proof, Scratch resistant, Anti fingerprint, Anti-glare, Anti-shatter, Touch sensitive",Electronic_accesories
275,Original BN4A Battery Compatible for Xiaomi Redmi Note 7 / Redmi Note 7s / Redmi Note 7 Pro - 4000mAh - 1 Year Warranty.,Digicrown,"1,099",3.4,47,✔️100% mAh Capacity inside for excellent backing up your mobile phone during heavy usage over long duration.✔️1 Year Warranty.✔️Totally tested before dispatch.✔️You're requested to install it via a professional.✔️You're highly suggested to use original charger for it's longevity.,Electronic_accesories
276,"SAIJI Laptop Bed Tray Table, Adjustable Laptop Bed Stand With Storage Drawer, Portable Standing Table With Foldable Legs, Foldable Lap Tablet Desk For Sofa Couch Floor (Black, Large) (PVC Leather)",SAIJI,"3,999",4.5,"2,821","[Easy To Use] Fully assembled adjustable laptop bed table: two auto-lock buttons on each side easily enable quick changes in height, legs can be set to 5 different heights adjustable from 9.4""-12.6""; [Angle Adjustable] In addition two clamps may be used to adjust the surface angle, surface can be set to 4 different angles from 0-36°.[Fashion Design]This lap table with non-slip pvc leather desktop surface,and on the left side of laptop bed tray desk has a little drawer in which you can put your accessories.Notebook slip helps keep your device on the table, preventing the tablet and mouse from sliding off the table.[Multifunction] This multifunctional table will be a perfect addition to your office, home or home office.Use it as a laptop workstation, laptop table for bed, a children's bed table, a mini writing table, laptop couch table,laptop bed tray table, a standing table for office work,a laptop desk for bed, it becomes the great balance for relaxing and productivity.[Foldable] Saiji laptop bed tray desk light but sturdy, folds flat for space-saving storage and portability. Executive oiffice Solutions, set up your laptop or writing work station anywhere in your home or office.Mounting Type: Floor Mount",Electronic_accesories
277,"Logitech MK120 Wired USB Keyboard and Mouse Set for Windows, Optical Wired Mouse, Full-Size Keyboard, USB Plug-and-Play, Compatible for PC, Laptop - Black",Logitech,"1,140",4.4,"1,628","Full-size Sculpted Mouse: The high-definition optical USB mouse puts comfort and control in your hands with smooth, accurate tracking and an ambidextrous shape that feels good hour after hour.Simple Set-Up: Simply plug the keyboard and mouse into the USB ports on your desktop, laptop, or netbook and you're ready to work; compatible with Windows 7, 8, 10 or later.Comfortable, Familiar Typing: Youâ€ll enjoy a comfortable and familiar typing experience thanks to the deep-profile keys and standard layout with full-size F-keys and number pad.Durable and Reliable: This USB keyboard features a curved space bar, spill-resistant design (2), durable keys that can withstand 10 million keystrokes, and sturdy, adjustable tilt legs.Made with Recycled Plastic: Plastic parts in MK120 Black keyboard mouse set include certified post-consumer recycled plastic (1) (Mouse:72 percent, Keyboard: 54 percent).Clear and Convenient: The bold, bright white and long-lasting characters make the keys on this PC or laptop keyboard easy to read and extra durable.Upgrade to Logitech MK270 Wireless Combo: Experience more freedom of movement with MK270 wireless keyboard and mouse combo for reliable wireless, hotkeys, media shortcuts, and long battery life.",Electronic_accesories
278,CEDO Redmi 9 Power/Poco M3 Flip Cover | Leather Finish | Inside Pockets & Inbuilt Stand | Shockproof Wallet Style Magnetic Closure Back Cover Case for Xiaomi Redmi 9 Power/Poco M3 (Blue),CEDO,259,4.0,"1,072","DISCLAIMER: Compatible with Xiaomi Redmi 9 Power mobile only.MATERIAL: High quality material, Ultra High Quality Construction With synthetic Leather,2 Card Slot And 1 Side PocketsACCESSIBILITY: Complete access to all features of the device including microphone, speaker, camera and all buttons with magnetic closure flapPROTECTION: Protects your phone from Scratches, bumps and fallsINSTALLATION: TPU soft inner case. Easy to installation and remove",Electronic_accesories
279,"CROXEY New Version-Car Phone Holder Mount, Rearview Mirror Phone Holder for Car, 360°Rotatable and Car Phone Holder, Multifunctional Phone Mount for Car Green, for All Mobile Phones",Generic,169,1.0,1,"🚗Opening Adjustable- The opening of the support is adjustable. The size and tightness of the opening can be adjusted according to your own needs by turning the rotating button under the opening🚗High-quality material- Made of high-quality ABS material, wear-resistant, not easy to break, can be used for a long time, durable, stable and firm.🚗Suitable for Any Occasion- You Can also be installed in car seats, kitchens, bedrooms, which is convenient for you to study, work, and pass boring time.🚗360° Rearview Mirror Phone Holder- Adjustable Angle, Car phone holder can rotate 360° to meet the needs of different sight lines; Meanwhile, it also supports horizontal and vertical screen switching, the navigation angle can be adjusted at will, which is convenient for you to plan your route and drive better.🚗Easy to install- Large-spacing vise design, fast locking, saving time and effort, fast installation and removal of the mobile phone with one hand. It is easy to clamp firmly on the dashboard or most flat surfaces. The car vent phone holder can be easily removed by pulling it.",Electronic_accesories
280,AUNO Homes Table Laptop Study Bed Home Wooden Foldable Students Stand Office Computer Desk Folding Work Tables laptops Portable (Wood),AUNO,249,3.7,28,"The computer bed table for laptop is novel in design and versatile. You can send it to your friends and family, which will be a creative gift. In the course of use, if you have any confusion, please feel free to contact us, Solve the problem for you in time and provide the best customer service!.No assembly required, ready to go right out of the box! Feel free to reach to our customer service if you have any trouble with this product, your satisfaction is our priority.Using it for simple dining table, laptop computer table, studying desk, serving table, or any other scenes you want for reading/writing/drawing/playing board games/models puzzles arts.Suitable from 5-year-old child to 80-year-old senior. A smooth surface laptop table can use for surfing the internet, reading book, painting work, enjoy leisure snack time, serving breakfast, enjoy family time on your bed, sofa, couch, floor, lawn etc. Indoor or outdoor.Foldable laptop table/bed tray. You can secure the tablet in the groove or secure it in the groove. Charging your tablet is easy because the bed tray has a cable hole.",Electronic_accesories
281,AmazonBasics Ultra Hybrid Polycarbonate; TPU Clear Camera Protection Back Cover Case for iPhone 14 Pro - Crystal Clear,AmazonBasics,399,4.0,11,"QUALITY MATERIAL - Hybrid technology that is made of a best Quality Material.CAMERA PROTECTION - Raised camera bump protect phone camera from scratches.MODERN DESIGN - Elegant Design perfectly uses the advantages of the scratch-resistant material.PERFECTLY MADE CUTOUTS - Pronounced buttons are easy to feel and press, while large cutouts fit most cablesEASY TO CLEAN - The case is very easy to wipe off dust and dirt that keeps clean and dry condition.",Electronic_accesories
282,"ESR Classic Kickstand Case Compatible with Samsung Galaxy S23 Case, Adjustable Built-in Camera Ring Stand, Military-Grade Protection, Scratch-Resistant Acrylic Back, Frosted Black",ESR,"1,683",4.6,21,"Compatibility: only compatible with Samsung Galaxy S23Adjustable Camera-Guard Kickstand: fully adjustable between 15° and 85° to ensure the perfect angle for catching up on your favorite showsBuilt to Last: robust and durable zinc-alloy construction ensures stand stays looking like new while hinge is lab tested to retain its strength after more than 3,000 usesWireless Charging Ready: slim design ensures full compatibility with standard wireless chargers; not MagSafe compatible; retract kickstand before wireless chargingMilitary-Grade Drop Protection: Air-Guard corners, scratch-resistant acrylic back, and raised edges combine to keep your phone protected from drops, bumps, and scratches",Electronic_accesories
283,"(Renewed) Fire-Boltt Tank 1.85"" Bluetooth Calling Smart Watch, 123 Sports Mode, 8 UI Interactions, Built in Speaker & Mic, 7 Days Battery & Fire-Boltt Health Suite",Fire-Boltt,"1,699",4.1,73,"This Renewed product is tested to work and look like new with minimal to no signs of wear & tear; the product comes with relevant accessories and is backed by a minimum six month seller warranty; box may be genericLargest 1.85"" Display : View bigger on the screen with the industry’s largest 1.85"" display covering every edge possible and providing a crystal-clear resolution of 240*280 pixelsBluetooth Calling On The Go - With Fire-Boltt Tank Smart watch, you have the freedom to access a quick dial pad and sync speed dial contacts on the watch. Make calls through the watch while you are in a traffic jam or a packed transport.123 Massive Sports Modes - This watch is equipped with 123 kinds of sports to cover your health metrics at every inch of life.Fire-Boltt Health Suite - Stay updated about your health with this fitness tracker, Monitor your blood oxygen levels at all times, 24/7 dynamic HR tracking available",Electronic_accesories
284,Spigen Ultra Hybrid Back Cover Compatible for Google Pixel 6a (TPU + PC | Crystal Clear),Spigen,"1,299",3.6,"1,854",[Compatibility] Spigen Genuine Case Compatible with Google Pixel 6a[Color Name] Crystal Clear[Case Cover Type] Back Cover Case[Protection] Air Cushion Technology protects your phone against accidental falls[Material] Hybrid technology that is made of a TPU bumper with a durable PC back,Electronic_accesories
285,"MORUS Anti Dust Dirt Plugs Cover for 2021 MacBook Pro 14 inch A2442 & MacBook Pro 16 inch A2485 Apple M1 Pro or M1 Max Chip Accessories, Silicone Port Plugs Cover Dust Cups Set, Black",,399,4.3,154,"【For NEWEST MACBOOK PRO 14 16 INCH PORTS】Dust plugs cover set fits the ports of 2021 Apple MacBook Pro 14 inch Model A2442 M1 Pro/M1 Max Chip and 2021 MacBook Pro 16 inch Model A2485 M1 Pro/Max Chip. Please kindly check the model number ""A2xxx"" on the back of the macbook before your purchase. Not Compatible with any MacBook previous models.This anti dust dirt protection set is NOT compatible with 2020 2019 MacBook Pro 16 inch Model A2141, 2020 & 2019 & 2018 MacBook Air 13-inch Model A2179 A1932, 2020 & 2019 & 2018 & 2017 & 2016 Release Apple MacBook Pro 13"" 15"" Model A2159/A1989/A1706/A1708/A1990/A1707 and MacBook 12 Inch with Retina Model A1534 that with Thunderbolt 3 ( USB 3.2 Type C ) ports【High Quality material】Made of high quality durable and eco-friendly silicone material【Easy-To-Use & Remove】 Simply plug the anti dust dirt plug set into the ports of your macbook, protect the device against infiltrating dust, lint and dirt in headphones and ports, easily remove these dust plugs.【Package Content】Thunderbolt 4 USB-C plugs, 3.5 mm headphone port plugs, HDMI plugs, SDXC port plugs.",Electronic_accesories
286,LF KIA Seltos Car Accessories Navigation or Music System (Stereo) Touch Screen Guard 10.25inch (Company Fitted) - Clear,LF,299,4.1,"1,837","🚗 PERFECT FIT: Precise Fitted For Kia Seltos 10.25inch🚗 HIGH DEFINITION: It won’t reduce the visibility of the screen, but keep your touchscreen brand-new. Does not interfere with the sensitivity of the touch screen or reboot your system, it provides a glossy feeling for your screen instead.🚗 HD & SMOOTH Touch Feeling：so easy to clean, just gentle wipe. Ultra thin, Ultra clear, made with polished, rounded edges and provide 99.99 percent HD clarity and touch accuracy.🚗 ULTRA-THIN: 0.26mm thickness makes your screen smooth and clear. 6-layer coatings of the protector can reduce oil left from your fingerprints and provides smoothness to the screen.🇮🇳 MAKE IN INDIA: Proudly Made in India",Electronic_accesories
287,TheGiftKart Sleek Back Cover Case for iPhone 12/12 PRO | Slim Fit Protective Design | Ultra Matte Finish | Camera Protection Bump | Soft Silicon Back Cover for iPhone 12/12 Pro (Silicone | Matte Black),TheGiftKart,199,4.0,35,Compatible with Apple iPhone 12 / 12 Pro OnlySlim & Lightweight ProfileSuperb Ultra Matte Smudge Resistant FinishProtective Shock-Absorbing DesignRaised Lip for Camera & Screen Protection,Electronic_accesories
288,SupCares Edge to Edge Tempered Glass for Google Pixel 4A (5.81 Inch) with Easy Self Installation Kit | Black,SupCares,329,4.3,38,"Compatible Device: Google Pixel 6A (6.1 Inch)Hardness: High hardness level provides protection from accidental drop & scratchesEasy Self Installation kit: Contains 1 wet wipes, 1 dry wipes, Guide Stickers & Alignment stickersSpecial Features : Bubble Proof, Scratch ResistantArea of coverage: Full Edge to Edge Screen Coverage",Electronic_accesories
289,CEDO iPhone 12 Case Back Cover Shockproof Bumper Crystal Clear | 360 Degree Protection TPU+PC | Camera Protection | Acrylic Transparent Eagle Cover for iPhone 12 (Black),CEDO,229,3.9,267,"DISCLAIMER: Compatible with iPhone 12 mobile only.TPU+PC(Acrylic Hard Cover) - The back case made of TPU and acrylic hard cover.TPU can protect corner guard of your Phone better and acrylic hard cover can display the original beauty of the phone.CAMERA PROTECTION - Raised bezels lift camera off flat surfaces, thus protecting the camera from scratches, scuff marks and accidentsPERFECT CUT-OUTS - Full access to user interface, camera lens, headphone jack, speakerphone and microphone. Allows charging without removing the caseRAISED LIP FOR SCREEN PROTECTION - This Back Case is designed and tested to be compatible with most screen protectors and also supports bilateral wireless charging.",Electronic_accesories
290,FUR JADEN 15.6 Anti Theft Laptop Backpack with USB Charging Port Unisex Bag for College Office Suitable for Men Women,,789,4.0,"5,777","KEY FEATURES - Grey Colour Laptop Backpack for Men and Women for Stylish Office use as well as for Trendy College students. Huge compartment size that can fit upto a 15.6 inch Laptop with ease. Multiple pockets for other accessories.Charging On the Go - Now charge your phone on the go while travelling without the hassle of holding the bulky power bank in your pocket or in your hand. Simple Connect your Powerbank to the wire inside the Bag and leave it in the bag. When you want to charge your phone, just connect your phone charger to the bag and your phone will start charging. IMPORTANT NOTE: We do NOT provide Free Portable Charger with the BagAnti Theft Design - This backpack by Fur Jaden has anti theft design where zipper of the main pocket is hidden at the back. No thief, intruder or robber can find a way to open the backpack, making this totally theft proof. There are secret pockets on the shoulder strap and on the sides of the bag allowing us to keep travel documents, boarding pass, credit cards, mobile phone, earphones etc.Essence of Fur Jaden - We craft signature Laptop Backpacks and Casual Backpacks that are young, vibrant and fashionable, and yet a celebration of timeless style, luxe and sophistication. We strive to make thoughtful designs that are high on aesthetics as well as on utility and functionality.WARRANTY- 6 Month Manufacturer Warranty. 100% Genuine Fur Jaden Men products, 10 days No Question asked replacement guarantee from the date of delivery.",Electronic_accesories
