,title,brand,price,rating,reviewCount,description,categories
129,"KTCOO [Pack 2 Xtend 1.69 inch Smart Watch Screen Guard Scratch Guard Full Screen Protector Compatible for Boat Xtend 1.69"" - Flexible TPU - HD Clear - Bubble-Free (Pack of 2)",KTCOO,149,3.5,237,"KTCOO Smart Band Screen Guard Protector Compatible With Boat Xtend.Maximum Coverage - Flexible TPU screen protector will fit your screen perfectly from curved edge to curved edge. It designed to offer the maximum amount of coverage for your Smart band screen.Best Protection Guard - Screen Protector is made to protect the Activity Tracker Smart Fitness Band Screen from scratches and other external damage.Ultra Clear - 99% HD Clear screen protector with High definition transparency film and maximum resolution which keeps the bright and colorful image quality.Product Does NOT include the TRACKER / WATCH and Its Smart band/Watch TPU Flexible Soft Screen Guard Protector.Bubble Free- After attaching, even if there are bubbles, they all disappear within a few days.",Electronic_accesories
130,Csecurity RJ45 Inline Coupler Cat7/Cat6/Cat5e Ethernet Network Router Cable Extender Connector - Black,Csecurity,80,4.3,925,"RJ45 modular female/female couplers.Great for connecting two Cat 5 or Cat 5e cables to make one longer cable.Standard RJ45 8P8C socket to socket.Function: Compatible with ADSL, hubs, switch, TV, set-top box, router, wireless device, computer.",Electronic_accesories
131,"pTron Volta FC14 20W Fast PD/Type-C Charger Adapter with Fast Charging for iPhone 12/12 Pro/12 Mini/12 Pro Max/11/XS/XR/X/8/Plus, iPad Pro/Air/Mini, Galaxy 10/9/8 (Charger Only) White",PTron,549,4.0,"3,834","Volta FC14 smart USB Charger comes with 20W Super Fast PD (Type-C) compatible Charging | Made in IndiaWide compatibility with all Type-C/PD enabled devices. A compatible 3A USB cable should be used with this charger to experience fast charging. Cables below 3A will charge at the normal rate.Smart USB Adapter: Equipped with intelligent IC which auto-detects the connected device and charges it at the fastest speed of the devices.Multi-layer Chipset Protection - The charger comes with multi-layer chipset protection that gives protection against short circuits, over-voltage, and fire-resistance ABS bodyVolta FC15 charger is compact, lightweight, and can be carried out conveniently; Input AC 100-240V, PD Output DC 5V/3A, 9V/2.22A, 12V/1.67A. 6-months manufacturer warranty from the date of purchase.",Electronic_accesories
132,"Hair Clipper for Philips Beard Trimmer Compatible with BT1232/15, BT1212/15, BT1230/15, BT1215/15, BT1210/15, BT1235/15 Attachment Combs 3mm and 7mm",,295,4.7,4,"3mm and 7mm CombsCompatible with all 1000 series Philips Beard TrimmerCompatible with BT1232/15, BT1212/15BT1230/15, BT1235/15, BT1210/15, BT1215/15",Electronic_accesories
133,Amazon Brand - Solimo Thermoplastic Polyurethane MagSafe Back Cover for Apple iPhone 12 MagSafe Back Cover Compatible for MagSafe Scratch-Resistant Back Cover (Transparent),Amazon Brand - Solimo,319,5.0,1,"[Compatibility]: Only compatible with Apple iPhone 12; full functionality maintained via precise speaker and port cutouts and easy-press buttons[Stronger Magnetic Lock]: Powerful built-in Magnets with 1,500g of holding force enable faster, easier place-and-go Wireless Charging and a secure lock on any HaloLock or MagSafe accessory[Military-Grade Drop Protection]: Rigorously tested to ensure total protection on all sides, with specially designed Air-Guard corners that absorb shock so your phone doesn’t have to.[Screen and Camera Protection]: Raised Screen Edges and Camera Guard lens frame provide enhanced Scratch Protection where it really counts[Stay Original]: Scratch-Resistant, Crystal-Clear Acrylic back lets you show off your Apple iPhone 12 true Style in Stunning Clarity that lasts",Electronic_accesories
134,"Careflection TRIPOD-3110 Portable Camera Tripod with Three-Dimensional Head &Quick Release Plate for All Cameras & Mobile, Best for Making Videos'- Silver, Black",Careflection,329,3.1,282,"Here's a tripod that promises enough length, all the features of a pro tripod and yet extremely light weight. With a maximum height of 105 cm and a minimum height of 35 cm, a weight under 400 grams, you can carry it with you on your holidays.WIDELY COMPATIBLE: Compatible with lightweight video cameras, light weight digital cameras, still cameras and very much suitable for all types of smart phones. (Adapter for smartphone is included).STABLE: Non-skid rubber feet，the stability that triangle structure brings , protect every movement of your precious epquiments , and secures every shooting of yours. If there is any problem with the order or the goods, please contact us in time.To lock simply tighten the knob by twisting clock wise Smartphone Mount With the Universal Smartphone Mount it is a breeze to set up any type of smartphone from 2.2"" to 3.4"" in width. The Rubber Pull tab allows for quick and precise mounting / dismounting of your devices.This product is equipped with remote and microphone to make it a complete package for making videos for youtube and other videos of still photos. With a compact size of only 13” when retracted the tripod makes the perfect companion for every special moment. You can carry it with ease to any event. Easily fits in any travel bag.",Electronic_accesories
135,NISHTECH for Redmi A1 (2022) Premium Transparent Crystal Clear Soft & Slim Back case Cover [Transparent],NISHTECH,149,4.0,"1,616","Compatiblity : Only With Redm A1 (2022)100% Visual Transparency , Perfect cut-outs for volume buttons, audio and charging portsWashable, Fingerprint Free, Flexible,Very Soft,Transparent, Superior Quality, Shockproof, Smooth Feeling,Non-Slipry.Raised upper lip build design to help protect the screen against fall on a flat surfacePerfect Fit, Smart and intelligent design allow you to plug the charger, and access all features without removing the case",Electronic_accesories
136,POPIO Tempered Glass Compatible for OnePlus Nord/OnePlus Nord 2 5G / OnePlus Nord CE 5G (Transparent) Full Screen Coverage Except Edges,POPIO,150,3.7,230,"Compatible Device: OnePlus Nord / OnePlus Nord 2 5G / OnePlus Nord CE 5G| Area of coverage : Edge to Edge Full Screen CoverageHardness: High hardness level provides protection from accidental drop & scratchesEasy Installation: Contains 1 tempered glass ,1 wet wipe, 1 Dry wipes, 3 Guide Sticker & 1 Dust AbsorberAdditional features: Bubble proof, Scratch resistant, Anti fingerprint, Anti-glare, Anti-shatter, Touch sensitive",Electronic_accesories
137,"Tizum Z103- Universal Car Mobile Holder Stand, Self Adhesive Dashboard Mount Cell Phone Holder, Sturdy Groves, Anti Slip Silicone, for All Smartphones Size 4 Inch to 6 Inch (Black-Red)",tizum,285,3.5,177,"STURDY & PROTECTIVE: The Exterior Car Mount stand is made of TPU (Thermoplastic Polyurethane) and Interior TPE (Thermoplastic Elastomers) prevents scratches on devices.GROOVES FOR TWO DIFFERENT VIEWING ANGLE: The small mobile phone holder provide 2 different viewing angles that can be easily placed on the table or bed, and provides hands-free when watching video, reading, video, and viewing photos.WASHABLE & REUSABLE: The strong sticky silicone gel is washable. Use water to clean away from the adhesive gel pad before reusing.EASY TO USE: Easily insert and remove your phone with one hand for easy usability while driving responsiblyCOMPATIBLE: All Smartphone with Cases, GPS and all Android phones up to 6-Inch Screen Size",Electronic_accesories
138,POPIO Tempered Glass Compatible for Xiaomi Redmi 10 Power/Xiaomi Redmi 10C / Redmi 10 (Transparent) Full Screen Coverage Except Edges,POPIO,129,3.7,45,"Compatible Device: Xiaomi Redmi 10 Power / Redmi 10C / Redmi 10| Area of coverage : Full Screen Coverage Except Edges GlassHardness: High hardness level provides protection from accidental drop & scratchesEasy Installation: Contains 1 tempered glass ,1 wet wipe, 1 Dry wipes, 3 Guide Sticker & 1 Dust AbsorberAdditional features: Bubble proof, Scratch resistant, Anti fingerprint, Anti-glare, Anti-shatter, Touch sensitive",Electronic_accesories
139,"VERVENIX Hand Free Neck Fan, Rechargeable Mini USB Personal Fan with 360 Rotation, 3 Adjustable Speeds for Home, Sport, Camping, Beach, Travel, Office (Pink)",VERVENIX,549,4.1,7,"Hands-Free - Neckband fan is designed to be worn around the neck and take it everywhere, no need hold regular portable Mini USB fan. Cool All Summer! Neck hanging fan is perfect for personal cooling on-the-go, camping, trips, office, church, home, makeup, watching sports etc.360° Rotating - Two fans can 360° flexible rotate, which allow you to adjust the best wind direction, can be used as a desk fan or a neck fan. You won’t feel uncomfortable or tied when you hang the fan for a long time, thanks to its lightweight, soft and skin-friendly silicone material of the handle. A wonderful summer gift for your friends and families.6 Adjustable Speeds - Wearable neck USB fan is available with Low / Medium / High speed levels to meet your individual needs. Looks so cool Anywhere Anytime.USB Rechargeable Fan - Built-in rechargeable lithium battery, USB interface is convenient for charging. Owing to different speed, the working time is 2-6 hours(depending on the use of wind speed). You can take it everywhere. Hands free fan - prefect for indoor and outdoor activities.Neck Hanging Fan - For long-haired people, please tie the hair when wearing the fan to prevent it from being stirred into the fan. If you are not satisfied after receiving the product, please feel free to contact us.",Electronic_accesories
140,Spigen Liquid Air Back Cover Case Compatible For Google Pixel 7 Pro (TPU | Matte Black),Spigen,899,4.6,"1,037","[Compatibility] Spigen Genuine Case Compatible with Google Pixel 7 Pro[Protection] Air Cushion Technology protects your phone against accidental falls[Material] Flexible TPU. Anti-slip matte surface gives fingerprint-resistance and comfort in every grip[Perfect Fit] Exact fit, perfect cutouts with minimum bulk. All connections and buttons are easy to reach and easy to use[Licensed Product] Licensed under Made For Google Partnership Program",Electronic_accesories
141,ACED® M2 PUBG Triggers Controller for Mobile Gaming for BGMI/Free Fire/COD Mobile/etc- PUBG Trigger - Gaming Triggers for Mobile Gaming,ACED,799,4.0,207,"Composition: four parts in total, contains 4 buttons. Suitable for phones within 0.47inch/1.2cm.Please note：Controller malfunction or after the controller installed on the phone, Please turn off the phone screen, and then turn on the phone screen again.Operation method of mobile game triggers : The left hand index finger controls the left two buttons, the right hand index finger controls the left right buttonsAdvantages: 1. reduce finger blocking field of view, so that the visible field of view is larger. 2. make the upper limit of operation higher, such as slide, frequent second crouch, probe crouch pull back cover, etc. 3. after using the buttons, you can make the operation easier, faster and less expensive to operate. 4. release the right thumb, so that the right thumb is responsible for fewer buttons, so that the right thumb is more focused on controlling the front sight.This set of mobile game controller is very light, not too large, easy to operate, from the beginning to proficiency is not difficult.",Electronic_accesories
142,CEDO Rugged Armor OnePlus 5 | TPU Military Grade Shock Proof Back Cover Case for OnePlus 5 (Black),CEDO,299,4.4,636,"DISCLAIMER: Compatible with OnePlus 5 / One Plus 5 mobile only.ANTI-SHATTER: Advance shock absorption protection from drops and bumps. Raised lips protect the screen and camera bump. Unique Look featuring Smooth Silk Brushed texture, glossy accents and carbon fibre texture.PERFECT CUT-OUTS - Full access to user interface, camera lens, headphone jack, speakerphone and microphone. Unique Look featuring Smooth Silk Brushed texture, glossy accents and carbon fibre texture. Easy to remove & install, anti finger print, anti scratch, washable case. Heat Dissipation Design, flexible and tear resistant.GREAT PROTECTION - Ultra-slim, light weight protect your valuable investment from scratches and damageANTI-SCRATCH: Stylish, protect your valuable investment from scratches and damage",Electronic_accesories
143,Original Fast Charging Cable Fast Data sync Cable only Compatible for oneplus 7t/7t pro/7/7 pro/6/6t/5t/5/3t/3/8/8 pro/nord one Plus and All c Type Devices,"Naru, Quality Beyond Comparison",449,5.0,2,Compatible for All Mobile,Electronic_accesories
144,"Car Rearview Mirror Phone Holder- Car Phone Mount- Phone Bracket, Phone Stand with 270° Swivel and Adjustable Clips, Universal Smartphone Cradle (Black, Plastic, For 3.7 To 6.6 Inch Smartphones)",Generic,299,2.8,52,"✔Fits all sizes of Rear view mirrors, easy adjustment for optimal viewing angles✔Easy to install, no tools required. Padded holding arms safely secure your device in place without harming it.✔Shock resistant / Slip resistant - hold your device securely in place.✔Non Recycled High quality Virgin Plastic Universal Car Rear View Mirror Mount✔Universal adjustable Car Rear-view Mirror Mount fits most smartphone and navigator smaller than 5 inch",Electronic_accesories
145,WOW IMAGINE Slim Ultra Soft Rubberised Back Cover for Xiaomi Redmi Note 12 Pro 5G | Inner Velvet Fabric Lining | Matte Silicone Flexible Camera Protection Back Case – Black,WOW IMAGINE,189,3.5,11,"Designed Exclusively For Xiaomi Redmi Note 12 Pro 5GSuperior Finish : Our Patent applied Embedded Infused Color Technology (EICT2).An excellent fit for your Device. All cutouts and buttons are precisely designed to access all your device's features.Professional Design: Suitable for Men, Women, and Teens of all ages.Scratch Proof Coating for lasting Durability. Also features the Upper lip build design to help protect the screen when face down on a flat surface",Electronic_accesories
146,"Amazon Brand - Solimo Silicone, Thermoplastic Polyurethane Anti Dust Plug Mobile Cover (Soft & Flexible Back case) for OnePlus 7, Clear",Amazon Brand - Solimo,119,4.2,240,"Durable, soft and flexible back caseTear & slip-resistantRaised upper lip build design to help protect the screen against fall on a flat surfaceProtects phone from scratches, fingerprints and sweatEasy to put and take off",Electronic_accesories
147,Eveready Rechargeable Battery - 1000 Series AA - Pack of 2,Eveready,214,3.9,49,Eveready 1000 Series AA Rechargeable NiMH Batteries -Last Longer & Save CostEveready Rechargeable Batteries can be recharged for up to 1000 times giving long lasting performance,Electronic_accesories
148,Spigen Ultra Hybrid Pro Case with Pencil Holder Compatible with iPad Pro 12.9 inch (2022 / 2021) - Black,Spigen,"2,564",4.3,635,Precisely designed for the iPad Pro 12.9 inch (2022 / 2021)Fully supports Apple Pencil functionsBuilt-in kickstand for easy hands-free viewingDual-layered with Air Cushion TechnologyRaised edges for screen and camera protection,Electronic_accesories
149,TheGiftKart Flip Back Cover Case for Redmi 11 Prime 5G | Dual-Color Leather Finish | Inbuilt Stand & Pockets | Wallet Style Flip Back Case Cover for Redmi 11 Prime 5G (Brown & Coffee),TheGiftKart,275,4.4,71,STYLISH LEATHER LOOK: Premium Dual-Color Leather Styling Carefully Crafted by Seasoned Craftsmen Gives it a Rich & Stylish Look.INBUILT STAND: The Inbuilt Stand Provides you a Handsfree Experience while watching any Movie or Video Content.POCKETS INSIDE: There are Pockets built inside which allows you to keep Cards / Cash / Docs in this Wallet Case.COMPLETE PROTECTION: It provides Excellent Shock-Absorption & Complete 360 Degree Protection from all 6 Sides.EASY CLOSURE: Soft Magnetic Lock enables Easy Closure of the cover in order to ensure Device Safety.,Electronic_accesories
150,"SIDRUM 1/4 Thread Gopro Tripod Mount Adapter Compatible with GoPro Hero 10 9 8 7 6 5 4 3+ 3 , SJCAM, DJI OSMO, Insta 360 and All Other Action Cameras (1/4-Mount-Set of 2)",SIDRUM,153,3.6,126,"【Wide Compatibility】Compatible with: Go Pro Hero 10, Hero 9, Hero8, Hero7, Hero6, Hero5, Hero4, Session, Hero3+, Hero3, Hero2, Hero1, Hero (2018), Fusion and most action cameras.【Wide Use】Often used for mounting on the tripod or a monopod.【High Quality】Made of high quality material, different from the normal one.【Convenient】Tripod mount for attaching your quick-release GoPro camera to a standard 1/4-20 tripod stud.【Tripod 】The tripod mount help attaching GoPro to other equipment,keep your camera tight and stable to capture more wonderful moments.",Electronic_accesories
151,Lavie Women's Mento Laptop Bag | Ladies Purse Handbag,,"1,325",5.0,6,"Sleek laptop bag which can be teamed well with your formal dresses.Features dual shoulder handles.Functional and trendy, this laptop handbag from Lavie will carry all your essentials for your day.Made from high quality and soft material, this handbag features a well-stitched inner lining for easy accessibility and storage.Carry to work with style & comfort.",Electronic_accesories
152,"UltraProlink PowerLink+ UM1023 12 Functions | Black | Type C-C 3A PD Cable | Micro USB + iPhone | Convertor, 15W Wireless Charger, Card Reader, OTG, Phone Holder | Flash Light with 2 Nano Sim Holder",ULTRAPROLINK,"1,999",3.7,239,"Multiple Connectors : Multifunction Cable & Connector kit is the only accessory you will ever need to carry on for all your charging & connectivity needs. There is nothing more compact & versatile than Power Link+. Say goodbye to calling multiple cables. No more fumbling in your bag. Compatible with Type C, Micro USB, iPhone & USB-A – all Smartphones, Tablets & laptops covered. It’s the ultimate survival kit when paired with your powerbank.Power Delivery : Type C – Type C (PD2.0) / 3A cable capable of Power Delivery so it’s the perfect charging cable for your latest devices & compatible with iPad Pro 10.5-inch Pro, iPad Pro 12.9-inch (2nd generation), iPad Pro 12.9-inch (1st generation) iPhone 11/11 Pro/11 Pro Max/XS Max/XS/XR/X/8/8 Plus, Galaxy S10/S10+/S10E/Note 9/S9/S8/S8 Plus, Pixel 3XL 3 /2/Pixel 2 XL, Nexus 5X/6P, Lumia 950/950XL, Xiaomi Mi9, Nokia 8 and so many more USB-C devices with Power Delivery15W Wireless Charger : Power Link supports upto 15W (Wireless Charging Compatible LG Phones) of Wireless charging phonesand also the ones that need 5W, 7.5W (Wireless Charging Compatible iPhones) & 10W ( Wireless Charging Compatible Samsung Phones). Flip it over and use it as a flatbed charger or use it in the cradle mode. Just remember to power it with an 18W wall adaptor to use it optimally. Disclaimer : Wireless Charging Technology works at 75% efficiency as compared to cable via cables.Mobile Phone Cradle with Ambient Flashlight : It’s so convenient to just flip it into a stand so you can watch movies comfortably or simply charge your phone while you travel. Allows for hands-free viewing in landscape mode. Enjoy 0.5W of ambient light very helpful to brighten up your way in the darkness. Just power it up with your power bank & you are good to go.Card Reader with Data Transfer & Nano Sim Storage : Connect easily to OTG enabled phones and/or Laptops for two way data transfers at blazing speeds. It will support Micro SD ( TF) cards upto 256GB at transfer speeds of 480Mbits/s. Supports both Type A & USB Type C connectors. Includes storage slots for 2 nano sims & that elusive pin you need to open your sim tray.",Electronic_accesories
153,"Portronics Car Power 120 Car Laptop/Mobile Charger (Quick Charge + PD) with 3 Ports 120W Max Output Fast Charging Compatible with Most Cars, Type C Cable Included(Grey)",Portronics,"1,929",3.7,24,"[PORTABLE YET POWERFUL] - If you are a car accessories fan, then Car Power 120 is meant just for you and will change your outlook on car charging. You get all-in-one charging support to fast-charge your devices with a maximum power output of 120W.[MULTIPLE CHARGING PORTS] - Car Power 120 car charger comes with three charging ports - a USB-A port and 2 Type-C PD charging ports. Now charge multiple devices simultaneously while driving, making it easy to go on long journeys without worrying about your battery levels.[PD CHARGING WITH 100W POWER DELIVERY] - Now charge your laptops in the car itself with the 100W Type-C PD charging port of the Car Power 120. This gives you a better working and charging experience when you set out on long journeys and road trips.[FAST CHARGE SUPPORT] - Apart from the 100W PD charging slot, Car Power 120 comprises a 20W Type-C PD charging port and an 18W QC charging slot for fast charging of your devices. Just connect your mobile phones to this car charger and let the magic begin.[UNIVERSAL COMPATIBILITY] - Compatible with almost all the cars, Car Power 120 car charger is a must-have car accessory for all the driving enthusiaasts. Say goodbye to your ‘charging while driving’ issues with this heavy output car charger.[MINIMALISTIC DESIGN WITH DURABILITY] - Car Power 120 car charger comes with a minimalistic design to make it all the more desirable. Moreover, its zinc alloy manufacturing makes it durable for a long run.[WARRANTY] - 1-year manufacturer’s warranty",Electronic_accesories
154,Robustrion Smart Trifold Translucent Back Case Cover for Apple iPad 10.2 inch 9th Gen 2021 Cover 8th Gen 2020 7th Gen 2019 Generation - Black,Robustrion,499,4.3,153,"[Comptabillity]: This case is designed to fit the iPad 7th 8th 9th Generation 10.2 inch only.[Convenience]: Keeping Your Convenience In Mind, This Case by Robustrion For iPad 10.2 inch 7th 8th 9th Generation Is Designed To Give You The Best Utility & User Experience Possible.[Precise Cutouts]: Perfect Fit & Precise Cutouts Ensures Easy Access To All The Ports & Buttons On Your iPad 10.2 inch 7th 8th 9th Generation That You Rarely Need To Remove The Case.{High Quality]: Built With Highest Quality Material, This Robustrion Case Protects Your iPad 10.2 inch 7th 8th 9th Generation Against Scratches, Bumps & Accidental Drops Keeping Your Precious Device Safe & Sound.[Sleek Design & Classy Look]: This Case For iPad 10.2 inch 7th 8th 9th Generation Is Crafted With Elegance That Surely Will Be An Add-On To Your Style While On The Go.",Electronic_accesories
155,"Microware VGA to HDMI with Audio Adapter for Connecting Traditional VGA Interface Laptop, PC to HDMI Monitor or Projector,1080P VGA Male to HDMI Female Converter with 3.5mm Audio Lead and Power Supply Port",MICROWARE,549,3.6,98,"➤【Only From VGA to HDMI Displays】Imported super quality adapting chipset, converting and outputting VGA signal to HDMI display devices. This converter is NOT bi-directional, it is vga to hdmi adapter, ONLY convert VGA signal into HDMI signal, and USB power supply is necessary (USB cable is included).➤【Powerful Performance】The VGA male to HDMI female converter support VGA input resolution from 800*600 to 1920*1080 for PC. Support HDMI Output resolution up 720P/1080i/1080P for HDTV/Projector/Monitor.➤【Plug and Play】No driver needed, easy to use, fast, convenient and compact. Aluminum alloy case and gold-plated HDMI interface, high wear & corrosion resistance, stable and durable for HD data transmission.➤【3.5mm Audio Output】The clear sound can be output by earphones or by the audio cable which connects to a 3.5mm audio port of this adapter. 0.6m AUX cable makes it super convenient to transfer the audio.➤【Universal Compatibility】Work with PC, laptop, TV,TV-Box and other VGA output devices. HDMI port can be connected to projectors, HDTV, monitors/Displayer and other device with HDMI port. Compatible with Win 7, Win 8, win10 operation system.",Electronic_accesories
156,"Sounce iPhone Charger and Headphones Adapter iPhone Splitter, MFi iPhone Charger and Aux Adapter Earphone Audio Dual Lightning Charging Dongle for iPhone 13 12 11 Pro Max 7 8 SE X XS",,299,3.3,941,"2 IN 1 AUX HEADPHONE ADAPTER + CHARGING ADAPTER- It has 2 Port, one port is for Charging, another is an audio port. Charging and Listening to music at the same time.Simply, lightweight, durable and very portable and perfect solution for all Phone users.This product is one of the best choices for giving gifts to friends!HIGH QUALITY: 100% copper wire core provides you with high-speed and stable signal transmission. High quality Aluminum alloy oxidation shell is more wear-resisting and corrosion resistance, enhancing the anti-interference ability,High grade material with quality surface treatment,perfect match all phone earphone,High fidelity on the music,bring you new experiences.AUDIO QUALITY: The Audio + Charge supports up to 24bit 48kHz lossless output, and is compatible with the full ecosystem of Audio headphonesVOICE QUALITY - Made of high quality materials to ensure charging speed. Durable metal shell design to enhancing the anti-interference ability. Digital Audio Input Port Designed for Phone 8/7/6/5, Small Impedance, High Sensitivity, Can Accurate to Receive Audio Data.WARRANTY - 12-months warranty and friendly customer services, ensures the long-time enjoyment of your purchase.",Electronic_accesories
