,title,brand,price,rating,reviewCount,description,categories
352,URBN 10000 mAh Li-Polymer Ultra Compact Power Bank | 12W Fast Charge | Dual USB Output | Type C | Micro Input | Pocket Size (Camo),URBN,999,3.9,"36,910","Proudly Made In IndiaIt will charge a 3000mAh phone battery up to 2.4 times & It will charge a 4000mAh phone battery up to 1.8 timesDual USB Output 2.4 Amp 5V Fast ChargeUltra Compact body along with smooth touch finish gives the Power Bank its premium look, weighs only 181 grams.1 Type-C USB Cable, 1 User Manual, 1 Warranty Card, Charger Not included",Electronic_accesories
353,"ZEBRONICS Zeb-Buds C2 in Ear Type C Wired Earphones with Mic, Braided 1.2 Metre Cable, Metallic Design, 10mm Drivers, in Line Mic & Volume Controller (Red)",ZEBRONICS,399,3.4,"3,835","Type C Earphone with Mic;1.2 Metre Braided CableMetallic Design, Sturdy Built, Call function and control for volume/media;Comfortable Fit10mm Drivers;Extra Eartips; In Line Mic and Volume ControllerCompatible with Phone, Tablet, Audio Devices with Type C Input PortWarranty Description: 6 Months Carry Into Service Centre; Size Name: 65x185x195",Electronic_accesories
354,"BROLAVIYA Overhead Video Tabletop Stand Phone Holder, Metal Long Lazy Arm and Bracket for All Mobiles Phone, for Streaming ,Overhead Video,Desktop,Bedroom, Office, Black",BROLAVIYA,896,4.3,"2,855","Multipurpose use: Product design is made in way you can watch Netflix/Prime while lying in bed or sofa or chair with hand free. You can make live stream, online lesson, YouTube videos, cooking video, videography, photography, vlogging, video shooting and find your own hidden innovation talent.Overhead Mobile stand :Brolaviya Stand is Perfect for watching movies & enjoying music in the bedroom, cooking in the kitchen, exercising in the gym and working in the office.Adjustable stand: Compatible with all smart phones screen. Product length is 29.5 inch in total.Quality over Quantity: Brolaviya stand is made of high- quality solid Iron metal makes product sturdy enough to hold mobile firmly.After sale service: The thoughtful and detailed design of the phone holder is a good gift for your family or friends. In addition, we provide you after-sale service, please feel free to contact us when necessary.",Electronic_accesories
355,Fur Jaden Anti Theft Backpack 15.6 Inch Laptop Bag with USB Charging Port,,799,4.0,"10,692","KEY FEATURES - Black Colour Backpack for Men and Women for Stylish Office use as well as for Trendy College students. Huge compartment size that can fit upto a 15.6 inch Laptop with ease. Multiple pockets for other accessories.Charging On the Go - Now charge your phone on the go while travelling without the hassle of holding the bulky power bank in your pocket or in your hand. Simple Connect your Powerbank to the wire inside the Bag and leave it in the bag. When you want to charge your phone, just connect your phone charger to the bag and your phone will start charging. Note: We do not provide Power Bank with this Bag.Anti Theft Design - This backpack by Fur Jaden has anti theft design where zipper of the main pocket is hidden at the back. No thief, intruder or robber can find a way to open the backpack, making this totally theft proof. There are secret pockets on the shoulder strap and on the backside of the bag allowing us to keep travel documents, boarding pass, credit cards, mobile phone, earphones etc.Durable and Sturdy - Made from durable quality polymer fabric, this Fur Jaden backpack is sturdy and reliable. Flaunt this bag with style and enjoy life with this low maintenance bag which is also washable. This backpack is also suitable for school or college.Warranty - 1 Year Manufacturer Warranty Against Manufacturing Defects",Electronic_accesories
356,"ZEBRONICS K24 USB Keyboard with Long Life 8 Million Keystrokes, Silent & Comfortable Use, Slim Design, Retractable Stand, 1.5 Meter Textured Cable, Chiclet Keys and Uv Coated Keycaps",ZEBRONICS,349,3.6,227,Standard keyboard layout with 104 Keys and UV coated keycaps (full size).Proven durability with 8 million keystrokes for lifelong usage.The keyboard supports the Rupee key in the layout.1.5 meter textured cable length and quality USB connector for usage with computer and laptop.Silent performance and comfortable usage with the retractable stand option.Simply plug the USB and start using the ZEB-K24 keyboard with your computer / laptop.The keyboard has a sleek and slim design. It has comfortable chiclet style keys which are easy to type on.,Electronic_accesories
357,Cosmic Byte ARES Wireless Controller for PC (Black),,"1,799",4.1,"1,627",Ergonomic Design and Rubbersied Textured Sticks for enhanced GripPressure Sensitive Analog Triggers and LED Backlit Buttons. Supports Xinput and D InputVibration Feature and Zero Lag connection using dongle8-10 meters wireless range for Ares Wireless.700mAh Battery for 12hrs of continuous gaming,Electronic_accesories
358,"Oneplus 10R Type c to 3.5mm Audio Jack, 1-Plus Audio Jack Adapter, car Audio Connector USB Type c, Headphone Converter Cable Stereo Jack Splitter Compatible for Oneplus 9 9r 8 8t 7 7pro 7t 6t nord",DUETMI,189,4.2,77,"NOTE- Compatible only with OnePlus , IQOO, VIVO, OPPO, REALME, POCO,Features 3.5mm female to type-c male: End to end is a inche long. Convert your 3.5mm headset to type-c headset with this adapterAlso supports 3.5mm AUX in the car.Built with the same grade materials as premium headphone brands, Features premium digital audio conversion chip delivering a premium audio/sound output.Gently insert your headphone/earphone pin completely into the 3.5 mm jackKeep your 3.5mm Headphone: You can still keep your 3.5mm Headphone with your new Smartphone with only type c port. USB C Audio Adapter creates stable connection with your headphone and USB C Port",Electronic_accesories
359,"LIRAMARK Webcam Cover Slide, Ultra Thin Laptop Camera Cover Slide Blocker for Computer MacBook Pro iMac PC Tablet (Pack of 3)",LIRAMARK,149,4.3,"11,086","Cool Gadget: Protection against possible video surveillance from hackers. This webcam cover slide easily slides over your camera ensuring that it won’t be used as a surveillance tool against you.Ultra-thin: Super thin design, perfect curve edges, and extra mini size, which means it can be perfectly combine with your devices. Webcam Cover is only 0.027 inches thick and does not feel its existence when the laptop lid is closedUniversal Design: Webcam Cover is compatible with most Laptop Computer, Smartphones, iPad,iphone, MacBook, MacBook Pro, Tablets PC, PS4 and all-in-one desktops. Many pieces package, meet your all cameras needSuper Sturdy Adhesive: Solid durable, because the strong Nano gel provides durable and reliable connection between your devices and webcam cover. Also, the adhesive can be easily applied and removed from the device without any tracesEasy to Install: Use a dry cloth to clean the surface of your device's webcam, then remove the 3-M adhesive tape from the back of the camera cover Slide, align the lens and attach the protective cover to the lens, and firmly press for 15 seconds to achieve a strong, but non-permanent seal.",Electronic_accesories
360,Ferilinso [6-in-1 for Apple iPhone 14 & 13 Screen Protector Guard Accessories 3 Pack 9H Tempered Glass 3 Pack HD Camera Lens Protector Cover Protection Case Friendly mounting Frame,Ferilinso,"1,062",4.5,"3,375","❤️Cost-effective All-round Protection: Committed to providing one-stop purchase experience, no need spend more on other accessories. The Ferilinso 6-in-1 bundle includes: [3ⅩGlass Screen Protector for iPhone 14 & iPhone 13] [3ⅩCamera Protector for iPhone 14 & iPhone 13] [1Ⅹfull set of installation tools, Includes mounting frame and cleaning kit]Military-grade shatterproof: Glass by Ferilinso is glass adopts the same glass that is generally used in military and government areas, High quality materials combined with German-engineered technology, with extraordinary strength. (Awarded SGS Certification) Its hardness is much higher than other products on the market. Your screen is certified to survive even 10Ft drop to hard ground. What a remarkable achievement!Reinforced edge & Original touch: Heat treatment technology enhances the toughness of each edge, Provides edge-to-edge invisible protection for the entire iPhone 14 & iPhone 13 screen with no adverse effects. Maintains the classic look of your beloved Phone while providing full and lasting protection. Hydrophobic coating on top effectively reduces fingerprints and smudges by 98%, so your fingertips enjoy a smooth feel with every swipe.Camera Protector & Case-Friendly: Ferilinso camera protector made of 9H glass effectively protect entire lens from drops, scratches, other accidents and not easy to fall off. Special designed Black circle compatible night shooting function, brings you the original of beauty to every photo and video. This camera and screen protector designed to be compatible with most cases. Extra slight space around the bezel allows your case to wrap around the edge of your device without any interference.Face ID Compatible and Easy To Install: Precisely cut for the iPhone 14 & iPhone 13 6.1 inch, this tempered glass does not interfere with the Face ID feature. Comes with precision installation frame and complete cleaning kit, made the install very easy. We are committed to providing good service to every customer, whatever problems, You can send us information through Amazon's Message Center, we will provide you with satisfactory service within 24 hours.",Electronic_accesories
361,"PROAIM SnapRig DSLR Camera Cage Rig with Top & Side Handles | Height-Adjustable with 15mm Rod Support Aluminum Made | Cold Shoe, Tripod & Accessory Mounting Options (UC-01)",Proaim,"8,400",No reviews,,"PROAIM SnapRig DSLR Camera Cage not only protects your camera but also offers better mobility, comfy handheld use, Tripod, and accessories mounting flexibilityIt is a height-adjustable cage; comes with two interchangeable side support rods of different heights that let you adjust the cage's height to best fit your cameraIt mounts directly to tripods with a 1/4′′-20 or 3/8"" -16 threaded mount & has multiple universal connections for mounting additional accessoriesSophisticated & High-Grade CNC aluminum body to ensure long-lasting durability & stability.100% CustomerSatisfaction Guarantee; Buy with confidence",Electronic_accesories
362,VTS S2 Speedlite S-Type Bracket Bowens Mount Flashes & Accessories,,"1,299",3.5,13,"[Stronger adaptability]S2 Bracket is update version of S type bracket, fit more speedlites and flashes, such as V1 round Head speedlite,V860II series, T685 series, TT350 series, and outdoor flashes AD series like AD400Pro, AD200Pro[Better quality and protection]No-slip surface, mounts with light pressure, Will not scratch your equipment[More Angle]S2 bracket can tilt stepless, suitable for different angles of lighting. It can be hold in hand or install on a light stand.[More Compact and Portable]S2 bracket has less size and is more compact and portable than the original S type bracketMade of Impact Resistant ABS Plastic, Precise Stepless Tilt Control, Large Adjustment Handle, Integrated Umbrella MountFLASH/LIGHT NOT INCLUDED.",Electronic_accesories
363,"CRYSTALOPRO Surface Pro Charger 65W, Microsoft Surface Pro Laptop Charger, Compatible for Surface Pro 7/6/5/4/3/X, Surface Book, Surface Go/3/2/1 PowerSupply Charger",CRYSTALO PRO,"2,500",3.9,15,"1.Replacement for 24W/ 36W/ 44W / 65W power charger. With Additional USB Port, Wall Plug and 6ft Power Cord2.This power adapter match for Microsoft Surface Go(2018), Surface Pro 6(2018 Latest release), Surface Pro 5(2017), Surface Pro 4(2015), Surface Pro 3(2014), Surface Pro (2014~2018), Surface Laptop 2(2018 Latest release), Surface Laptop, Surface Book and Surface Book 23.Input:100-240V 1.6A 50/60 Hz; Output:15V-4A 65W; USB port (USB 2.0,5V-1A)4.Safe: Automatic thermal, overload cut-off, and short circuit protection; 5.65W surface pro charger with Lengthen Power CordPower Source Type: Corded Electric",Electronic_accesories
364,Adofys 3 in 1 Bullet Time Handle with Foldable Tripod Extension Monpod Rod for Insta 360 One X 2 / Insta360 One X Accessories,ADOFYS,"2,869",3.9,143,"⭐ The handle and selfie are forInsta360 One x / Insta360 One/ Insta 360 one x 2 and one R series , and designed for bullet time shooting; Stick is invisible in photos and videos.⭐ Super lightweight convenient to carry around, thanks to the hidden retractable design,11 inches You can put it in pockets or other small bags. Whenver you want to record a beautiful moment, it always be there. It's only 46 inches for extension max.⭐ The 360 degrees rotation handle Stick are both sturdy, and easy to extend, Bullet time handle thread anti-smashing grip has a texture. Rotate stick to left to lock,and rotate stick to right to loosen.Handle bar is slippery-proof; There is standard 1/4"" screw at the bottom of handle.⭐ What's more, you will be using it as a desktop phone holder, doing live internet broadcast, binge-watching TV shows, etc. With a very flexible adjustable view height, the nape ache, shoulder pain will be substantially reduced.You can use it for a close self-photography or extend it to get a larger scenery.⭐ Material: Aluminum alloy + ABS, aerospace aluminum alloy material opens a new era of self-timer.⭐ As Handle or Tripod: The handle can be mounted on the selfie stick and you can make yourself a complete set accessories for bullet time camera. It can also be used as tripod, working tripod height is about 14.2cm / 5.59in",Electronic_accesories
365,ADISA 15.6 inch Laptop Backpack Office Bag College Travel Back Pack 32 Ltrs (z-Navy Blue),,499,3.8,516,Material: Water Resistant Light-Weight PolyesterCompartments: 2 with padding; Laptop Size: 15.6 inch and belowDimensions: LxWxH - 12.5 x 7.5 x 19 inchesReflector Logo / Adjustable Padded Shoulder Straps / 2 Bottle holdersClosure Type: Zipper,Electronic_accesories
366,"Zebronics Zeb-Pluto 2.0 Multimedia Speaker with Aux Connectivity,USB Powered and Volume Control",ZEBRONICS,349,4.0,"1,455",Zeb-Pluto is a USB powered 2.0 speaker that comes in a compact size with volume control;It has Aux Connectivity and it is USB PoweredOutput power 5W RMS (2.5W x 2);Impedance 3ΩFrequency response 120Hz-15kHz;Line input 3.5mm jack1 Year warranty-from the date of purchase; Country of Origin: ChinaColor Name: Black,Electronic_accesories
367,"Tukzer Gizga 2-in-1 Professional Screen Cleaning Kit (500ML) for Camera, Lens, Binocular, Laptop, TV, Monitor, Smartphone, Tablet (Includes: Cleaning Liquid 500ml, Plush Microfiber Cloth)",,569,4.6,168,"YOUR SCREEN’S NEW BESTFRIEND! - Tukzer is proud to present a screen cleaner spray that’s perfectly suited for your TV screen cleaner, computer screen cleaner laptop, iPad, Macbook, tv cleaner or any electronic device. Our screen cleaner along with the included plush microfiber cloth, easily removes dust, fingerprints & other smudges on the screen’s surface. And unlike other screen cleaners, ours effectively removes static electricity as wellGENTLE & SAFE ON ANY ELECTRONIC SCREEN - Our screen cleaner is formulated to be used even for the most sensitive types of LCD, LED, CRT, and OLED screens. Be at ease knowing that this product is tested as safe on all the major brands: iPad, iPhone, Android screens, Kindle, PC monitors - we’ve got you covered! for lcd screen cleaner, tv cleaner for smart tv and more!! Works on matte, glossy, glass, plastic and other smooth surfaces.PREMIUM SUPER SOFT PLUSH MICROFIBER CLOTH - Included in this efficient screen cleaning kit is our signature plush microfiber cloth specially designed for a better screen cleaning experience. Notice in every use that it effectively absorbs stubborn stains; leaves zero discoloration, zero streaks, and no fiber shedding. Always use this together with our screen cleaner for best results.EASY-TO-USE SCREEN CLEANER KIT + MICROFIBER CLEANING CLOTH. Keep screens away from dust, smudging, fingerprints and other imperfections so that you can focus on the content. Simply screw on the sprayer gun on the screen cleaner bottle. Spray the cleaning liquid onto the microfiber cloth then wipe the screen until desired cleanliness & shine is achieved.Quality Screen Care Kit Worth Purchasing - Enjoy a convenient Screen Cleaner anytime, anywhere you need it. Your satisfaction is our top priority. We stand behind the quality of our products and that’s why, you shouldn’t be worrying at all. We manufacture the Best Screen Cleaner. And can be used for laptop cleaning kit, laptop screen cleaner, tv screen cleaner for smart tv. MacBook screen cleaner, monitor cleaner or screen cleaner spray for electronic devices with microfiber cleaning cloth.",Electronic_accesories
368,"HUMBLE Dynamic Lapel Collar Mic Voice Recording Filter Microphone for Singing Youtube SmartPhones, Black",HUMBLE,199,3.3,"3,043","SOUND RECORDING: With the Miracle Sound Microphone you can finally create the perfect videos and audio files on your smartphone and tablet. Pristine sound without .effort, no matter where you are.SIMPLE OPERATION: Precise Design and Convenient Carrying.EASY TO USE: Clip-on design, easy to clip it to your shirt, collar or placed in small pockets.CONNECTOR: The 3.5mm type jack can be connected to PC / Laptop / wireless microphone transmitter with 3.5mm line-in / mic in.USE FOR: Youtube, Interview, Recording, Podcasting, Conference call. Now you can instantly reproduce your voice, no additional plugs or batteries needed.",Electronic_accesories
369,"SWAPKART 5-in-1 Cleaning Soft Brush Keyboard Cleaner, Multi-Function Computer Tools Kit Corner Gap Duster Key-Cap Puller for Bluetooth Earphones, Laptop Air-pods & Pro Camera Lens (Random Colour)",,149,4.7,670,"UPGRADE 5 IN 1 CLEANING TOOLS: Multifunction keyboard cleaning brush including a large nylon brush, a flocking sponge, a high-density brush and a metal pen tip. It is more convenient for you to clean the dust and stubborn stains with one compact tool.DEEP CLEANING: The 5 in 1 soft brush keyboard cleaning kit is great ideal for cleaning uneven surfaces, edges, crevices or small holes. The metal pen tip cleans the hole or edges of the earphones. The high-density brush cleans the mobile phone or headphone speaker. The flocking sponge cleans the inner of the wireless charger case. The large nylon brush cleans the keyboard, laptop, computer monitor edge etc.WIDE APPLICATION: Suitable for cleaning the Bluetooth wireless earbuds, Airpods, the keyboard, wireless earbuds charge case, mobile phone, camera lens, watch, laptop, computer etc.PORTABLE & LIGHTWEIGHT: With a detachable design, the nylon brush and handle can be disassembled. With a total weight of only 1.23 oz and a handle length of only 4.25'', the cleaning kit can easily be put in a bag and carried around like a pen.LIFETIME WORRY-FREE WARRANTY: MMF 5 in 1 multifunction keyboard and earphones cleaning kit is made of premium material and 100% full inspection shipment. We will provide a LIFETIME RETURN service for you. Please don't hesitate to contact us if you have any issues with the product, we will try our best to assist you to solve them to ensure you get a great shopping experience.",Electronic_accesories
370,"AmazonBasics 20W Phone Charger | Type C Adapter, Fast Charging (White)",AmazonBasics,429,3.6,36,"20W Type C adapter capable of fast chargingPolycarbonate body prevents charger overheating, and provides short-circuit and over-voltage protection.Lightweight and easy to carryCompatible with Android, iPhones, headphones, tablets, and moreInput: 100-240 V~ 50/60 Hz 0.6 AOutput: 5 V 3 A, 9 V 2.22 A, 12 V 1.67 A, 20 W (Max)Product dimension : 62 x 42.3 x 27.5 mm Product weight: 52.18 gm",Electronic_accesories
371,"TheGiftKart Shockproof Crystal Clear Back Cover Case for Nothing Phone 1 | 360 Degree Protection | Protective Design | PC, TPU | Transparent Back Cover Case for Nothing Phone 1 (PC, TPU | Transparent Bumper)",TheGiftKart,275,4.2,956,Compatible with Nothing Phone 1 OnlyCrystal Clear Non Yellowing Transparent BackShock Proof & Protective Case360 Degree Protection DesignSleek and Lightweight Profile,Electronic_accesories
372,"Marklif Premium Metal Folding Portable Laptop Stand Non-Slip Base Bracket, Tabletop Risers for 10-17 Inch Laptop & Keyboard & Tablet (Pack of 2)",Marklif,299,4.7,157,"Quality Material laptop stand (PACK OF 2)- The Laptop stand designed with a zinc alloy shield is small in size and strong in load-bearing. The upgraded rubber pad is used in contact with the desktop, which can effectively protect your office equipment and play a non-slip efAdhesive foldable laptop stand - This Laptop foldable stand weight is 24g. Never an extra burden to you, ideal for carry, home, school, office and business travel.Ergonomic Design computer keyboard stand - The keyboard stand can raise your notebook to get the most comfortable viewing position and operating angle, its ergonomic design makes for easy watching and typing, effectively relieve your neck and shoulder pain of continuous typing.Efficient heat dissipation - laptop cooling pad sticking position can be adjusted, and the lifting range is 15°-25°. Just choose the most suitable angle as you want. The middle space can efficiently dissipate heat and protect your laptop all the time.Suitable for most portable computers - This mini keyboard riser maximum load is 10KG, suitable for 12-20 inch laptop.",Electronic_accesories
373,One Plus USB Type C to 3.5mm Adapter for OnePlus 7T 8T 9 Pro Headphone Jack Adapter - USB Type C to 3.5mm Aux Audio Earphone (White & Red) (3.5mm Audio Jack),GO SHOPS,249,4.2,168,"【DIirect USB-C to 3.5mm Headphone Jack】: Premium solution to bring the 3.5MM headphone jack back to your new USB-C phone; Inside DAC chipset enable crystal clear stereo output and phone calls with your 3.5MM headphones/earbuds and AUX cable;【Multi-function Dongle】: This compact usb-c to aux adapter enable you to listen musics and answer phone call with your headphone and support wire control function as well.【Hi-Fi Sound Quality】:This c to aux adapter is compatible with up to 24bit/96Khz while others are 16bit/48Khz, you can get higher fidelity sound from it.【Relief Strain Design】:With the relief strain design, this adapter can stand 40000+ bending tests, which makes this adpter much more durable.OnePlus Type-C to 3.5mm Adapter (White)",Electronic_accesories
374,"Boult Audio Probass Curve Bluetooth Wireless in Ear Earphones with Mic with Ipx5 Water Resistant, 12H Battery Life & Extra Bass (Blue)",Boult Audio,799,3.8,"104,234","Long Battery Life - Curve is a powerhouse,Offers playback time of up to 12-15 hours for every charge. Takes 1-1.5 to get fully charged and it has 1-2 days of standby. Bluetooth Version v5.0.Note : If the size of the earbud tips does not match the size of your ear canals or the headset is not worn properly in your ears, you may not obtain the correct sound qualities or call performance. Change the earbud tips to ones that fit more snugly in your earsOff-Axis magnetic technology - Oval-shaped earbud with nozzle angled at 60 degree tunnels the sound directly into the ear canal, also providing noise isolation.Inline ControlDurable Flexi-band- The light yet sturdy, neck band can drape comfortably across the neck with supreme comfort and in-line controls.Noise Isolating Aerospace Grade AL Drivers - Curve comes with Built-in micro-woofers that produce a deep bass, isolating noise in any environment.IPX5 water resistant- earbuds and charging case inner Nano-coating makes it possible to waterproof for 1 meters deep for 30 minutes.Ideal for sweating it out at the gym. Even Wash the earbuds and baseDesigned with latest Bluetooth 5.0, the wireless earbuds own fast and stable transmission without tangling. Improved high quality mic for both earbuds bring a better call performanceSafety Precautions - Please keep this device away from extreme heat, humidity or corrosive environment, Please don't over-charge the neckband as it will decrease the service life of battery, Please use only a good quality phone charger (5V/1A)",Electronic_accesories
375,SUNMI Bike Phone Mount Anti Shake and Stable Cradle Clamp with 360° Rotation Bicycle Phone Mount/Bike Accessories/Bike Phone Holder -Black,SUNMI,249,3.4,"7,831","SHOCKPROOF PROTECTION: This Adjustable Bike Phone Mount Comes With foam Pads That Keep Your Phone From Scratches And Vibration. The Motorcycle Phone Mount Holds Your Phone Perfectly When Cycling.STURDY AND SAFE: A Special Shape Of This Motorcycle Phone Holder Grips Each Corner Of Your Phone Tightly. It Ensures The Safety Of Your Cell Phone Attached To The Bike Handlebar Even On A Bumpy Road.EASILY ROTATABLE & ADJUSTABLE: 360 degree rotating support holder, can provide you the best viewing angle, and hold your phone vertically or sideways firmly and securely, Simply adjust and have your phone to any angle and position that suits your preference and enjoy the comfort of your cycling on the bike.EASY INSTALLATION: This Bike Phone Mount Is Easy To Install Without Tool. The Silicone Pads Make Your Phone Fit Better With Handlebar, Can Add Or Remove The Silicone Pad According To The Diameter Of Handlebar. Suit Well With Various Types Of Bicycles, Motorcycles, Stroller, Shopping Cart, Electric Scooter, Indoor Treadmill, Spin Bike.UNIVERSAL HIGH COMPATIBILITY: Stretchable rubber belt makes SUNMI bike phone mount 100% fit any smartphones with 4"" ~ 7"" screens. Handlebar Diameter: 0.6 - 1.18"" (15-30mm).",Electronic_accesories
