,title,brand,price,rating,reviewCount,description,categories
0,Women's Beechwood Modal Bikini Briefs | Pure Soft Breathable Briefs | Lingerie for Women,Tailor & Circus,399,4.9,19,"Care Instructions: Machine WashFit Type: RegularHigh-quality Fabric - The bikini brief womens underwear is comfortable, silky, smooth, soft, reduces sports friction and dries quickly after washing. The natural cotton lining is breathable and comfortable, protecting women's private parts and allowing the skin to breathe freely day and night, offering a comfy stretch for your perfect fitComfort You Deserve - We master in providing the best innerwear for women, the ultra-soft waistband moves with you without pinching or binding. The no ride up briefs fit is designed with a low waist and full-seat coverage, with leg bands that stay in place, are must haves for women. Bikini Briefs are no pilling, no fading, no shrinking and no skin irritation. Our sexy underwear is an ingenious combination of comfort and sexy for ladies.Bikini Cut, Beyond Fit - True to size, no issues with sliding around or wedgies while wearing with jeans or leggings, also suitable for panties pads. With full back coverage & double layer crotch, this lady's bikini briefs underwear will provide you with more support and confidence. The lightweight, cool, comfort moisture-wicking fabric keeps you cool and dry all day.An Ideal Choice - Our bikini underwear for women are made from modal fabric which is made from beechwood tree fibers. It's an eco-conscious alternative to synthetic rayon. Plus, it's more breathable & makes it a perfect lingerie for women with comfort and durability. The soft elasticized waistband feels great and stays smooth without chafing, digging, or pinching.Easy Wash Care - Womens underwear is entirely machine washable, for easy, stress-free care. Zero impact soft layered waistband. Throw them right in the washing machine on laundry day. It is a total comfort at the leg openings. The modal material used holds its shape that helps it last long.",Women-lingerie-wear
1,Lacy Copper Lingerie Set,CUKOO,699,No reviews,,"Care Instructions: Hand Wash OnlyFit Type: RelaxedFabric : NylonColor : CopperClosure : Back ClosureWash Care : Nylon and Elastane, Hand Wash only, Do not IronBottom & Upper Type : Hipsters & Lacy Bra",Women-lingerie-wear
2,Women's Cotton Non-Padded Wire Free Sports Bra,kamison INTERNATIONAL LINGERIE,699,4.0,"1,096","Care Instructions: Hand Wash OnlyNo-Back Hook Design - Specially designed for low impact exercises or first timers.18+ Hours Comfort - Bra cups are non-padded, making the Bra light and breathable.Seamless Look- Cup is made of a single fabric, free from stitches or seams, making your bra cups invisible under your clothes.Fully adjustable strapsÂ - Adjust the detachable straps according to your comfort.28 = 70 cm : 30 = 75 cm : 32 = 80 cm : 34 = 85 cm : 36=90 cm : 38 = 95 cm : 40 = 100 cm : 42 = 105 cm",Women-lingerie-wear
3,Women's Cotton Panty for Women Pack of 3 ( Prints May Vary),kamison INTERNATIONAL LINGERIE,539,3.8,6,Care Instructions: Hand Wash OnlyMade from Superior 100% Combed Cotton Soft Absorbent fabricHelp you stay fresh throughout the dayCoverage : Full back Coverage; Colour : 3 New Prints every timeSmall = 80 cm : M = 85 cm : L = 90 cm : XL = 95 cm : XXL =100 cm : 3XL =105 cm : 4XL =110 cm; Age Range Description: AdultPattern Type: All Over Print,Women-lingerie-wear
4,Women's Polyester Activewear Padded Wirefree Sports Bra & Sports Tights Set,Clovia,"1,159",4.1,6,"Care Instructions: Hand Wash OnlyFit Type: SlimProduct Type: Tights & Bra SetFabric: Polyester,SpandexPattern: Geometric PrintTop Type: Padded BraBottom Type: Sports Tights.",Women-lingerie-wear
5,Sports Bra for Women's Full Coverage for Daily Workout Gym Wear Seamless Combo of 3 Free Size,IPP,399,3.4,37,"Care Instructions: Hand Wash OnlyMaterial : Soft Cotton Fabric, Pack of 3 (Size 40)The adjustable straps are wide and stretchy. Very nice for running, yoga, jogging, biking, boxing, dance or gym,Perfect for Sports, Yoga, Dance and Sleeping Brasolid full-coverage sport brasÂ they moves easily and comfortably.Adjustable, elastic and wide straps make you more comfortable.It is very comfortable to Touch and Wear. Designed to make a women look more young and ravishing. and TYPE: Sports Bra with supportSports Bra for Women's Full Coverage For Daily Workout Gym Wear Seamless Combo of 3 (Size 40)Free Size",Women-lingerie-wear
6,Ladies Cotton Gloria Camisoles Short Length White Style 1901 (Pack of 5),DORA,480,3.8,8,"Care Instructions: Hand Wash OnlyShort length camisole, slips Fits above naval. from Shoulder to above navalBest suited to be worn under short westerns and short kurtisMade from 100% Ultra combed cotton lasts really long. Feel Fresh through out the daylite and Super soft fabric made from high quality long staple cotton absorbs sweatNormal wash, do not bleach, dry in shade",Women-lingerie-wear
7,Women's Cotton Broad Elastic Hipsters (Pack of 3)(Multicolored),green beauty,269,New to Amazon,,"Care Instructions: Dry Clean OnlyFit Type: RegularHigh class stretch cotton to ensure the comfort, breathability and durability. The soft material makes feel safe to wear a lingerie, especially the crotch is made of 100% best cotton.Works well with dresses and high waisted jeans, sarees, shorts, under yoga pants.Broad elastic pure cotton panty.Pattern Name: All Over Print; Pattern Type: All Over Print; Size Name: Xl; Age Range Description: Adult",Women-lingerie-wear
8,Women's Microfiber Modern Hipster Panties,Jockey,399,4.5,13,"Care Instructions: Machine WashFit Type: ModernStyle Number - 1814Soft touch microfiber nylon elastane stretch fabricGenuine Jockey comfort, fit and qualityModern fitFull back coverageDelicate lace for added feminityLabel free for all day comfortNormal Wash At 40c,Do not dry clean,Do not bleach,Do not iron,Line dry in shade",Women-lingerie-wear
9,Women's Cotton Polyester Padded Wire Free T Shirt Bra,Komli,219,3.5,30,"Care Instructions: Hand Wash OnlyFit Type: relaxedKomli Heavily Padded bra can be used for everyday wear under t-shirts and tops to kurtis and shirts.The seamless cups provide for a smooth finish with no shows on your outfit and the brushed back hook & eye provides for extra comfort.Padded and Wired Full Coverage Adjustable Straps Bra is Ideal for Everyday wear.Wash care : Hand wash without fabric conditioner , line dry , do not iron, wash dark colours separately.",Women-lingerie-wear
10,Women's & Girls' Cotton Non Padded Non-Wired T-Shirt Bra Everyday Use Comfortable (Pack of 6),DeVry,299,No reviews,,"Care Instructions: Machine WashCare Instructions: Hand wash only, line dry, do not dry clean, do not ironClosure: Back closure; Straps: RegularFabric: CottonEffortlessly soft cotton bra, thatâ€™s designed for long hoursType - Non Padded Seamless Bra.Describe -- Full Comfortable Bra for Women",Women-lingerie-wear
11,Pink Full Coverage Bra - Pack of 1 (UltraKross),College Girl,375,5.0,2,Care Instructions: Machine WashFit Type: regularColor : PinkFabric : HosierySeamed BraNon Padded BraPack of 1,Women-lingerie-wear
12,Women's Cotton Non Padded Non-Wired Regular Bra (Super Shaper Shape Up - Black_Black_32),DAISY DEE,365,4.2,12,Care Instructions: Dry Clean OnlyWide straps for easing the pressure on shoulders and preventing slip off.Wide band elastic under the bust offers superior lift and firmness.Perfect silhouette shaping and projection.Fabric with dry Technology to wick away sweat from the body.Signature Moisture Transport System wicks sweat to keep you dry and light.,Women-lingerie-wear
13,Women's Cotton Padded Non-Wired Sports Bra (Pack of 2),Ritu-Creation,699,3.5,43,"Care Instructions: Hand wash, drip dry in shade, do not iron, do not bleachMaterial : Cotton,Nylon,Spandex. Knitted wide support band eliminates the need for underwiresRemovable pads-The inside of the cup has a small opening that contains a removable pad. Removable pads are easy to put in & take out.Size: Size M/L fits Best upto bust size 34 inchesThis Air bra is as light as air and it targets all the trouble areas women want to fix especially embarrassing back fat and shapeless cups.This Seamless Air Bra has especially been designed to give you the required support and comfort, freeing you from the endless pain of slipping straps, painful hooks and bulging edges",Women-lingerie-wear
14,Lingerie Set for Womens and Girls Bikini Lingerie Set - 06083,AAYAN BABY,479,New to Amazon,,"Care Instructions: Hand Wash OnlyðŸ‘™ Soft and smooth 100% Cotton Fabric Breathable and Comfortable.; Modern fit, sits just below the waistðŸ‘™ Soft & smooth inner waistband leaves no marks on youðŸ‘™ StayFresh treatment with antimicrobial properties to help you stay fresh throughout the dayðŸ‘™ A Make in India Product, 100% DISCREET PACKAGING, We Value Your Privacy.",Women-lingerie-wear
15,Cotton Blend Womens Intimate Wear Bikini Panties,Enamor,499,4.0,10,"Care Instructions: Machine WashFit Type: ClassicDisclaimer-Assorted Pack-Color And Print May Vary From the image Shown. | Bikini style panties for women sits approximately 2 inches below navel button. This bikini panty gives high level of comfort and complete freedom of movement. We recommend these panties for maximum comfort for daily wear. Ideal for pairing with low waist jeans and low waist shorts.Rear Coverage panty: Provides excellent full coverage for all day comfort. The low-waist design ensures a minimal show at waist and is perfect to pair with low waist outerwear.Leg Opening of panties: Low cut sits comfortably at the crease of your legFlatter seams for low show through outerwear.; Fabric of panties: 95% modal 5% spandex,Panty Crotch - Crotch - 100% cotton with Antimicrobial finish which prevents odour causing bacteria & Stain Release finish which helps wash off stains easilyMachine wash Warm Gentle cycle with Like colors. | Do not Bleach. | Tumble dry. | Medium Iron. | Do not dry clean.Age Range Description: Adult; Pattern Name: Solid; Size Name: Xl; Bottom Style: Hipster; Pattern Type: Solid",Women-lingerie-wear
16,Women Winter Thermal Round Neck Half Sleeve Top (505WCT Pack of 2),Warmzone,"1,339",2.8,2,"Care Instructions: Machine WashFit Type: Regular FitFit Type : Tailored Fit , Material Composition : 50% Cotton, 25% Viscose, 25% PolysterFabric Details : Made from rich brushed Interlock fabric and it will keep you warm and cozy all day longNeck Type : Round Neck::Sleeve Type : Half SleeveThis thermal embraces your body in a perfect fit and shields you from the chilly weatherFabric Care : Gentle wash in lukewarm water, do not bleach::Package : 2 Pc Top",Women-lingerie-wear
17,Girls Cotton Printed Panties Multicolor Pack of 5 85 cm,Neoteric,359,2.9,2,"Care Instructions: Machine WashFit Type: RegularMachine washable. Durable high quality fabric will wash beautifully.Lightweight and comfortable design makes these boyshort panties perfect for workouts or anytime.Modern fit, sits just below the waistModern fit, sits just below the waistCircular knit fabrication for a completely seamless look.Stay fresh with High Waist full coverage every day wear panties.Super combed cotton Regular wear elastane stretch fabricWomens Cotton Multicolour Boyshort Panties Printed Pack Of 5 95 CM",Women-lingerie-wear
18,Women's Round Smart Skin Cups Bra Pads Inserts (White brown and Black Free Size) -Combo Pack of 6 Pieces :,NiKKaMma,234,3.3,45,"Care Instructions: Machine WashAn Ideal For Working Women Wear /Collage Going Girls/ Under Any Tight Outfit / Formal Wear EtcInsert Into Your Any Loving Bra To Soften And Diminish The Look Of The Apex / Nipple . They Help To Conceal Under Tops And Casual And Formal Dresses.Flexible Enough To Fit Under Different Types Of Bras, Sports Bras, Shape Wear Pieces And Swimsuits Can Be Worn As An Additional Layer Between You And The Bra For Added Softness Against Your Skin.These Smart Cup Bra Inserts Add A Thin Layer Of Modesty Without Adding Volume To your BosomProduct colours may slightly vary due to photographic lighting sources or monitor settings",Women-lingerie-wear
19,Women's Non-Wired Bra,RIZA,999,3.3,23,Care Instructions: Machine WashFirst time ever a single bra for all impact exercisesFast dry technology Fabric - Sweat Free workoutAdvance Straps Design for - Less bounce Effect5 x 4 Hook & Eye Closer with Cushioning effect for comfertable WorkoutAdjustable grip eliminates for Different Impact Exercise,Women-lingerie-wear
20,Kamison Non Padded Seamless T-Shirt Bra | Double Layer Fabric no| No Bra Lines | Fully Adjustable Strap (Pack of 2),kamison INTERNATIONAL LINGERIE,699,3.7,134,Care Instructions: Hand Wash OnlyProduct : Non Padded T-Shirt BraFabric - COTTON BLEND FABRICCoverage : B C D CUP SEAMLESS Wirefree.DOUBLE LAYER FOR EXTRA COMFORTThere might be minor color variation between actual product and image shown on screen due to lighting on the photography,Women-lingerie-wear
21,"Kamison Everyday Lightly Padded Polyamide Cotton T-Shirt Bra for Women - Padded, Wireless, 3/4th Coverage (Pack of 2)",kamison INTERNATIONAL LINGERIE,799,New to Amazon,,"Care Instructions: Hand Wash OnlyProduct : Light Padded Seamless bra, crafted with soft stretch microfiber fabricHow It Feels : Our signature Breathable T-shirt Bra is high on technology, comfort and functionality. Super-soft for everyday comfort, it feels like a gentle warm hug!.Wear It Under : Everyday Western and Indianwear outfits for a seamless look.Full Coverage: The Full Coverage adds a functional layer to the bra while keeping you at ease.There might be minor color variation between actual product and image shown on screen due to lighting on the photography",Women-lingerie-wear
22,Fashion Love Lingerie Set for Women-Green,Ailory,349,No reviews,,"Care Instructions: Machine WashFit Type: WesternSoft elastic and straps, Back closure with hook and eye, Adjustable strapsHipster panty, Fullcoverage, seamed, Non-wired and non-padded bra panty setThis collection will be a trendy addition to your innerwear & swimwear wardrobeWestern Innerwear & swimwear with Soft Lining, Stylish Lingerie Set, Comfortable Fashionable Trendy",Women-lingerie-wear
23,Bra & Panty Set Floral Printed Lingerie Set,VERMILION,325,No reviews,,Care Instructions: Machine WashFit Type: RegularHigh Quality Nylon elastane straps with metal sliders.High Quality Cotton sourced from the best parts of the country. Fashionable colours.Panty is Hipster in shape and provides full coverage.Made from High Quality Cotton Rich fabric,Women-lingerie-wear
24,Premium Women Cotton Athleisure Sports Bra and Tights for Sports Activewear Tights for Yoga Gym & Workout Wear Outfit,Wearslim,749,3.2,26,"Care Instructions: Hand Wash OnlyFit Type: Performance2 PIECES WORKOUT OUTFITS FOR WOMEN: Presenting the V-shaped pattern on a sports bra and contouring ruched detail on leggings, which design shows your perfect curves and feel comfortable with seamless construction. Yoga outfits for women 2 piece sports bra pants set to meet all your requirement for workouts.MAXIMUM COMFORT: Seamless construction minimizes chafing. Cotton soft blend, stretchy, comfortable fabric moves with you. Women workout set clothes to provide high support with seam-free construction. Moreover, the workout set is breathable and good at moisture absorbing and sweat releasing, fast drying.ELITE PERFORMANCE: Advanced quick-dry, breathable, moisture-wicking technology material keeps you dry and cool throughout your practice. Sports bra and leggings set for women great for medium impact or high impact intense workout, feel free to be fully in the moment of activities like exercise, running, yoga gym house sports, fitness classes, and athletic training.U-BACK DESIGN BRA: Wire-free, vest style, padded sports bra. Breathable fabric keeps you comfortable during your workout. Our gym outfits have ribbed textured non-slip designs that can keep them in place when you move.SQUAT PROOF & NON SEE THROUGH LEGGINGS: Tummy control high rise elastic waistband for superior support, Squat proof, and non-see-through. High-waisted leggings lie flat keeps you feeling covered and secure. Slim-fit, helping to show off your body curves perfectly with tummy control and butt lift.",Women-lingerie-wear
25,Women's Fitted Vest,Jockey,319,3.0,2,Care Instructions: Machine WashSuper combed Cotton Elastane stretch fabricDouble layered front panelDurable and concealed underbandBody fit with optional cross back stylingLabel free for all day comfort,Women-lingerie-wear
26,"Cotton Hipster Panties for Womens Combo, Multi Coloured - (Pack of 3)",FUNAHME,217,3.8,51,"Care Instructions: machine and hand washFit Type: RegularCare Instructions: Machine Wash / Hand wash; Hipster Panty for women combo pack of 3Regular Fit Star printed Panties, Panty for womenHigh waist Panty , soft nylon elastic for more comfort, soft cotton fabric & full coverage pattern.This Style Is Ideal For Wearing With Casual & Formal Out Fits. Panty for women; Size Name: Xl; Age Range Description: AdultStyle Name: Hipsters; Pattern Name: Geometric",Women-lingerie-wear
27,Sheer Mesh Crop Top Without Bra,MIRABI,449,New to Amazon,,"Care Instructions: Machine WashFit Type: Slim FitComposition:94% Polyamide, 6% ElastaneStyle:Sexy Pattern Type:Plain Neckline:Round NeckSleeve Length:Short Sleeve Details:Sheer Sleeve Type:Regular Sleeve",Women-lingerie-wear
28,Women Cotton Bridal Minimizer Bra Size (32 Till 48) Pack of 2,ELEG & STILANCE,499,No reviews,,"Care Instructions: Hand Wash OnlyFit Type: regularSuper combed cotton elastane stretch fabricStyle : Full CoveragePattern-SolidCare Instructions: Machine washUltra soft fabric ensures no marksIdeal for travelling, camping, fitness,Machine wash cold gentle cycle without fabric conditioner",Women-lingerie-wear
29,Women's Winter Thermal Sleeveless/Spaghetti Thermal Top and Bottom Thermal Set,Blush n Bloom,639,4.3,4,"Care Instructions: Hand Wash OnlyFit Type: SnugThin women thermal base layer with round and low neckline design is perfect subcoating for sweater and jeans.Suitable for yoga, gym, skiing, outdoor work, travel, camping, golfing, mountain climbing and motor cycling.Size = S-32 inch || M-34 inch || L-36 inch || XL-38 inch || XXL-40inch || XXXL - 42 inch || 4XL - 44 inchPackage contains : 1 PC of Sleeveless women thermal top.And bottom/pajma",Women-lingerie-wear
30,"Women's Pure Cotton Baby Pink Inner Slip, Size:- M/L/XL/XXL",SNAPFAB,399,3.1,7,"Care Instructions: Machine WashFit Type: Regular FitCare Instructions: Machine Wash, Do Not Bleach, Dry In Shade, Medium To Hot Iron.Fabric : Cotton | Can be worn as Innerwear, Loungewear or Casual wear.Kurta Length: Knee-Long | Knee-length coordinates the length of your most loved Salwar Suit, Designed the slip to go invisible under the fabricStyle: Straight | Pattern: SolidThis is comfortable to wear all day long and easy to maintain.",Women-lingerie-wear
31,Women Full Coverage Bra,Clovia,299,4.3,9,Care Instructions: Hand Wash OnlyFit Type: Regular FitFabric: CottonPattern: SolidPadding: Non Padded,Women-lingerie-wear
32,Marks and Spencer Women's Underwear Briefs (T61_2051X_Navy Mix_10 M),Marks & Spencer,449,No reviews,,"Care Instructions: Machine WashBriefs43% polyester, 42% polyamide and 15% elastane (exclusive of trimmings)Better Cotton InitiativeM&S is proud to invest in making cotton production more sustainable. Better Cotton is sourced through a system of Mass Balance.",Women-lingerie-wear
33,Vanish Seamless Hipster Seamless Panty,Amante,545,4.2,76,"Care Instructions: Hand Wash OnlyHipster style, crafted with soft microfiber fabric for all day comfort;High-rise, that sits on the natural waistlineProvides moderate back coverage;Flocking application on the edges to prevent any curlingSeamless style, for a no panty-line look;Ideal for body hugging outfitsFabric Composition: 75% Polyamide, 25% Elastane; Wash Care: Hand wash only. Do NOT tumble dryPattern Name: Solid; Age Range Description: Adult; Department Name: Women",Women-lingerie-wear
34,Women's Polycotton Padded Underwire Push Up Bra Blue,Brachy,295,4.0,18,Care Instructions: Hand Wash OnlyPattern: Net FlowerPadded under wired pushup braWith detachable transparent Strap which is available with the product.Size: 34BColour: Cream,Women-lingerie-wear
35,BS Traders Women's Silicone Strapless Backless Adhesive Stick On Invisible Lightly Padded Wire Free Bra for Girls (Beige),Generic,499,New to Amazon,,"Care Instructions: Hand Wash OnlyEver heard of a comfortable strapless bra that doesnâ€™t slip? You have now! The ultimate strapless bra not only stays in place but also has an underwire giving you the perfect support and enhancing your shape.Fabric: Soft, cotton,stretchable fabric for comfort round the clock. Cups : Perforated cups designed to let your skin breathe all dayWear it under: All everyday and occasion-wear outfits, especially under off-shoulder and tube stylesHow it feels : Our signature Breathable Strapless Bra is high on technology and functionality. Gives a held-in, snug fit feeling!Care Instructions: Wash Below 40 degrees Celsius, do not bleach, do not tumble dry, do not iron, do not dry clean, hand wash allowed, wash dark colours separately.Looking for comfort and a rash free experience? We understand. The soft brushed cups are here to help you solve that problem",Women-lingerie-wear
36,Women Briefs,Zivame,315,No reviews,,Care Instructions: Hand Wash OnlyFit Type: ClassicHigh rise panties sit above the belly buttonFull rear coverageNet Quantity: 2 N100% cotton gusset for comfort & hygieneFabric: Cotton Elastane Hand Wash Allowed Do Not Bleach Wash Below 40 C Wash Dark Colours Separately Do Not Tumble Dry,Women-lingerie-wear
37,TT GADWAL/KALYANI COTTON,Generic,"1,400",3.3,3,Care Instructions: Machine Wash,Women-lingerie-wear
38,Sensual Lady Women's Rhine Stone Transparent Bra Straps | Diamond Shoulder Straps | Free size | Color- Black/Silver/Gold,Generic,399,No reviews,,"Number Of Items-2 Pair (4 Straps)/ 3 Pair (6 Straps) | Color : Black/Silver/GoldDetachable Straps With Adjustable Transparent Strap Loop At The Back.Flaunt Your Straps In Style With These Stylish Rhine Stone Straps & Beautify Yourself | An Ideal For College Going Girls, Women's Stylish Formal Outfits. Add Glamour To Your Loving Bra, Just Attach These Straps & Flaunt.Ideal For Strapless Dresses, See Through Tops / Outfits .12 mm Silver Metal-Coated Bra Hooks Used With Silicone Adjustable Strap Of 10 mm | Material Type - Rhine Stone ,Silicone Straps",Women-lingerie-wear
39,Women's Bra Panty Set,PIBU,279,No reviews,,"Care Instructions: Hand Wash OnlyFit Type: RegularFashion Comfortz presents Printed Bras and Panties sets which is especially crafted soothing cotton elastane stretch fabric for all the romantic, stylish ladies and girls.Fashion Comfortz presents Printed Bras and Panties sets which is especially crafted soothing cotton elastane stretch fabric for all the romantic, stylish ladies and girls.Fashion Comfortz presents Printed Bras and Panties sets which is especially crafted soothing cotton elastane stretch fabric for all the romantic, stylish ladies and girls.Fashion Comfortz presents Printed Bras and Panties sets which is especially crafted soothing cotton elastane stretch fabric for all the romantic, stylish ladies and girls.Fashion Comfortz presents Printed Bras and Panties sets which is especially crafted soothing cotton elastane stretch fabric for all the romantic, stylish ladies and girls.",Women-lingerie-wear
40,Women Vest Top,Amazon Brand - Symbol,322,4.3,101,"Care Instructions: Machine WashFit Type: Slim Fit95% Cotton and 5% ElastaneSolid, Slim fitSleevelessRound NeckMachine washsingle jerseyMade with a premium quality cotton fabric with elastane for comfort stretch and a silken finish wash for a soft handfeel.Perfect for layering, this camisole features adjustable straps and spandex for a comfort fit.",Women-lingerie-wear
41,Womens Solid Padded Non Wired T-Shirt Bra,Amante,519,4.6,3,"Care Instructions: Hand Wash OnlySeamless T-shirt bra with moulded cups, for a smooth lookProvides full coverage to avoid top spillageMade of soft, self-embossed lace and microfiber fabricsFully adjustable straps for a custom fitFeatures detachable straps for multiple wearing optionsFabric Composition: 79% Polyamide, 21% ElastaneWash Care: Hand wash without fabric conditioner, line dry, do not iron, wash dark colours separately",Women-lingerie-wear
42,Fione Daily Bra,Fione Lingerie,299,4.8,15,"Care Instructions: Hand Wash OnlyCotton Tshirt bra features breathable smooth fabric,adjustable straps,keep you cool and comfortable.Hook and Eye closureSoft, 4-way stretch fabric provides smoothing across the backComfortFlex Fit stretches effortlessly to adapt to your shape rather than forcing you into a restrictive constructionHand Wash Recommend. Machine Wash with a laundry bags can prolong the lifespan of the bra",Women-lingerie-wear
